|autores|titulo|ano|group
1684|Ana Graziela Alvarez&SASSO, GRACE&IYENGAR, SRIRAM|mobil virtual learn object assess acut pain learn tool assess acut pain nurs analysi mental workload|2015|1684.0
1686|SILVA JUNIOR, LUNEQUE&Nadia Nedjah&Luiza de Macedo Mourelle|rout network chip topolog|2015|1686.0
1687|SÁ, ALAN OLIVEIRA DE&Nadia Nedjah&Luiza de Macedo Mourelle|backtrack search algorithm appli localis problem|2015|1687.0
1688|Rafael Carneiro Gurgel Fernandes&Julina Martins de Oliveira&Victor Hugo Costa de Albuquerque|new medic devic aid control temperatur liquid meal post surgeri patient|2015|1688.0
1690|NETO, EDSON CAVALCANTI&GOMES, SAMUEL LUZ&REBOUÇAS FILHO, PEDRO PEDROSA&Victor Hugo Costa de Albuquerque|vehicl identif embed plate recognit system|2015|1690.0
1691|Victor Hugo Costa de Albuquerque&Cleisson Vieira Barbosa&Cleiton Carvalho Silva&Elineudo Pinho de Moura&Pedro Pedrosa Rebouças Filho&João Paulo Papa&J M R S TAVARES|ultrason sensor signal optimum path forest classifi microstructur character thermal age inconel alloy|2015|1691.0
1692|F. S. Ribeiro Junior&Victor Hugo Costa de Albuquerque&Rafael Carneiro Gurgel Fernandes&João Manuel R. S. Tavares|biomed data manag process new framework|2015|1692.0
1694|MEDEIROS, HUGO REIS&BOCHIO, GABRIELA MENEZES&Milton Cezar Ribeiro&TOREZAN, JOSÉ MARCELO&DOS ANJOS, LUIZ|combin plant bird data increas accuraci index biotic integr assess conserv level forest fragment|2015|1694.0
1695|GALETTI, MAURO&CAMARGO, HILÉIA&SIQUEIRA, TADEU&KEUROGHLIAN, ALEXINE&DONATTI, CAMILA I.&JORGE, MARIA LUISA S. P.&PEDROSA, FELIPE&KANDA, CLAUDIA Z.&Milton Cezar Ribeiro|diet overlap forag activ feral pig nativ peccari|2015|1695.0
1696|DIAS, DAVI F. C.&Milton Cezar Ribeiro&FELBER, YAN T.&CINTRA, ANA L. P.&DE SOUZA, NATÁLIA S.&HASUI, ÉRICA|beauti age landscap factor influenc bird divers natur regener fragment regener age|2015|1696.0
1697|MENDES, CALEBE P.&Milton Cezar Ribeiro&GALETTI, MAURO|patch size shape edg distanc influenc seed predat palm speci atlant forest|2015|1697.0
1698|DA SILVA CARVALHO, C&Milton Cezar Ribeiro&CÔRTES, M C&GALETTI, M&COLLEVATTI, R G|factor influenc differ differenti divers palm|2015|1698.0
1699|MAGIOLI, M.&Milton Cezar Ribeiro&Katia Maria Paschoaletto Micchi de Barros Ferraz&RODRIGUES, M. G.|threshold relationship divers patch size mammal brazilian atlant forest|2015|1699.0
1700|DA SILVA, LUCAS GOULART&Milton Cezar Ribeiro&HASUI, ÉRICA&DA COSTA, CARLA APARECIDA&DA CUNHA, ROGÉRIO GRASSETTO TEIXEIRA|patch size function isol visibl matrix permeabl influenc neotrop primat occurr highli fragment landscap|2015|1700.0
1705|Vinicius Gonçalves Braga&Kleber Cardoso Vieira&Vagner José do Sacramento Rodrigues|understand model behavior web map user journal inform data manag|2015|1705.0
1708|SANCHES, DANILO SIPOLI&SILVA ROCHA, JOSIMAR DA&CASTOLDI, MARCELO FAVORETTO&Orides Morandin Junior&KATO, EDILSON REIS RODRIGUES|adapt genet algorithm product schedul manufactur system simultan use machin|2015|1708.0
1709|FIGUEIREDO, T.&MELO, U. S.&PESSOA, A. L. S.&NOBREGA, P. R.&Joao Paulo Fumio Whitaker Kitajima&CORREA, I.&ZATZ, M.&KOK, F.&SANTOS, S.|missens mutat segreg disabl famili|2015|1709.0
1713|FIGUEIREDO, T&KOK, F&SANTOS, S&MELO, U S&PESSOA, A L S&NOBREGA, P R&Joao Paulo Fumio Whitaker Kitajima&RUSCH, H&VAZ, F&LUCATO, L T&ZATZ, M|loss function mutat inositol caus disabl|2015|1713.0
1715|SILVA, DANIELA R.&Patricia Nogueira Hubler&PERRY, GABRIELA&SANTOS, MARLISE BOCK&CARNEIRO, MARA LÚCIA FERNANDES&DEL PINO, J. C.|learn object chemic transform|2015|1715.0
1716|Jucélio Costa de Araújo&MARIA, JOSÉ&GARCIA, LEONARDO|semant method recov medic articl|2015|1716.0
1717|Sylvester Arnab&Theodore Lim&Maíra Brandão Carvalho&Francesco Bellotti&Sara de Freitas&Sandy Louchart&Neil Suttie&Riccardo Berta|map learn game mechan game analysi|2015|1717.0
1718|Maíra Brandão Carvalho&BELLOTTI, FRANCESCO&BERTA, RICCARDO&DE GLORIA, ALESSANDRO&GAZZARATA, GIORGIA&HU, JUN&KICKMEIER-RUST, MICHAEL|case studi servic orient architectur game|2015|1718.0
1719|Maíra Brandão Carvalho&BELLOTTI, FRANCESCO&BERTA, RICCARDO&DE GLORIA, ALESSANDRO&SEDANO, CAROLINA ISLAS&Hauge, Jannicke Baalsrud&HU, JUN&RAUTERBERG, MATTHIAS|activ theori base model game analysi design|2015|1719.0
1721|Marianna Vaz Rodrigues&Agar Costa Alexandrino de Perez&Thaís Moron Machao&Fátima Maria Orisaka&Jacqueline Kazue Kurissio&Andrea Lafisca|research longa heat treat fillet mullet mugil platanu|2015|1721.0
1723|FEDERICI, ANTOINE&Henrique Sérgio Gutierrez da Costa&OGIEN, JONAS&ELLERBEE, AUDREY K.&DUBOIS, ARNAUD|field field coher microscopi resolut phase amplitud imag|2015|1723.0
1724|Iara Núbia Felix de Sousa&Gentil Veloso Barbosa&Francisca Maria da Silva Costa&José Itamar Mendes de Souza Junior|use inform commun technolog public school state teacher percept|2015|1724.0
1725|LOPES, ROBSON DA SILVA&MORAES, WALAS JHONY LOPES&Thiago de Souza Rodrigues&BARTHOLOMEU, DANIELLA CASTANHEIRA|genom repeat finder util fast parallel hash function|2015|1725.0
1730|Alexandro José Baldassin&Edson Borin&Guido Araujo|perform implic memori alloc memori system|2015|1730.0
1731|Edson Borin&DEVLOO, PHILIPPE R.B.&VIEIRA, GILVAN S.&SHAUER, NATHAN|acceler engin softwar processor|2015|1731.0
1732|Wanderson de Oliveira Leite&CAMPOS RUBIO, JUAN CARLOS&Jaime Gilberto Duduch&Paulo Eduardo Maciel de Almeida|correct deviat machin tool approach artifici neural network|2015|1732.0
1733|Fábio Daros de Freitas&FREITAS, CHRISTIAN DAROS&Alberto Ferreira De Souza|trade architectur|2015|1733.0
1734|FARIAS, ALINE CRISTINA MENDES DE&MEDEIROS, ALEXANDRE AUGUSTO SOUZA&José Josemar de Oliveira Júnior&ALVES, SALETE MARTINS|correl fuel lubric vibrat signal obtain ball disc analysi fourier transform|2015|1734.0
1735|Jose Ricardo de Almeida Torreao|equat motion gener solut dimension complex cell respons signal tune approach|2015|1735.0
1736|Lucas de Paula Veronese&Fernando Auat Cheein&Teodiano Bastos&Alberto Ferreira De Souza&Edilson de Aguiar|comput geometri approach local track gp deni environ|2015|1736.0
1737|Igor Machado Coelho&Pablo Luiz Araújo Munhoz&Luiz Satoru Ochi&Marcone Jamilson Freitas Souza&Cristiana Bentes&Ricardo Farias|integr cpu heurist inspir neighbourhood search vehicl rout problem deliveri pickup|2015|1737.0
1740|Marina Esther Groshaus&MONTERO, LEANDRO|bound number twin graph|2015|1740.0
1741|PADOIN, EDSON LUIZ&CASTRO, MÁRCIO&PILLA, LAÉRCIO LIMA&ALEXANDRE NAVAUX, PHILIPPE OLIVIER&BOITO, FRANCIELI Z.&Jean-Francois Paul Fernand Méhaut|perform energi trade comput case arm littl intel sandi bridg|2015|1741.0
1743|SOUZA, S. R. S.&Paulo Sérgio Lopes de Souza&BRITO, M. A. S.&SIMAO, A. S.&ZALUSKA, E. J.|evalu approach coverag criteria reachabl test program|2015|1743.0
1744|Luís Henrique Nunes&Marcos José Santana&Stephan Reiff-Marganiec&julio cezar estrella&Carlos Henrique Gomes Ferreira&Luís Hideo Nakamura&Rafael M. de O. Libardi&Edvard M. de Oliveira&Bruno Tardiole Kuehne&Paulo Sérgio Lopes de Souza&Regina Helena Carlucci Santana|dca servic distribut collabor architectur conduct experi servic orient system|2015|1744.0
1746|ALENCAR, GIZELTON PEREIRA&DA SILVA, ZILDA PEREIRA&SANTOS, PATRÍCIA CARLA&RASPANTINI, PRISCILA RIBEIRO&Bárbara Laisa Alves Moura&DE ALMEIDA, MARCIA FURQUIM&DO NASCIMENTO, FELIPE PARRA&RODRIGUES, LAURA C|impact intervent prevent mortal increas birth state sao brazil|2015|1746.0
1747|RASPANTINI, PRISCILA RIBEIRO&DA SILVA, ZILDA PEREIRA&ALENCAR, GIZELTON PEREIRA&Bárbara Laisa Alves Moura&DO NASCIMENTO, FELIPE PARRA&RODRIGUES, LAURA CUNHA&DOS SANTOS, PATRÍCIA CARLA&DE ALMEIDA, MARCIA FURQUIM|proport deliveri accord hospit fund sao metropolitan area brazil|2015|1747.0
1748|Fevzi Belli&Mutlu Beyazit&André Takeshi Endo&Aditya P Mathur&Adenilso da Silva Simão|fault domain base test situat approach case studi|2015|1748.0
1752|DE FREITAS, MARIA AGUIEIRAS A.&ROBBIANO, MARIA&Andréa Soares Bonifácio|improv upper bound energi graph matric|2015|1752.0
1753|Renata Maria Abrantes Baracho Porto&Rogério Amaral Bonatti&Francisco Ricardo Abrantes Couy Baracho&Christiano Pereira Pessanha&Marina Mourão Starling de Rezende&Claudio Homero Ferreira Silva|decis support electr gener model integr paramet indic|2015|1753.0
1754|Marcelo Franco Porto&José Ricardo Queiroz Franco&Renata Maria Abrantes Baracho Porto&Polyana Chamas Falcão&Nilson Tadeu Ramos Nunes|automat analysi standard rail project|2015|1754.0
1755|Fuad Gattaz Sobrinho|valu busi engin innov approach|2015|1755.0
1756|Fuad Gattaz Sobrinho&Caio Marcio Gonçalves&André Munhoz de Argollo Ferrão&Cristiane Chaves Gattaz|need engin process model|2015|1756.0
1758|Cristiane Chaves Gattaz&joão amato neto&Fuad Gattaz Sobrinho|complex network specif languag|2015|1758.0
1759|OLIVEIRA, EDIMAR J.&OLIVEIRA, LEONARDO W.&PEREIRA, J.L.R.&Leonardo de Mello Honório&SILVA, IVO C.&MARCATO, A.L.M.|power flow base safeti barrier point method|2015|1759.0
1760|POUBEL, RAPHAEL PAULO BRAGA&DE OLIVEIRA, EDIMAR JOSÉ&Leonardo de Mello Honório&DE OLIVEIRA, LEONARDO WILLER&DA SILVA JUNIOR, IVO CHAVES|model multistag transmiss expans plan|2015|1760.0
1761|OLIVEIRA, EDIMAR J.&Leonardo de Mello Honório&ANZAI, ALEXANDRE H.&OLIVEIRA, LEONARDO W.&COSTA, EXUPERRY B.|droop compens tune load frequenc control hydro power system|2015|1761.0
1762|HAYES, MICHAEL A&Miriam Akemi Manabe Capretz|detect framework sensor data|2015|1762.0
1763|BROWN, KEVIN&HAYES, MICHAEL&ALLISON, DAVID&Miriam Akemi Manabe Capretz&SAZIO, MARGARET&MANN, RUPINDER|fine grain filter provid access control data provid servic environ|2015|1763.0
1764|BRESCIA, MARÍLIA D?ELBOUX GUIMARÃES&MASSAROLLO, PAULO CELSO BOSCO&Ernesto Sasaki Imakuma&MIES, SÉRGIO|prospect random trial compar hepat venou outflow renal function convent versu piggyback liver transplant|2015|1764.0
1765|COIMBRA, D. B.&MARTINS, R. M.&NEVES, T. T.&Alex C. Telea&Fernando Vieira Paulovich|explain dimension reduct plot|2015|1765.0
1766|AGOSTINHO, NILZAIR B.&MACHADO, KARINA S.&Adriano Velasque Werhli|infer network converg improv sampler|2015|1766.0
1767|Mauro Medeiros Barbat&Nilo Cesar Dutra&Diana Francisca Adamatti&Adriano Velasque Werhli|teach plant game|2015|1767.0
1769|Rodrigo Costa Mateus&Thiago Luís Lopes Siqueira&Valéria Cesário Times&Ricardo Rodrigues Ciferri&DE AGUIAR CIFERRI, CRISTINA DUTRA|data warehous come cloud design perform|2015|1769.0
1773|CESAR NARDI, JULIO&DE ALMEIDA FALBO, RICARDO&João Paulo Andrade Almeida&Guizzardi, Giancarlo&PIRES, LUÍS FERREIRA&VAN SINDEREN, MARTEN J.&GUARINO, NICOLA&FONSECA, CLAUDENIR MORAIS|commit base refer ontolog servic|2015|1773.0
1775|AZEVEDO, CARLOS L.B.&IACOB, MARIA-EUGENIA&João Paulo Andrade Almeida&VAN SINDEREN, MARTEN&PIRES, LUÍS FERREIRA&Guizzardi, Giancarlo|model resourc capabl enterpris architectur found ontolog base propos|2015|1775.0
1777|Marcelo Laser&Elder Macedo Rodrigues&Anderson R. P. Domingues&Flávio M de Oliveira&Avelino Francisco Zorzo|research note architectur evolut softwar product line|2015|1777.0
1778|MACEDO RODRIGUES, ELDER&MOREIRA DE OLIVEIRA, FLÁVIO&TEODORO COSTA, LEANDRO&BERNARDINO, MAICON&Avelino Francisco Zorzo&DO ROCIO SENGER SOUZA, SIMONE&SAAD, RODRIGO|comparison model base captur replay approach perform test|2015|1778.0
1779|Rafael Weingartner&Gabriel Beim Bräscher&Carlos Becker Westphall|cloud resourc manag survey forecast profil model|2015|1779.0
1780|GAY NETO, ALFREDO&MARTINS, CLÓVIS A.&Eduardo Ribeiro Malta&TANAKA, RAFAEL L.&GODINHO, CARLOS|simplifi finit element model studi dri collaps straight curv flexibl pipe|2015|1780.0
1781|GAY NETO, ALFREDO&Eduardo Ribeiro Malta&DE MATTOS PIMENTA, PAULO|riser slide roll seab induc movement|2015|1781.0
1782|CAFEO, BRUNO B.P.&Elder José Reioli Cirilo&GARCIA, ALESSANDRO&DANTAS, FRANCISCO&LEE, JAEJOON|featur depend chang propag exploratori studi softwar product line|2015|1782.0
1783|MIREYA SILVA, GREIS F.&Alberto Barbosa Raposo&SUPLINO, MARYSE|explor collabor pattern game encourag social interact collabor user autism spectrum disord|2015|1783.0
1785|TAKAHASHI, H.&SHIOKAWA, K.&WRASSE, C.M.&OTSUKA, Y.&IVO, A.&Vitor Conrado Faria Gomes&PAULINO, I.&MEDEIROS, A.F.&DENARDINI, C.M.&Nilson Sant'Anna|bubbl monitor tec map nm imag|2015|1785.0
1786|Norton Trevisan Roman&Paul Piwek&Ariadne Maria Brito Rizzoni Carvalho&Alexandre Rossi Alvares|sentiment behaviour annot corpu dialogu summari|2015|1786.0
1790|Wesley Nunes Gonçalves&Machado, Bruno Brandoli&Bruno, Odemir Martinez|network approach textur recognit|2015|1790.0
1791|RIBAS, LUCAS CORREIA&GONÇALVES, DIOGO NUNES&ORUÊ, JONATAN PATRICK MARGARIDO&Wesley Nunes Gonçalves|dimens respons filter appli textur analysi|2015|1791.0
1792|Felipe Francisco Bezerra Araújo&COSTA, ALYSSON M.&MIRALLES, CRISTÓBAL|balanc assembl line worker|2015|1792.0
1794|Mauricio de Alvarenga Mudadu&CARVALHO, VIVIANE&LECLERCQ, SOPHIE YVETTE|nonclass secret protein possibl antigen vaccin develop revers approach|2015|1794.0
1795|CHUD, TATIANE C. S.&MARCONDES, CINTIA R.&REGITANO, LUCIANA C. A.&MUNARI, DANÍSIO P.&VENTURA, RICARDO V.&SCHENKEL, FLAVIO S.&CARVALHEIRO, ROBERTO&BUZANSKAS, MARCOS E.&ROSA, JAQUELINE O.&Mauricio de Alvarenga Mudadu&DA SILVA, MARCOS VINICIUS G. B.&MOKRY, FABIANA B.|strategi genotyp imput beef cattl|2015|1795.0
1796|TIZIOTO, POLYANA C&CHAVES, AMÁLIA S&LANNA, DANTE PD&ZERLOTINI-NETO, ADHEMAR&Mauricio de Alvarenga Mudadu&TAYLOR, JEREMY F&REGITANO, LUCIANA CA&COUTINHO, LUIZ L&DECKER, JARED E&SCHNABEL, ROBERT D&ROSA, KAMILA O&OLIVEIRA, PRISCILA SN&SOUZA, MARCELA M&MOURÃO, GERSON B&TULLIO, RYMER R|liver gene express differ steer feed intak phenotyp|2015|1796.0
1798|Ieso Costa MARQUES&Eliane Moreira Sá de Souza&Eliseu Eliseu Vieira Machado Junior|strateg map manag model focus de competit broiler chicken chain case studi micro region|2015|1798.0
1800|Daniel Lima Ventura&Fairouz Kamareddine&Mauricio Ayala-Rincón|substitut calculi de indic intersect type system|2015|1800.0
1801|Cristiano Maciel da Silva&André L. L. de Aquino&Wagner Meira Jr|deploy roadsid unit base partial mobil inform|2015|1801.0
1803|Cristiano Maciel da Silva&André L. L. de Aquino&Wagner Meira Jr|smart traffic light low traffic condit|2015|1803.0
1804|Mamane Souley Ibrahim&Nelson Maculan Filho&Michel Minoux|inequ lift procedur path problem digraph cycl|2015|1804.0
1806|GONZALEZ, ERNESTO DRS.&SARKIS, JOSEPH&HUISINGH, DONALD&HUATUCO, LUISA H.&Nelson Maculan Filho&MONTOYA, JAIRO&DE ALMEIDA, CECILIA M.V.B.|make progress societi decis support model tool introduct volum|2015|1806.0
1808|RAUPP, FERNANDA M.P.&ANGELI, KATHARINE DE&ALZAMORA, GUINA G.S.&Nelson Maculan Filho|optim model product system remanufactur|2015|1808.0
1809|José André de Moura Brito&Pedro Luis do Nascimento Silva&Gustavo Silva Semaan&Nelson Maculan Filho|integ program formul appli alloc stratifi sampl|2015|1809.0
1810|Leanderson André&Rafael Stubs Parpinelli|multipl knapsack problem approach binari differenti evolut algorithm adapt paramet|2015|1810.0
1811|Cristiano Amaral Maffort&VALENTE, MARCO TULIO&TERRA, RICARDO&BIGONHA, MARIZA&ANQUETIL, NICOLAS&HORA, ANDRÉ|mine violat version histori|2015|1811.0
1812|MARTIN, PAUL&Lucas Francisco Wanner&SRIVASTAVA, MANI|runtim optim system util variabl hardwar|2015|1812.0
1815|SILVA, V P&SILVA, D S&Davidson Rodrigo Boccardo&MACHADO, R C S&CARMO, L F R C|data acquisit inspect system|2015|1815.0
1817|Ricci, Alessandro&Agha, Gul&Rafael Heitor Bordini&MARRON, ASSAF|issu program base actor agent control|2015|1817.0
1819|FUKUNAGA, DANILO COSTA&Roberto Avelino Cecílio&Sidney Sara Zanetti&OLIVEIRA, LAÍS THOMAZINI&Marco Aurélio Costa Caiado|applic swat model watersh brazil|2015|1819.0
1821|Sidney Sara Zanetti&Roberto Avelino Cecílio&Estevão Giacomin Alves&Vitor Heringer Silva&Elias Fernandes de Sousa|estim moistur content soil colour imag network|2015|1821.0
1822|Sidney Sara Zanetti&Roberto Avelino Cecílio&Vitor Heringer Silva&Estevão Giacomin Alves|calibr tdr assess moistur soil network|2015|1822.0
1823|Douglas Alexandre Gomes Vieira&Lucas Sirimarco Moreira Guedes&Adriano Chaves Lisboa&Rodney Rezende Saldanha|formul energi product optim condit|2015|1823.0
1824|Lucas Sirimarco Moreira Guedes&Douglas Alexandre Gomes Vieira&Adriano Chaves Lisboa&Rodney Rezende Saldanha|model cascad hydro power gener mainten schedul|2015|1824.0
1825|Alex Sander de Moura&Rodney Rezende Saldanha&Elson José da Silva&Adriano Chaves Lisboa&Werley Gomes Facco|approxim invers hodg matrix sparsiti pattern|2015|1825.0
1826|Ana Cristina O. Siqueira&Sandra Regina Holanda Mariano&Joysi Moraes|trust entrepreneurship insight relationship bank brazil|2015|1826.0
1827|Moraes, Joysi&Sandra Regina Holanda Mariano&Rafael Cuba Mancebo&Alessandra Bellas Romariz de Macedo|quadripolar epistem proposit entrepreneurship construct|2015|1827.0
1828|PEREIRA, MOISÉS H. R.&DE SOUZA, CELSO L.&PÁDUA, FLÁVIO L. C.&SILVA, GIANI D.&Guilherme Tavares de Assis&PEREIRA, ADRIANO C. M.|inform system support analysi inform retriev televis program|2015|1828.0
1830|Moussa Reda Mansour&Alberto, L. F. C.&Rodrigo Ramos|prevent control design voltag stabil consid multipl critic conting|2015|1830.0
1832|Vitor Chaves de Oliveira&Inácio Yano&Mauricio Becker&Andreiwid Sheffer Corrêa|appli hybrid poll approach softwar implement extend lifetim wireless sensor network|2015|1832.0
1835|Antonio Elias Fabris&DO NASCIMENTO, MARCELO ZANCHETTA&BATISTA, VALÉRIO RAMOS|softwar tool base surfac evolv locat tumour procedur mastectomi|2015|1835.0
1836|Antonio Elias Fabris&BATISTA, VALÉRIO RAMOS|improv region fill techniqu|2015|1836.0
1837|AMADIO, G&DUHEM, L&ELVIRA, D&GHEATA, A&JUN, S Y&LIMA, G&NOVAK, M&PRESBYTERIAN, M&SHADURA, O&SEGHAL, R&WENZEL, S&APOSTOLAKIS, J&BANDIERAMONTE, M&Calebe de Paula Bianchini&BITZES, G&BRUN, R&CANAL, P&CARMINATI, F&LICHT, J DE FINE|experi vector physic model detector simul|2015|1837.0
1839|BESSA, JÉSSYCA ALMEIDA&CORTEZ, PAULO CÉSAR&DA SILVA FÉLIX, JOHN HEBERT&Ajalmar Rêgo da Rocha Neto&DE ALEXANDRIA, AUZUIR RIPARDO|snake comparison segment method imag|2015|1839.0
1840|SILVA, DANILO AVILAR&SILVA, JULIANA PEIXOTO&Ajalmar Rêgo da Rocha Neto|novel approach evolutionari comput spars squar support vector machin|2015|1840.0
1841|GAMELAS SOUSA, RICARDO&Ajalmar Rêgo da Rocha Neto&Cardoso, Jaime S.&BARRETO, GUILHERME A.|classif reject option self organ map|2015|1841.0
1842|OLIVEIRA, SAULO A.F.&Ajalmar Rêgo da Rocha Neto&BEZERRA, FRANCISCO N.|novel genet algorithm surf base approach imag|2015|1842.0
1843|ALMEIDA BESSA, JESSYCA&ALMEIDA BARROSO, DARLAN&Ajalmar Rêgo da Rocha Neto&RIPARDO DE ALEXANDRIA, AUZUIR|locat robot artifici neural network imag|2015|1843.0
1844|DI NOLA, ANTONIO&Ciro Russo|semir approach mv algebra survey|2015|1844.0
1846|Waldir Aranha Moreira Junior&MENDES, PAULO|impact behavior forward|2015|1846.0
1847|Waldir Aranha Moreira Junior&MENDES, PAULO|data share enabl citizen sens system|2015|1847.0
1848|ALVES, ADRIANA G.&Ana Elisa Ferreira Schmidt&CARTHCAT, KARLA D.P.&HOSTINS, REGINA C.L.|explor technolog innov inclus educ build digit game interdisciplinari challeng|2015|1848.0
1849|Almeida, A. P. S. S.&TRBOVICH, P.&PINKNEY, S.&José Alberto Ferreira Filho&Egon Luiz Müller Júnior&Rodrigo Maximiano Antunes de Almeida&CUSTODIO, R. A. R.&MELLO, C. H. P.|establish human factor usabl center medic devic brazil|2015|1849.0
1852|CARVALHO, FABRÍCIO B.S. DE&LOPES, WASLON T.A.&ALENCAR, MARCELO S.&José Valentim dos Santos Filho|vehicular network overview|2015|1852.0
1853|Paulo Henrique de Souza Bermejo&Adriano Olímpio Tonelli&Andre Luiz Zambalde&Todesco, José Leomar|understand inform technolog strategi develop base knowledg manag|2015|1853.0
1854|Dalton de Sousa&Ricardo Braga Veroneze&Andre Luiz Zambalde&Paulo Henrique de Souza Bermejo|relat market innov univers|2015|1854.0
1855|Antonio Claret dos Santos&Andre Luiz Zambalde&Ricardo Braga Veroneze&Giancarla Aparecida Botelho&Paulo Henrique de Souza Bermejo|open innov social particip case studi public secur brazil|2015|1855.0
1856|Paulo Oliveira Lima Júnior&Luiz Gonzaga de Castro Junior&Andre Luiz Zambalde|analysi machin learn techniqu classifi news inform manag coffe market|2015|1856.0
1857|MÌRIAN OLIVEIRA&Carla Maria Marques Curado&Antonio Carlos Gastaud Maçada&Felipe Nodari|scale measur knowledg share behavior differ|2015|1857.0
1858|CURADO, CARLA&OLIVEIRA, MÍRIAN&MAÇADA, ANTONIO CARLOS GASTAUD&Felipe Nodari|team innov get knowledg share capac|2015|1858.0
1860|Janine Kniess&Orlando Loques&Célio Vinicius Neves de Albuquerque|servic discoveri time constraint ad hoc network|2015|1860.0
1866|DE O. RODRIGUES, CLEYTON MÁRIO&DE AZEVEDO, RYAN RIBEIRO&DE FREITAS, FREDERICO LUIZ GONÇALVES&Eunice Palmeira da Silva&DA SILVA BARROS, PATRÍCIA VIEIRA|approach simul action code|2015|1866.0
1870|FIRMINO, PAULO RENATO A.&Paulo Salgado Gomes de Mattos Neto&Ferreira, Tiago A.E.|error model approach improv time seri forecast|2015|1870.0
1871|Paulo Salgado Gomes de Mattos Neto&CAVALCANTI, GEORGE D. C.&Madeiro, Francisco&FERREIRA, TIAGO A. E.|approach improv perform pm forecast|2015|1871.0
1872|PENA, RODRIGO FO&SHIMOURA, RENAN O&Antonio Carlos Roque da Silva Filho|multi model properti intern gener activ|2015|1872.0
1873|SHIMOURA, RENAN O&PENA, RODRIGO FO&Antonio Carlos Roque da Silva Filho|effect plastic connect activ network model|2015|1873.0
1875|DE CARVALHO JUNIOR, OSVALDO ADILSON&Sarita Mazzini Bruschi&Regina Helena Carlucci Santana&Marcos José Santana|green cloud meta schedul|2015|1875.0
1877|Eduardo de Paula Kirinus&MARQUES, WILIAM CORREA&JUNG, BÁRBARA MICHELLY&STRINGARI, CAIO EADI&MATZENAUER, HELENA BARRETO|evalu current power avail energi convers southern brazilian shelf|2015|1877.0
1878|Eduardo de Paula Kirinus&MARQUES, WILIAM CORREA|viabil applic power gener shelf|2015|1878.0
1879|Ivan Mezzomo&Benjamín René Callejas Bedregal&Regivan Hugo Nunes Santiago|type ideal lattic|2015|1879.0
1880|Liliane Silva&MOURA, RONILDO P. A.&Anne Magaly de Paula Canuto&Regivan Hugo Nunes Santiago&Benjamín René Callejas Bedregal|interv base framework fuzzi cluster applic|2015|1880.0
1881|Dimuro, G.P.&Benjamín René Callejas Bedregal|implic deriv overlap function|2015|1881.0
1882|CUCO, ANA PAULA CURTY&Fabiano Luis de Sousa&SILVA NETO, ANTÔNIO J.|methodolog spacecraft equip layout|2015|1882.0
1883|AUGUSTO TEIXEIRA, FERNANDO&MENEZES VIEIRA, GUSTAVO&MARCONDES FONSECA, PABLO&Fernando Magno Quintão Pereira&CHI WONG, HAO&MARCOS SILVA NOGUEIRA, JOSE&BARBOSA OLIVEIRA, LEONARDO|defend internet thing exploit|2015|1883.0
1884|LEMOS MAIA NETO, ANTONIO&TERRA CUNHA MELO, LEANDRO&PARANAIBA VILELA NETO, OMAR&Fernando Magno Quintão Pereira&BARBOSA OLIVEIRA, LEONARDO|protect program memori violat hardwar|2015|1884.0
1885|ZAFRA SAGGIORO, LUIZ FELIPE&MENDES PAISANTE, VITOR&ERNANI RODRIGUES, RAPHEL&BARBOSA E OLIVEIRA, LEONARDO&Fernando Magno Quintão Pereira|distribut data detect integ overflow|2015|1885.0
1886|Telmo de Menezes e Silva Filho&PIMENTEL, BRUNO A.&SOUZA, RENATA M.C.R.&OLIVEIRA, ADRIANO L.I.|hybrid method fuzzi cluster base fuzzi c mean improv particl swarm optim|2015|1886.0
1891|Thiago Magela Rodrigues Dias&Gray Farias Moita|method identif collabor databas|2015|1891.0
1892|Raqueline Azevedo Medeiros Santos&PORTUGAL, RENATO&BOETTCHER, STEFAN|moment quantum walk lattic|2015|1892.0
1896|Ana Carolina Oliveira Lima&Ana Carolina Oliveira Lima|network hardwar review locat system|2015|1896.0
1901|Maria Thereza Miranda Rocco Giraldi&Cindy Stella Fernandes&Marta S. Ferreira&Marco José de Sousa&Pedro Alberto da Silva Jorge&Joao Crisostomo Weyl Albuquerque Costa&José Luis dos Santos&Orlando Frazão|fiber displac sensor base reflect techniqu|2015|1901.0
1904|Pieter Van der Weeën&SILVA, NÚBIA ROSA DA&Bernard De Baets&Odemir Martinez Bruno|textur imag classif use corros inspir automaton|2015|1904.0
1906|Marina Jeaneth Machicao&Anderson Gonçalves Marco&Jan Marcel Baetens&Bernard De Baets&Odemir Martinez Bruno|system approach discrimin mode oper system|2015|1906.0
1907|FLORINDO, JOAO BATISTA&LANDINI, GABRIEL&Odemir Martinez Bruno|textur descriptor analysi coars|2015|1907.0
1908|SILVA, NÚBIA ROSA DA&Florindo, J.B.&Davi Rodrigo Rossatto&Rosana Marta Kolb&Maria Cecília Gomez&Odemir Martinez Bruno|plant identif base leaf midrib cross section imag fractal descriptor|2015|1908.0
1909|Florindo, J.B.&Lucas Assirati&Odemir Martinez Bruno|enhanc textur descriptor neighborhood approach entropi|2015|1909.0
1911|BACKES, ANDRÉ RICARDO&GERHARDINGER, LEANDRO CAVALERI&NETO, JOÃO DO ESPÍRITO SANTO BA&Odemir Martinez Bruno|imag retriev analysi field dimens|2015|1911.0
1912|NARDIN, CARLA FERNANDA&Luís Carlos Bernacci&PLOTZE, RODRIGO OLIVEIRA&Odemir Martinez Bruno&SHEPHERD, GEORGE JOHN|recognit differenti speci passiflora complex|2015|1912.0
1913|KORN, GUSTAVO POLACOW&AUGUSTO DE LIMA PONTES, ANTONIO&Denise Caluta Abranches&AUGUSTO DE LIMA PONTES, PAULO|hoars risk factor univers teacher|2015|1913.0
1914|KORN, GUSTAVO POLACOW&AUGUSTO DE LIMA PONTES, ANTONIO&Denise Caluta Abranches&AUGUSTO DE LIMA PONTES, PAULO|vocal tract discomfort risk factor univers teacher|2015|1914.0
1915|VILANI-MORENO, F. R.&SILVA, S. M. U. R.&BARBOSA, A. S. A. A.&SARTORI, B. G. C.&BARBOZA PEDRINI, S. C.&NUNES, A. J. F.&SARUHASHI, M. R.&José Roberto Pereira Lauris&Suzana Madeira Diorio|studi jorg lobo diseas analysi lavag cell footpad histopatholog earli versu lesion|2015|1915.0
1916|PORTO, ANA CAROLINA SOUZA&FIGUEIRA, RENATA BORGES FORTES COSTA&BARRETO, JAISON ANTÔNIO&José Roberto Pereira Lauris|evalu profil patient diagnos leprosi refer center sao|2015|1916.0
1918|CONTI, PAULO CÉSAR RODRIGUES&CORRÊA, ANA SILVIA DA MOTA&José Roberto Pereira Lauris&STUGINSKI-BARBOSA, JULIANA|manag joint click devic counsel control studi|2015|1918.0
1919|SENES, A. M.&Carlos Ferreira dos Santos&Adriana Maria Calvo&Bella L. Colombini-Ishikiriama&P Z Gonçalves&Thiago José Dionísio&Eduardo Sant`ana&Daniel T. Brozoski&José Roberto Pereira Lauris&F A C Faria|efficaci safeti molar surgeri|2015|1919.0
