|autores|titulo|ano|group
760|FERREIRA, SILVIO C.&Renan Servat Sander&PASTOR-SATORRAS, ROMUALDO|versus hub activ epidem phase network|2016|760.0
761|Vitor Venceslau Curtis&SANCHES, C. A. A.|solut subset sum problem|2016|761.0
762|Ranilson Oscar Araújo Paiva&BITTENCOURT, IG IBERT&TENÓRIO, THYAGO&Jaques, Patricia&Isotani, Seiji|student line model student interact improv learn experi|2016|762.0
763|Timóteo Gomes da Silva&Maria Lencastre Pinheiro de Menezes Cruz&João Henrique Correia Pimentel&Sérgio Mário Lins Galdino&Cinthya Cavalcanti Flório|conceptu domain specif simul requir|2016|763.0
764|Oriel Frigo&SABATER, NEUS&DELON, JULIE&HELLIER, PIERRE|motion driven tonal stabil|2016|764.0
766|João Felipe Manhães de Lima Velloso&Hélvia Pereira Pinto Bastos&Suzana da Hora Macedo|tool assist develop linguist abil english|2016|766.0
767|Marco Antônio G. T. da Silva&Suzana da Hora Macedo&Evanildo dos Santos Leite|teach electromagnet imag simul technic cours|2016|767.0
768|Anderson Aparecido Alves da Silva&Fen Zhou&Elvis Pontes&Marcos Antonio Simplicio Jr&Rui Aguiar&Adilson Eduardo Guelfi&Sergio T. Kofuji|energi node posit identif payoff matrix variabl analysi|2016|768.0
769|FERREIRA, LUCIANO&BORENSTEIN, DENIS&Éverton Santi|fuzzi rank procedur discrimin|2016|769.0
770|Éverton Santi&ALOISE, DANIEL&BLANCHARD, SIMON J.|model cluster data dissimilar|2016|770.0
771|Marcel Vinicius Medeiros Oliveira&ANTONINO, P.&RAMOS, R.&SAMPAIO, A.&MOTA, A.&ROSCOE, A. W.|develop compon base system compon pattern|2016|771.0
772|Ernesto Julián Goldberg Birgin&John Lenon Cardoso Gardenghi&José Mario Martínez Perez&Sandra Augusta Santos&Philippe L. Toint|evalu complex nonlinear constrain optim unscal condit high order model|2016|772.0
773|THEOTO ROCHA, FABIO&GONCALVES DE MAGALHAES JUNIOR, ROBERTO&OLIVEIRA HORTA, THOMAS&HENRIQUE GONCALVES CESAR, FABIO&MAURICE D'ISRAEL, DAVID&DA SILVA, WILSON&Carlos Eduardo Thomaz|acquisit process brain map chess problem solv|2016|773.0
774|MORETO, RODRIGO ALVES DE LIMA&ROTONDARO, ANTONIO LUIS PACHECO&Carlos Eduardo Thomaz&GIMENEZ, SALVADOR PINILLOS|architectur manufactur framework transconduct amplifi design|2016|774.0
775|PICCOLO, LARA S. G.&Maria Cecilia Calani Baranauskas&AZEVEDO, RODOLFO|social inspir energi feedback technolog challeng develop scenario|2016|775.0
776|NETO, LAURINDO BRITTO&GRIJALVA, FELIPE&Maike, Vanessa Regina Margareth Lima&MARTINI, LUIZ CESAR&FLORENCIO, DINEI&Maria Cecilia Calani Baranauskas&ROCHA, ANDERSON&GOLDENSTEIN, SIOME|base wearabl face recognit system aid visual user|2016|776.0
777|Hernane Borges de Barros Pereira&FADIGAS, I.S.&MONTEIRO, R.L.S.&CORDEIRO, A.J.A.&Moret, M.A.|densiti measur divers concept address network|2016|777.0
778|Francisco José Aragão Pedroza Cunha&Núbia Moura Ribeiro&MONTEIRO, R.L.S.&Hernane Borges de Barros Pereira|network analysi strategi monitor dissemin inform hospit|2016|778.0
779|MONTEIRO, R.L.S.&Tereza Kelly Gomes Carneiro&José Roberto de Araujo Fontoura&Valéria Loureiro da Silva&Moret, M.A.&Hernane Borges de Barros Pereira|model improv learn curv artifici neural network|2016|779.0
780|Leandro S. Maciel&Fernando Antonio Campos Gomide&Rosangela Ballini|stock market volatil predict fuzzi model|2016|780.0
781|MACIEL, LEANDRO&Rosangela Ballini&Fernando Gomide|evolv analyt time seri forecast|2016|781.0
782|Leandro S. Maciel&Gomide, F.&Rosangela Ballini|evolut algorithm yield curv estim|2016|782.0
783|MICHELON, GISANE A.&Luiz Augusto de Paula Lima Junior&OLIVEIRA JR., JOSÉ AÉLIO DE&ANDRADE, GIL E. DE|weight central potenti replica reloc|2016|783.0
787|VIGNATTI, ANDRÉ L.&Murilo Vicente Gonçalves da Silva|vertex cover general random graph power law degre distribut|2016|787.0
791|Ariadne de Andrade Costa&Renato Tinós|investig rat exploratori behavior evolv artifici neural network|2016|791.0
792|BROCHINI, LUDMILA&Ariadne de Andrade Costa&ABADI, MIGUEL&ROQUE, ANTÔNIO C.&STOLFI, JORGE&KINOUCHI, OSAME|phase transit self organ critic network spike neuron|2016|792.0
793|Marcos Cleison Silva Santana&DASILVA, C.A.&BARROZO, P.&PLAZA, E.J.R.&DE LOS SANTOS VALLADARES, L.&Nelson O Moreno|properti mn o perovskit|2016|793.0
794|João Fausto Lorenzato de Oliveira&LUDERMIR, TERESA B.|decomposit system time seri forecast|2016|794.0
795|Eugênio de Oliveira Simonetto&Osvaldo L.G. Quelhas&Vesna Spasojevi&#263; Brki&#263;&Goran Putnik&Cátia Alves&Hélio de Castro|system dynam model evalu reus wast origin comput|2016|795.0
796|Cristiane Cozin&VICENCIO, FERNANDO E. C.&DE ALMEIDA BARBUTO, FAUSTO ARINOS&MORALES, RIGOBERTO E. M.&DA SILVA, MARCO JOSE&ARRUDA, LUCIA VALERIA R.|phase slug flow character artifici neural network|2016|796.0
797|Thibaut Victor Gaston Vidal|note split algorithm capacit vehicl rout problem|2016|797.0
798|Ulrich Breunig&SCHMID, V.&HARTL, R.F.&Thibaut Victor Gaston Vidal|neighbourhood base heurist echelon rout problem|2016|798.0
799|Thibaut Victor Gaston Vidal&JAILLET, PATRICK&MACULAN, NELSON|decomposit algorithm nest resourc alloc problem|2016|799.0
801|Breno Bernard Nicolau de França&TRAVASSOS, GUILHERME HORTA|experiment simul model softwar engin plan report guidelin|2016|801.0
802|DA SILVA, ADENILTON J.&Wilson Rosa de Oliveira Junior&Teresa Bernarda Ludermir|network paramet architectur select quantum comput|2016|802.0
803|DE PAULA NETO, FERNANDO M.&Wilson Rosa de Oliveira Junior&DA SILVA, ADENILTON J.&Teresa Bernarda Ludermir|chao quantum weightless neuron node dynam|2016|803.0
804|STOSIC, DARKO&STOSIC, DUSAN&LUDERMIR, TERESA&Wilson Rosa de Oliveira Junior&Tatijana Stosic|exchang rate entropi evolut crise|2016|804.0
805|DA SILVA, ADENILTON JOSÉ&Teresa Bernarda Ludermir&Wilson Rosa de Oliveira Junior|quantum field network architectur select quantum comput|2016|805.0
806|Adenilton José da Silva&Wilson Rosa de Oliveira Junior|comment network|2016|806.0
807|Bruno Carreiro da Silva&SANT?ANNA, CLAUDIO&ROCHA, NEYLOR&Christina Brandão Von Flach|effect concern map strategi cohes measur|2016|807.0
808|TZANAKIS, GEORGIOS&Lucia Rosana Moura&Panario, Daniel&Stevens, Brett|construct cover array sequenc field|2016|808.0
809|Lucia Rosana Moura&MULLEN, GARY L.&Panario, Daniel|field construct array|2016|809.0
810|ANDRADE, LAÍS&CARVALHO, RUAN&DE OLIVEIRA, ANJOLINA&Ruy José Guerra Barretto de Queiroz|normal n graph sub n graph|2016|810.0
811|Marcus Vinícius Midena Ramos&Ruy José Guerra Barretto de Queiroz&Nelma Moreira&José Carlos Bacelar Almeida|formal pump lemma context languag|2016|811.0
812|DE CASTRO, CLARICE MARINHO MARTINS&REED, CHRIS&Ruy José Guerra Barretto de Queiroz|content cloud base contract brazil european union|2016|812.0
813|Ruy José Guerra Barretto de Queiroz&Anjolina Grisi de Oliveira&Arthur Freitas Ramos|proposit equal ident type comput path|2016|813.0
814|GULO, CARLOS A. S. J.&DE ARRUDA, HENRIQUE F.&DE ARAUJO, ALEX F.&Antonio Carlos Sementille&TAVARES, JOÃO MANUEL R. S.|parallel imag smooth method base model|2016|814.0
815|Eduardo Moreira Fernandes&Márcio Aparecido Inácio da Silva&Maria Istela Cagnin|s web applic mobil applic social health care data manag|2016|815.0
816|CAMPOS, JOSE CREISSAC&SOUSA, MANUEL&Miriam Celia Bergue Alves&HARRISON, MICHAEL D.|verif space system user interfac ivi workbench|2016|816.0
817|Alessandro Ferreira Leite&BOUKERCHE, AZZEDINE&MAGALHAES ALVES DE MELO, ALBA CRISTINA&EISENBEIS, CHRISTINE&TADONKI, CLAUDE&RALHA, CÉLIA GHEDINI|power server consolid feder cloud|2016|817.0
819|Flávio Mota Medeiros&RODRIGUES, IRAN&Márcio de Medeiros Ribeiro&Leopoldo Teixeira&GHEYI, ROHIT|studi configur relat issu investig identifi|2016|819.0
821|Díbio Leandro Borges&GUEDES, SAMUEL T.C. DE M.&NASCIMENTO, ABADIA R.&MELO-PINTO, PEDRO|detect grade sever spot caus xanthomona spp tomato lycopersicon field spectrum imag|2016|821.0
822|Joao Gari da Silva Fonseca Junior&OHTAKE, HIDEAKI&OOZEKI, TAKASHI&Ogimoto, Kazuhiko|region hour ahead forecast solar irradi train data select support vector regress|2016|822.0
823|Omar Andrés Carmona Cortes&Andrew Rau-Chaplin&Rafael Fernandes Lopes|survey contract optim evolutionari swarm comput|2016|823.0
824|Alana Elza Fontes da Gama&CHAVES, THIAGO MENEZES&FIGUEIREDO, LUCAS SILVA&BALTAR, ADRIANA&MENG, MA&NAVAB, NASSIR&TEICHRIEB, VERONICA&FALLAVOLLITA, PASCAL|clinic relat gestur recognit tool ar rehabilit system|2016|824.0
826|MAGALHÃES, DILZE MARIA ARGÔLO&LUZ, EDNA DORA MARTINS NEWMAN&Uilson Vanderlei Lopes&NIELLA, ANA ROSA ROCHA&DAMACENO, VIRGÍNIA OLIVEIRA|leaf disc method screen ceratocysti wilt resist cacao|2016|826.0
828|DA SILVA, MARCOS RAMOS&CLÉMENT, DIDIER&GRAMACHO, KARINA PERES&MONTEIRO, WILSON REIS&ARGOUT, XAVIER&LANAUD, CLAIRE&Uilson Vanderlei Lopes|associ map incompat gene cacao theobroma cacao|2016|828.0
829|Raphael Pereira de Oliveira&RODRIGUES SANTOS, ALCEMIR&de Almeida, Eduardo Santana&da Silva Gomes, Gecynalda Soares|evalu law softwar evolut softwar product line industri project|2016|829.0
831|CAMPOS, FERNANDO HENRIQUE&MONTANHA, GUSTAVO KIMURA&ANDRADE, VINICIUS CAMARGO&Franck Carlos Vélez Benito|expert system valid credit educ institut|2016|831.0
833|Camilo Carromeu&Débora Maria Barroso Paiva&Maria Istela Cagnin|e gov web spl e gov mobil spl intern journal web inform system|2016|833.0
834|ALBUQUERQUE, FÁBIO C.&CASANOVA, MARCO A.&LOPES, HÉLIO&REDLICH, LUCIANA R.&José Antonio Fernandes de Macêdo&Melissa Lemos Cavaliére&DE CARVALHO, MARCELO TILIO M.&RENSO, CHIARA|methodolog traffic relat twitter messag interpret|2016|834.0
836|SERAPIÃO, ADRIANE B.S.&CORRÊA, GUILHERME S.&GONÇALVES, FELIPE B.&Veronica Oliveira de Carvalho|combin k mean k harmon fish school search algorithm data cluster task graphic process unit|2016|836.0
838|DE CASTRO SILVA, SANDRO LUÍS FREIRE&DE OLIVEIRA, SAULO BARBARÁ&Antonio Augusto Goncalves|servic desk softwar usabl evalu case brazilian nation cancer institut|2016|838.0
839|Sergio Roberto de Mello Canovas&CUGNASCA, CARLOS EDUARDO|extend adapt program specifi adapt function|2016|839.0
840|ROSA, LUIZ PINGUELLI&SANTOS, MARCO AURÉLIO DOS&Claudio Joaquim Martagao Gesteira Neto&XAVIER, ADILSON ELIAS|model data extrapol greenhous gas emiss system|2016|840.0
841|Rafael Roberto&João Paulo Silva do Monte Lima&Veronica Teichrieb|track mobil devic systemat map studi|2016|841.0
842|João Paulo Silva do Monte Lima&SIMÕES, FRANCISCO PAULO MAGALHÃES&UCHIYAMA, HIDEAKI&Veronica Teichrieb&MARCHAND, ERIC|depth assist rectif time object detect pose estim|2016|842.0
843|Mouenis Anouar Tadlaoui&Souhaib Aammou&Mohamed Khaldi&Rommel Novaes Carvalho|learner model adapt educ system studi|2016|843.0
844|Rommel Novaes Carvalho&Laskey, Kathryn B.&COSTA, PAULO C.G. DA|uncertainti model process technolog|2016|844.0
846|Fabricio Ferreira Cintra&Caio Fernando Fontana&Antonio Gil da Silva Andrade&Cledson Akio Sakurai|propos use non intrus technolog ticket public transport vehicl pass integr mode|2016|846.0
849|Cledson Akio Sakurai&Caio Fernando Fontana&Antonio Gil da Silva Andrade|appli bus rapid transit|2016|849.0
850|Caio Fernando Fontana&Cledson Akio Sakurai&Claudio Luiz Marte&José R. Cardoso&Antonio Gil da Silva Andrade|power line communic altern data communic channel|2016|850.0
853|Mayara Marques da Silva&Hamilton Aurélio de Lima e dos Santos&Robson Barbosa&Caio Fernando Fontana&Cledson Akio Sakurai&Hermes Senger|internet thing urban mobil case bus rapid transit sao jose dos campo citi|2016|853.0
854|Robson Barbosa&Kellen Martins do Carmo&Felippe Borges&Vera Lúcia Alves Cordeiro Barbosa&Caio Fernando Fontana&Cledson Akio Sakurai&Hermes Senger|consider qualiti life work driver bus rapid transit|2016|854.0
855|Caio Fernando Fontana&Cledson Akio Sakurai&Leopoldo Rideki Yoshioka&CLAUDIO LUIS MARTE&Hermes Senger|logist monitor|2016|855.0
857|Robson Barbosa&Alessandra Di Lorenzo&Erica de Rossi Ferrarezi&Vera Lúcia Alves Cordeiro Barbosa&Caio Fernando Fontana&Cledson Akio Sakurai|aspect transport int environ case bus rapid transit sao campo municip|2016|857.0
858|Caio Fernando Fontana&Cledson Akio Sakurai&Barbara Carvalho Negrao&Leopoldo Rideki Yoshioka&CLAUDIO LUIS MARTE&Hermes Senger|overview sao jose dos campo project|2016|858.0
864|Celio Trois&DIDONET DEL FABRO, MARCOS D.&DE BONA, LUIS C. E.&MARTINELLO, MAGNOS|survey program languag taxonomi|2016|864.0
865|Mauro Cesar Martins Campos&KROHLING, RENATO A.|entropi base bone particl swarm constrain optim|2016|865.0
867|Maurício Massaru Arimoto&Leonor Barroca&Ellen Francine Barbosa|oer agil method develop open resourc|2016|867.0
869|TRAVIESO, GONZALO&Carlos Antonio Ruggiero&BRUNO, ODEMIR MARTINEZ&COSTA, LUCIANO DA FONTOURA|network approach cloud comput|2016|869.0
870|RODRIGUES, RICARDO N.&CANEZ, ALEXSANDER V.&SIMAS, GISELE M.&Regina Barwaldt|publish subscrib architectur deliv assist visual peopl|2016|870.0
871|Leander Cordeiro de Oliveira&Danubia Bueno Espíndola&Marília Abrahão Amaral&Silvia Silva da Costa Botelho&Regina Barwaldt|authorship methodolog artifact appli virtual world educ|2016|871.0
872|MAIA, DEISE&Roque Mendes Prado Trindade|face detect recognit color imag|2016|872.0
873|LOPES, MAISA&GOMES, IAGO&Roque Mendes Prado Trindade&SILVA, ALZIRA&LIMA, ANTONIO CEZAR|web environ program control robot laboratori|2016|873.0
874|S. LOPES, MAÍSA S. DOS&O. BRITO, JESSICA&Roque Mendes Prado Trindade&F. DA SILVA, ALZIRA&C. DE C. LIMA, ANTONIO|usabl evalu control program environ program educ|2016|874.0
875|Alexsandra Oliveira Andrade&Roque Mendes Prado Trindade&FLAULLES B. BERGAMASCHI&Alecio Santos Barros&Regivan Hugo Nunes Santiago&Ana Maria G. Guerreiro|analyz r implic weber count mycorrhiz fungi spore|2016|875.0
876|STOLFI, JORGE&Luiz Henrique de Figueiredo&OLIVEIRA, JOÃO BATISTA S. DE&NEHAB, DIEGO|bound julia set|2016|876.0
877|Izaquiel L. Bessas&Flavio L. C. Padua&Guilherme T. de Assis&Rodrigo T. N. Cardoso&Anisio Mendes Lacerda|set similar threshold content base inform retriev problem|2016|877.0
878|D. N. Brito&C. F. G. Nunes&Flavio L. C. Padua&Anisio Mendes Lacerda|evalu interest point match method project reconstruct scene|2016|878.0
879|DUENHA, LIANA&MADALOZZO, GUILHERME&MORAES, FERNANDO GEHM&Rodolfo Jardim de Azevedo|exploit perform power energi scale system simul|2016|879.0
880|PAULA LEITE, RODOLFO&FREITAS, RODRIGO&Rodolfo Jardim de Azevedo&DE KONING, MAURICE|ford model coeffici applic refer system phase energi calcul|2016|880.0
881|Liana Duenha&Guilherme Madalozzo&Thiago Santiago&Fernando Gehm Moraes&Rodolfo Jardim de Azevedo|benchmark level evalu multiprocessor system chip tool methodolog|2016|881.0
882|Rodolfo Jardim de Azevedo&Lucas Wanner|lesson learn comput architectur laboratori|2016|882.0
883|Jadsonlee da Silva Sá&Antonio Marcus Nogueira Lima&Ângelo Perkusic&José Sérgio da Rocha Neto|fault injector network|2016|883.0
884|Matheus P. Souza&Abilio A. M. de Oliveira&Marconi de Arruda Pereira&Felipe Augusto Lima Reis&Paulo Eduardo Maciel de Almeida&Eder J. Silva&Daniel S. Crepalde|optim taxi cab assign geograph locat base system distinct offer demand scenario|2016|884.0
885|Carlos Henrique Farias dos Santos&CARDOZO, DAISY ISABEL KANG&Reginatto, Romeu&DE PIERI, EDSON ROBERTO|bank control thruster fault control vehicl|2016|885.0
886|OLIVEIRA, DANIEL&Laércio Lima Pilla&SANTINI, THIAGO&RECH, PAOLO|evalu mitig radiat induc soft error graphic process unit|2016|886.0
887|DA ROSA RIGHI, RODRIGO&DE QUADROS GOMES, ROBERTO&RODRIGUES, VINICIUS FACCO&DA COSTA, CRISTIANO ADNRÉ&ALBERTI, ANTONIO MARCOS&Laércio Lima Pilla&NAVAUX, PHILIPPE OLIVIER ALEXANDRE|self organ process reschedul bulk synchron parallel applic|2016|887.0
891|Claudson Ferreira Bornstein&José Wilson Coura Pinto&Rautenbach, Dieter&Jayme Luiz Szwarcfiter|forbidden subgraph p intersect number|2016|891.0
892|Everton Knihs&Nizam Omar&Ismar Frango Silveira|aspect collabor product open digit resourc|2016|892.0
893|Christof Ebert&KUHRMANN, MARCO&Rafael Prikladnicki|global softwar engin industri perspect|2016|893.0
894|Forrest Shull&CARLETON, ANITA&CARRIERE, JEROMY&Rafael Prikladnicki&ZHANG, DONGMEI|futur softwar engin|2016|894.0
896|Rafael Prikladnicki&Casper Lassenius&Evelyn Tian&Jeffrey Carver|trend agil perspect practition|2016|896.0
897|Raoul Vallon&Stefan Strob&Rafael Prikladnicki&Thomas Grechenig|adapt framework agil distribut softwar develop|2016|897.0
899|Ramide Augusto Sales Dantas&Carlos Alberto Kamienski&FERNANDES, STENIO&Djamel Sadok|assess effect autom servic composit|2016|899.0
905|Eliciana Sias Aldrighi&Priscila Martha Rodrigues&Bárbara Denicol do Amaral Rodriguez&Liércio Isoldi&Luiz Alberto Oliveira Rocha&Elizaldo Domingues dos Santos|design rectangular fin intrud differ surfac forc convect lid driven caviti flow|2016|905.0
906|Leo Liberti&Carlile Campos Lavor|gem histori distanc geometri|2016|906.0
907|DOUGLAS S. GONCALVES&MARCIA A. GOMES-RUGGIERO&Carlile Campos Lavor|gradient method optim densiti matric|2016|907.0
908|Simon J.L. Billinge&Phillip M. Duxbury&DOUGLAS S. GONCALVES&Carlile Campos Lavor&Antonio Mucherino|assign distanc geometri applic molecul|2016|908.0
909|AMARO, BRUNO&DE LIMA, LEONARDO&OLIVEIRA, CARLA&Carlile Campos Lavor&ABREU, NAIR|note sum signless eigenvalu|2016|909.0
910|Alan Kelon Oliveira de Moraes&ANDRADE, WILKERSON L.&MACHADO, PATRÍCIA D.L.|famili test select criteria time input output symbol transit system model|2016|910.0
911|PELÁEZ, FRANCISCO JAVIER ROPERO&Mariana Antonia Aguiar Furucho&ANDINA, DIEGO|intrins plastic competit like neural network|2016|911.0
912|Márcio José das Chagas Moura&Rafael Azevedo&Enrique L Droguett&Leandro Chaves Rêgo&Lins, Isis Didier&Romulo Vilela&Sales Filho, Romero|estim expect number accid workforc unavail popul variabl analysi base model|2016|912.0
913|Filipe Costa de Souza&Raabe Marques Amorim&Leandro Chaves Rêgo|co authorship network analysi product research fellow probabl statist area|2016|913.0
914|Francisco Dantas Nobre Neto&Cláudio de Souza Baptista&Cláudio Elízio Calazans Campelo|predict destin rout urban trip autom identif place type stay point|2016|914.0
916|Caio Libanio de Melo Jerônimo&Cláudio Elízio Calazans Campelo&Cláudio de Souza Baptista|mine term toponym recognit resolut|2016|916.0
917|Denis José S. Albuquerque&Vanessa Tavares Nunes&Claudia Cappelli&Celia Ghedini Ralha|implement e govern process distribut transpar multi agent system|2016|917.0
919|BAA-PUYOULET, PATRICE&PARISOT, NICOLAS&FEBVAY, GÉRARD&HUERTA-CEPAS, JAIME&Augusto Fernandes Vellozo&GABALDÓN, TONI&CALEVRO, FEDERICA&CHARLES, HUBERT&COLELLA, STEFANO|cycad power collect databas analys compar metabol arthropod|2016|919.0
920|BERTUZZI, RÔMULO&MELEGATI, JORGE&BUENO, SALOMÃO&GHIARONE, THAYSA&PASQUA, LEONARDO A.&GÁSPARI, ARTHUR FERNANDES&LIMA-SILVA, ADRIANO E.&Alfredo Goldman vel Lejbman|lab free softwar calcul energi system contribut exercis|2016|920.0
921|AUTILI, MARCO&TIVOLI, MASSIMO&Alfredo Goldman vel Lejbman|seri servic composit internet|2016|921.0
924|NOGUEIRA, KEILLER&VELOSO, ADRIANO ALONSO&Jefersson Alex dos Santos|pointwis cloth annot combin featur media|2016|924.0
926|ALMEIDA, JURANDY&Jefersson Alex dos Santos&ALBERTON, BRUNA&MORELLATO, LEONOR PATRICIA C.&da S. Torres, Ricardo|rhythm represent fine grain plant speci identif|2016|926.0
927|ARAUJO, JULIO&HAVET, FRÉDÉRIC&LINHARES SALES, CLAUDIA&Ana Shirley Ferreira da Silva|orient cacti|2016|927.0
930|Diogo Tenório Cintra&Paulo Roberto Maciel Lyra&Ramiro Brito Willmersdorf&William Wagner Matos Lira|dem approach memori access optim|2016|930.0
931|Diogo Tenório Cintra&Paulo Roberto Maciel Lyra&Ramiro Brito Willmersdorf&William Wagner Matos Lira|dem approach workload balanc base|2016|931.0
933|Albino Szesz Junior&Marcos Monteiro Junior&Ariangelo Hauer Dias&Ivo Mario Mathias&Giuvane Conti|system platform control support grain aerat decis|2016|933.0
934|FONTINELE, ALEXANDRE&SANTOS, IALLEN&Gilvan Martins Durães&Soares, André|achiev regener alloc network regener assign algorithm|2016|934.0
935|MARTINS OLIVEIRA, JULIANA&CLAILTON M JORGE, JOSE&João Batista Furlan Duarte&HUGO COSTA DE ALBUQUERQUE, VICTOR|complementari treatment children cerebr palsi base realiti|2016|935.0
937|Paulo Augusto Silva Veloso&Sheila R M Veloso|calculi modal logic|2016|937.0
938|ORFANUS, DALIMIR&Edison Pignaton de Freitas&ELIASSEN, FRANK|self organ support paradigm militari relay network|2016|938.0
939|Tatiana Galibus&Viktor V. Krasnoproshin&Thiago Pereira Brito Vieira&Rafael Timóteo de Sousa Jr&Joao Paulo Carvalho Lustosa da Costa&Edison Pignaton de Freitas&Anton Zaleski&Herman Vissia|organ protect mechan cloud storag servic|2016|939.0
941|Paulo Andre Lima de Castro&Anderson Rodrigo Barreto Teodoro&Luciano Irineu de Castro Filho&Simon Parsons|expect util prospect theori fit agent base model market|2016|941.0
942|Eduardo Godoy de Souza&Claudio Leones Bazzi&Raj Khosla&Miguel Oribe Opazzo&robin reich|interpol type data comput crop yield map precis crop product|2016|942.0
944|RICARDO SOBJAK&Eduardo Godoy de Souza&Miguel Oribe Opazzo&Claudio Leones Bazzi&Nelson Miguel Betzek|variabl qualiti manag zone|2016|944.0
948|Laura-Maria Peltonen&Eunjoo Jeon&Jude L Tayaben&Chiu-Hsiang Kuo&Tasneem Islam&Janine Sommer&Hyunggu Jung&Gabrielle Jacklin Eler&Dari Alhuw Ail&Maxim Topaz&Charlene Ronquillo&Lisiane Pruinelli&Raymond Francis Sarmiento&Martha k Badger&Samira Ali&Adrienne Lewis&Mattias Georgsson|nurs informat research prioriti futur recommend intern survey|2016|948.0
949|Laura-Maria Peltonen&Chiu-Hsiang Kuo&Adrienne Lewis&Lisiane Pruinelli&Charlene Ronquillo&Raymond Francis Sarmiento&Janine Sommer&Jude L Tayaben&Maxim Topaz&Dari Alhuw Ail&Samira Ali&Martha k Badger&Gabrielle Jacklin Eler&Mattias Georgsson&Tasneem Islam&Eunjoo Jeon&Hyunggu Jung|current trend nurs informat result intern survey|2016|949.0
950|Maxim Topaz&Eunjoo Jeon&Jude L Tayaben&Chiu-Hsiang Kuo&Tasneem Islam&Janine Sommer&Hyunggu Jung&Gabrielle Jacklin Eler&Dari Alhuw Ail&Charlene Ronquillo&Laura-Maria Peltonen&Lisiane Pruinelli&Raymond Francis Sarmiento&Martha k Badger&Samira Ali&Adrienne Lewis&Mattias Georgsson|advanc nurs informat decad recommend intern survey|2016|950.0
951|Helen Andrade Arcuri&GOMES, PAULO CESAR&DE SOUZA, BIBIANA MONSON&DIAS, NATHALIA BAPTISTA&BRIGATTE, PATRÍCIA&STABELI, RODRIGO GUERINO&PALMA, MARIO S.|function dualiti wasp venom peptid toxin|2016|951.0
952|Rosa Maria Chura-Chambi&Helen Andrade Arcuri&Felipe Lino Sene de Oliveira&Natan Versati da Silva&Mario Sergio Palma&Ligia Morganti|studi protein fusion death domain hybrid enhanc activ|2016|952.0
953|DOS SANTOS-PINTO, JOSÉ ROBERTO APARECIDO&GARCIA, ANA MARIA CAVIQUIOLI&Helen Andrade Arcuri&ESTEVES, FRANCIELE GREGO&SALLES, HELIANA CLARA&LUBEC, GERT&Palma, Mario Sérgio|insight silk spin process spider|2016|953.0
955|Marcelo Daniel Berejuck&FRÖHLICH, ANTÔNIO A.|evalu connectionless techniqu system chip interconnect|2016|955.0
956|Marcelo Daniel Berejuck|overview network chip multicast support|2016|956.0
957|Kerstin Ellwanger&Elson Antonio do Nascimento&Said Fawad Mohammadi&Nelson Szilard Galgoul|regul cost estim decommiss sampl fix offshor platform brazil|2016|957.0
958|Luciano Carli Moreira de Andrade&OLESKOVICZ, MÁRIO&FERNANDES, RICARDO A.S.|threshold base wavelet transform appli segment power qualiti disturb|2016|958.0
959|Luciano Carli Moreira de Andrade&Ivan Nunes da Silva|effici model short term load forecast|2016|959.0
961|Leonardo Passos&Leopoldo Motta Teixeira&Nicolas Dintzner&Sven Apel&W'SOWSKI, ANDRZEJ&Krzysztof Czarnecki&Paulo Borba&Jianmei Guo|coevolut variabl model softwar artifact|2016|961.0
962|PÉRON, GUILLAUME&FLEMING, CHRIS H.&Rogério Cunha de Paula&CALABRESE, JUSTIN M.|uncov pattern space use anim track data includ algorithm periodogram improv random test|2016|962.0
964|Anderson Corrêa de Lima&BRANCO, RODRIGO G.&FERRAZ, SAMUEL&CÁCERES, EDSON N.&GAIOSO, ROUSSIAN A.&MARTINS, WELLINGTON S.&SONG, SIANG W.|solv subsequ sum problem cgm model cuda|2016|964.0
965|ALVES, JORIANNE T. C.&RAMOS, ROMMEL T. J.&SILVA, ARTUR&CARNEIRO, ADRIANA R.&Adonney Allan de Oliveira Veras&CAVALCANTE, ANA LÍDIA Q.&DE SÁ, PABLO H. C. G.&DIAS, LARISSA M.&GUIMARÃES, LUIS C.&MORAIS, EZEQUIEL&SILVA, ANDRÉ G. M.&AZEVEDO, VASCO|complet genom sequenc corynebacterium pseudotuberculosi strain sheep para brazil|2016|965.0
966|GOMES, JAQUELINE CONCEIÇÃO MEIRELES&DE AZEVEDO, JULIANA SIMÃO NINA&Adonney Allan de Oliveira Veras&ALVES, JORIANNE THYESKA CASTRO&HENRIQUES, ISABEL&CORREIA, ANTÓNIO&DA COSTA DA SILVA, ARTUR LUIZ&CARNEIRO, ADRIANA RIBEIRO|draft genom sequenc sp strain isol water temper estuarin system ria de portug|2016|966.0
967|GUIMARÃES, LUIS CARLOS&BAGANO, PRISCILLA&PEREIRA, FELIPE LUIZ&DORELLA, FERNANDA ALVES&LEAL, CARLOS AUGUSTO&CARVALHO, ALEX FIORINI&BIZET, CHANTAL&GUISO, NICOLE&BADELL, EDGAR&FIGUEIREDO, HENRIQUE CÉSAR PEREIRA&AZEVEDO, VASCO&LOPES, THIAGO&SILVA, ARTUR&RAMOS, ROMMEL THIAGO JUCÁ&CARNEIRO, ADRIANA RIBEIRO&CAVALCANTE, ANA LÍDIA QUEIROZ&BARRETO, DIEGO&DE SÁ, PABLO CARACCIOLO GOMES&Adonney Allan de Oliveira Veras&ROCHA, FLÁVIA SOUZA|draft genom sequenc pathogen corynebacteri speci cow|2016|967.0
968|Larissa Maranhão Dias&Rommel Thiago Jucá Ramos&Vasco Azevedo&Artur Silva&Adriana R Carneiro&Jorianne Thyeska Castro Alves&Adonney Allan de Oliveira Veras&BARÚNA, RAFAEL A.&DE SA, P. H. C. G.&SPIER, S. J.&Edman, J.&Luis Guimaraes&Flavia Rocha|genom sequenc corynebacterium pseudotuberculosi strain isol abscess goat california|2016|968.0
970|GUIMARÃES, LUIS C.&BARBOSA, MARIA S.&GUISO, NICOLE&BADELL, EDGAR&CARNEIRO, ADRIANA R.&AZEVEDO, VASCO&Rommel Thiago Juca Ramos&SILVA, ARTUR&VIANA, MARCUS V. C.&BENEVIDES, LEANDRO J.&MARIANO, DIEGO C. B.&Adonney Allan de Oliveira Veras&SÁ, PABLO H. C.&ROCHA, FLÁVIA S.&VILAS BOAS, PRISCILLA C. B.&SOARES, SIOMAR C.|draft genom sequenc corynebacterium strain isol dog franc|2016|970.0
972|DE SÁ, PABLO H. C. G.&Rommel Thiago Juca Ramos&MIRANDA, FÁBIO&Adonney Allan de Oliveira Veras&DE MELO, DIEGO MAGALHÃES&SOARES, SIOMAR&PINHEIRO, KENNY&GUIMARÃES, LUIS&AZEVEDO, VASCO&SILVA, ARTUR|graphic gap filler prokaryot genom|2016|972.0
