|autores|titulo|ano|group
2672|JUNG, SUNGKI&CHOI, WON&Luiz de Siqueira Martins Filho&MADEIRA, FERNANDO|implement self organ map airfoil design explor multi optim techniqu|2016|2672.0
2673|ALVES, HIRLEY&DE CASTRO TOME, MAURICIO&NARDELLI, PEDRO HENRIQUE JULIANO&Carlos Héracles Morais de Lima&LATVA-AHO, MATTI|enhanc transmit antenna select scheme secur throughput maxim csi transmitt|2016|2673.0
2674|NARDELLI, PEDRO H.J.&ALVES, HIRLEY&Carlos Héracles Morais de Lima&LATVA-AHO, MATTI|throughput maxim network secreci constraint|2016|2674.0
2675|pedro henrique juliano nardelli&Iran Ramezanipour&hirley alves&Carlos Héracles Morais de Lima&LATVA-AHO, MATTI|averag error probabl wireless sensor network imperfect sens communic differ decis rule|2016|2675.0
2679|Caio Eduardo Ribeiro&Luis Enrique Zárate Gálvez|data prepar data mine posit paper case studi age|2016|2679.0
2683|LIMA, CLODOALDO A. M.&COELHO, ANDRÉ L. V.&MADEO, RENATA C. B.&Sarajane Marques Peres|classif electromyographi signal relev vector machin dimens|2016|2683.0
2684|Heloísa do Nascimento de Moura Meneses&Amanda Neves&Felipe da Costa&Ricardo Bezerra de Oliveira&Anderson Alvarenga de Moura Meneses&Luís Reginaldo Ribeiro Rodrigues&Delaine Sampaio da Silva|mercuri level glutathion s transferas polymorph evalu popul low amazon brazil|2016|2684.0
2685|GELLER, MARLA&Anderson Alvarenga de Moura Meneses|life cycl assess small hydropow plant brazilian amazon|2016|2685.0
2691|Rafaelle Piazzaroli Finotti Amaral&Aldemon Lage Bonifácio&Flávio de Souza Barbosa&Alexandre Abrahão Cury|evalu comput intellig method statist analysi detect damag|2016|2691.0
2692|Ricardo Cerri&Rodrigo Coelho Barros&André Carlos Ponce de Leon Ferreira de Carvalho&Yaochu Jin|reduct strategi classif protein function predict|2016|2692.0
2693|Thiago Christiano Silva&STANCATO DE SOUZA, S. R.&TABAK, B. M.|network structur analysi interbank market|2016|2693.0
2694|Thiago Christiano Silva&STANCATO DE SOUZA, S. R.&TABAK, B. M.|structur dynam network|2016|2694.0
2695|STANCATO DE SOUZA, S. R.&Thiago Christiano Silva&TABAK, B. M.&Solange Maria Guerra|evalu risk bank default probabl financi network|2016|2695.0
2696|Thiago Christiano Silva&Solange Maria Guerra&TABAK, B. M.&CASTRO MIRANDA, R. C.|network bank effici risk take|2016|2696.0
2697|Thiago Christiano Silva&Marcos Soares da Silva&TABAK, B. M.|network bank liquid|2016|2697.0
2698|Thiago Christiano Silva&TABAK, B. M.&Daniel Oliveira Cajueiro&Marina Villas Boas Dias|comparison dea level perspect effici bank|2016|2698.0
2699|Thiago Christiano Silva&TABAK, B. M.&Solange Maria Guerra|vulner cycl matter network|2016|2699.0
2700|ANDRADE, ANDRE LUIZ MONEZI&DE LACERDA, ROSELI BOERNGEN&Henrique Pinto Gomide&Ronzani, Telmo Mota&SARTES, LAISA MARCORELA ANDREOLI&Martins, Leonardo Fernandes&DE SOUZA BEDENDO, ANDRÉ&SOUZA-FORMIGONI, MARIA LUCIA OLIVEIRA|web base self help intervent reduc alcohol consumpt heavi drink alcohol user pilot studi|2016|2700.0
2701|Henrique Pinto Gomide&Heder Soares Bernardino&RICHTER, K.&Leonardo Ferreira Martins&Telmo Mota Ronzani|develop sourc web base intervent smoker viva sem|2016|2701.0
2702|Lília Maria de Oliveira&Philippe Maillard&Eber Jose de Andrade Pinto|model effect land use land cover nitrogen dissolv oxygen load river concept contribut area|2016|2702.0
2703|Philippe Maillard&GOMES, MARÍLIA F.|detect count orchard tree imag geometr optic model mark templat match|2016|2703.0
2704|Lígia Maria Soares Passos&Stéphane Julia|linear logic tool qualit quantit analysi process|2016|2704.0
2710|Vinícius Fernandes dos Santos&Diana Sasaki|color snark np|2016|2710.0
2711|Vinícius Fernandes dos Santos&Murilo V. G. da Silva&Szwarcfiter, Jayme L.|k tree problem graph|2016|2711.0
2714|Rommel Melgaço Barbosa&PAULA, ELOISA SILVA DE&PAULELLI, ANA CAROLINA&MOORE, ANTHONY F.&SOUZA, JULIANA MARIA OLIVEIRA&BATISTA, BRUNO LEMOS&CAMPIGLIA, ANDRES D.&BARBOSA, FERNANDO|recognit rice sampl base trace element support vector machin|2016|2714.0
2715|MAIONE, CAMILA&BATISTA, BRUNO LEMOS&CAMPIGLIA, ANDRES DOBAL&BARBOSA, FERNANDO&Rommel Melgaço Barbosa|classif origin rice data mine induct coupl plasma mass spectrometri|2016|2715.0
2716|MAIONE, CAMILA&DE PAULA, ELOISA SILVA&GALLIMBERTI, MATHEUS&BATISTA, BRUNO LEMOS&CAMPIGLIA, ANDRES DOBAL&JR, FERNANDO BARBOSA&Rommel Melgaço Barbosa|studi data mine techniqu authent grape juic base ms analysi|2016|2716.0
2717|Rommel Melgaço Barbosa&SLATER, PETER|effici index graph|2016|2717.0
2718|Rommel Melgaço Barbosa&NELSON, DONALD R.|use support vector machin analyz food secur region brazil|2016|2718.0
2719|DA COSTA, NATTANE LUIZA&CASTRO, INAR ALVES&Rommel Melgaço Barbosa|classif cabernet differ countri south america chemic compound support vector machin|2016|2719.0
2720|Rommel Melgaço Barbosa&CAPPELLE, MÁRCIA R.|size maxim independ set cylindr grid graph|2016|2720.0
2721|MAIONE, CAMILA&SOUZA, VANESSA C. DE OLIVEIRA&TOGNI, LORAINE R.&DA COSTA, JOSE L.&CAMPIGLIA, ANDRES D.&BARBOSA, FERNANDO&Rommel Melgaço Barbosa|establish chemic profil ecstasi tablet base trace element level support vector machin|2016|2721.0
2722|Hugo Martinelli Watanuki&Renato de Oliveira Moraes|size matter investig role team size servic provis|2016|2722.0
2729|EFFANTIN, GRÉGORY&Leandro Farias Estrozi&ASCHMAN, NICK&RENESTO, PATRICIA&STANKE, NICOLE&LINDEMANN, DIRK&Schoehn, Guy&WEISSENHORN, WINFRIED|electron microscopi structur nativ prototyp foami virus glycoprotein virus architectur|2016|2729.0
2730|COSCIA, FRANCESCA&Leandro Farias Estrozi&HANS, FABIENNE&MALET, HÉLÈNE&NOIRCLERC-SAVOYE, MARJOLAINE&Schoehn, Guy&PETOSA, CARLO|fusion homo scaffold allow em analysi protein|2016|2730.0
2731|Ramon Adrian Salinas Franco&Marco Antonio Garcia de Carvalho&Paulo Sérgio Martins Pedro|low qualiti imag segment nonlinear regress k mean watersh|2016|2731.0
2733|DUHAMEL, CHRISTOPHE&Andrea Cynthia Santos&BRASIL, DANIEL&CHÂTELET, ERIC&BIRREGAH, BABIGA|connect popul model locat alloc problem disast relief oper|2016|2733.0
2734|Andrea Cynthia Santos&DUHAMEL, CHRISTOPHE&SILVA BELISÁRIO, LORENA|heurist design sink cluster topolog|2016|2734.0
2736|Solano-Charris, Elyn L.&PRINS, CHRISTIAN&Andrea Cynthia Santos|solv bi object vehicl rout problem cost demand|2016|2736.0
2741|ANA, PAULA BREZOLIN&GUSTAVO, MAZURKIEVICZ&JOSÉ, ANTONIO GONZALEZ DA SILVA&Fabricia Carneiro Roos Frantz&MANUEL, OSORIO BINELO&ANTONIO, CARLOS VALDIERO&CRISTIANO, MATHIAS ZIMMER&RUBIA, DIANA MANTAI&ANDERSON, MAROLLI&OSMAR, BRUNESLAU SCREMIN|effici wheat yield nitrogen dose fraction|2016|2741.0
2745|Clauirton A. Siebra&Rebeka G. Oliveira&Carolyn Seaman&Fabio Queda Bueno da Silva&SANTOS, ANDRÉ L. M.|theoret conceptu td practic perspect|2016|2745.0
2746|Fabio Queda Bueno da Silva&Cleviton&Igor Ebrahim dos Santos&Luiz Fernando Capretz|softwar develop group leader influenc team member innov behavior|2016|2746.0
2747|Guo, Yuepu&Seaman, Carolyn&Fabio Queda Bueno da Silva|cost obstacl encount debt manag case studi|2016|2747.0
2749|STOSIC, DUSAN&STOSIC, DARKO&Teresa Bernarda Ludermir|vote base q learn machin|2016|2749.0
2760|Emilia Katarzyna Witkowska Nery&KUBOTA, LAURO T.|evalu immobil method paper base devic glucos oxidas studi|2016|2760.0
2761|Fernando Henrique Machado&Adriana Prest Mattedi&Francisco Antonio Dupas&SILVA, L. F.&F E VERGARA|estim opportun cost conserv river watersh sao carlo sp brazil|2016|2761.0
2762|Gullermo Capitelli&Guillermo Macbeth&Raydonal Ospina Martínez&Fernando Marmolejo-Ramos|strategi use statist method psycholog research|2016|2762.0
2763|ROSSO, OSVALDO A.&Raydonal Ospina Martínez&FRERY, ALEJANDRO C.|classif verif handwritten signatur time causal inform theori quantifi|2016|2763.0
2767|MOREIRA, THIERRY PINHEIRO&PEREZ, MAURICIO LISBOA&OLIVEIRA WERNECK, RAFAEL DE&Eduardo Alves do Valle Junior|retriev lost dog featur|2016|2767.0
2768|JACOBOSKI, L. I.&Vanderlei Júlio Debastiani&DE MENDONÇA-LIMA, A.&HARTZ, S. M.|divers bird communiti respond chang landscap caus eucalyptus plantat|2016|2768.0
2770|KRIDI, DOUGLAS S.&DE CARVALHO, CARLOS GIOVANNI N.&Danielo Gonçalves Gomes|applic sensor network monitor pattern detect|2016|2770.0
2771|BORGIA, ELEONORA&Danielo Gonçalves Gomes&LAGESSE, BRENT&LEA, RODGER&PUCCINELLI, DANIELE|issu thing research challeng|2016|2771.0
2776|Paulo E Pillon&Emerson Carlos Pedrino&Valentin O. Roda&Maria do Carmo Nicoletti|hardwar orient ad hoc comput base method structur element decomposit base algorithm|2016|2776.0
2777|GOHARA, ANDERSON&PAZOTI, MÁRIO&SILVA, FRANCISCO&PEREIRA, DANILLO&Almir Olivette Artero&PITERI, MARCO|approach road detect laser data imag|2016|2777.0
2779|Hermano Lustosa&Fabio Andre Machado Porto&Pablo Blanco&Patrick Valduriez|databas system support simul data|2016|2779.0
2780|Thiago Schons&Xavier, C.R.&Alexandre Gonçalves Evsukoff&Nelson Francisco Favilla Ebecken&Vinicius da Fonseca Vieira|analysi spread pattern generat model|2016|2780.0
2781|Xavier, C.R.&Vinicius da Fonseca Vieira&Alexandre Gonçalves Evsukoff|popul algorithm influenc maxim|2016|2781.0
2784|Rodolfo Wanderson Lima Coutinho&BOUKERCHE, AZZEDINE&VIEIRA, LUIZ F. M.&LOUREIRO, ANTONIO A. F.|design protocol sensor network|2016|2784.0
2785|Rodolfo Wanderson Lima Coutinho&Azzedine Boukerche&Luiz Filipe Menezes Vieira&Antonio Alfredo Ferreira Loureiro|design guidelin rout network|2016|2785.0
2787|ALEXANDRE DA SILVA, VEITH&Julio Cesar Santos dos Anjos&EDISON PIGNATON, DE FREITAS&THOMAS J., LAMPOLTSHAMMER&CLAUDIO F., GEYER|strategi big data analyt lambda architectur volatil environ|2016|2787.0
2790|George Henrique Godim da Fonseca&Haroldo Gambini Santos&CARRANO, EDUARDO G.|accept hill climb school|2016|2790.0
2794|Paulo Henrique Lopes Silva&MEDEIROS FILGUEIRA BURLAMAQUI, AQUILES|system creation program avail distribut robot team knowledg|2016|2794.0
2796|Helen Sharp&DITTRICH, YVONNE&Cleidson Ronald Botelho de Souza|role ethnograph studi empir softwar engin|2016|2796.0
2798|Ricardo Linden|teach good program evalu|2016|2798.0
2807|João Carlos de Castro Pena&Danilo Marques de Magalhães&Ana Clara Mourao Moura&Robert J. Young&Marcos Rodrigues|infrastructur high urban citi role veget preserv|2016|2807.0
2811|RENATA DUTRA BRAGA&Fábio Nogueira de Lucena&Ribeiro-Rotta|inform model care defin consensus model health record|2016|2811.0
2812|Renata Dutra Braga&Panel of specialists in health&Fábio Nogueira de Lucena&Ribeiro-Rotta|inform model care|2016|2812.0
2814|MARTINS, V.S.G.&Abner Cardoso Rodrigues Neto&CERDEIRA, H.A.&MACHADO, B.S.|phase lag synchron analysi system direct relat|2016|2814.0
2815|Abner Cardoso Rodrigues Neto&CERDEIRA, HILDA A.&MACHADO, BIRAJARA SOARES|influenc hub structur network seizur|2016|2815.0
2816|FONSECA, MONIQUE T.&Abner Cardoso Rodrigues Neto&CEZAR, LUANA C.&FUJITA, ANDRE&SORIANO, FRANCISCO GARCIA&STEINER, ALEXANDRE A.|hypothermia sepsi self limit respons|2016|2816.0
2817|Diego Fernandes Nehab&MAXIMO, ANDRÉ|filter input extens|2016|2817.0
2823|Clyde William Fraisse&Caroline Staub&Oxana Uryasev&Ana Paula Wagner&josé Henrique Debastiani Andreis&Thiago Borba&Vinícius Andrei Cerbaro&Eduardo Gelcer&Willingthon Pavan&Diego Pequeno&Daniel Perondi&Xiaozhen Shen|tool manag climat risk agricultur|2016|2823.0
2824|DE LIMA, MARCELO ARTUR XAVIER&Thárcylla Rebecca Negreiros Clemente&DE ALMEIDA, ADIEL TEIXEIRA|alloc voltag regul electr distribut system approach base veto model|2016|2824.0
2826|VASCONCELOS, RAFAEL OLIVEIRA&VASCONCELOS, IGOR&Markus Endler|softwar reconfigur distribut data stream system|2016|2826.0
2827|VELAZQUEZ, AMADO&MARTÍNEZ-GARCÍA, ANA I.&FAVELA, JESÚS&Sergio Fabian Ochoa|adapt support age action research studi|2016|2827.0
2828|MEDINA, ESUNLY&LOPEZ, DAVID&MESEGUER, ROC&Sergio Fabian Ochoa&ROYO, DOLORS&SANTOS, RODRIGO|mobil autonom sens unit masu framework support distribut pervas data sens|2016|2828.0
2829|SANTOS, RODRIGO&OROZCO, JAVIER&Sergio Fabian Ochoa&MESEGUER, ROC&EGGLY, GABRIEL&PISTONESI, MARCELO|mac protocol support monitor underwat space|2016|2829.0
2830|GUTIERREZ, FRANCISCO J.&Sergio Fabian Ochoa&ZURITA, GUSTAVO&BALOIAN, NELSON|understand student particip cours communiti case studi|2016|2830.0
2831|ALHADEFF, ANDREI&LEON, SOFIE E.&Waldemar Celes Filho&Paulino, Glaucio H.|massiv mesh refin coarsen fractur simul|2016|2831.0
2832|LOZANO, ELIAS&ROEHL, DEANE&Waldemar Celes Filho&GATTASS, MARCELO|algorithm generat pack domain|2016|2832.0
2833|DE SOUSA JUNIOR, LUIS CARLOS&DOS SANTOS, LUIZ OTÁVIO SCHMALL&DE SOUZA RIOS, VICTOR&ARAÚJO, CHRYSTIANO&Waldemar Celes Filho&SEPEHRNOORI, KAMY|methodolog control transmiss fractur reservoir simul|2016|2833.0
2834|Ícaro Lins Leitão da Cunha&Luiz Marcos Garcia Gonçalves|adapt hybrid approach revisit visibl pipelin|2016|2834.0
2835|Sujal Bista&Ícaro Lins Leitão da Cunha&Amitabh Varshney|depth imag generat depth percept|2016|2835.0
2837|Eduardo Simões Lopes Gastal|high dimension edg awar filter|2016|2837.0
2839|Carnielli, Walter A.&Marcelo Esteban Coniglio|set theori predic consist|2016|2839.0
2840|Marcelo Esteban Coniglio&ESTEVA, FRANCESC&GODO, LLUÍS|set logic degre preserv logic|2016|2840.0
2841|Marcelo Esteban Coniglio&Aldo Figallo-Orellano&Ana Claudia Golzio|theori logic|2016|2841.0
2842|DE OLIVEIRA MOURA, LORENA&Daniela de Carvalho Lopes&Steidle Neto, Antonio José&DE CASTRO LOUBACK FERRAZ, LEILA&DE ALMEIDA CARLOS, LANAMAR&MARTINS, LUMA MOREIRA|evalu techniqu automat classif lettuc base spectral reflect|2016|2842.0
2843|Antonio José Steidle Neto&MOURA, LORENA DE OLIVEIRA&Daniela de Carvalho Lopes&CARLOS, LANAMAR DE ALMEIDA&MARTINS, LUMA MOREIRA&FERRAZ, LEILA DE CASTRO LOUBACK|predict pigment content lettuc base spectroscopi|2016|2843.0
2846|Eduardo Uchoa Barboza&PECIN, DIEGO&Pessoa, Artur&POGGI, MARCUS&VIDAL, THIBAUT&Subramanian, Anand|new benchmark instanc capacit vehicl rout problem|2016|2846.0
2848|Paulo Angelo Alves Resende&DOREA, CHANG CHUNG YU|model identif effici determin criterion|2016|2848.0
2849|Mayra Frozoni Rebolla&Eliete Maria Silva&Jancarlo Ferreira Gomes&Alexandre Xavier Falcão&Maria Vicentina Frozoni Rebola&Regina Maura Bueno Franco|preval spp children staff member attend public urban school sao state brazil|2016|2849.0
2850|Joseane Balan da Silva&Gleison Daion Piovezana Bossolani&Camila Piva&Greicy Brisa Malaquias Dias&Jancarlo Ferreira Gomes&Diogo Francisco Rossoni&Lúcio Tadeu Mota&Max Jean de Ornelas Toledo|distribut infect villag southern brazil|2016|2850.0
2851|Carlos Noriyuki Kaneto&Daniel Fontana Ferreira Cardia&Jancarlo Ferreira Gomes&Lucas Vinicius Shigaki de Matos&Julia Cestari Pierucci&Katia Denise Saraiva Bresciani|anthelmint resist sheep gastrointestin nematod northwest region sao state|2016|2851.0
2852|Sandra Valéria Inácio&Pamella Almeida Freire Casemiro&Marcelo Vasconcelos Meireles&Katia Denise Saraiva Bresciani&Jancarlo Ferreira Gomes&Bruno César Miranda Oliveira&Alexandre Xavier Falcão&Celso Tetsuo Nagase Suzuki&Bianca Martins dos Santos&Monally Conceição Costa de Aquino&Rafaela Silva de Paula Ribeiro&Danilla Mendes de Assunção|valid techniqu detect spp oocyst bovin fece|2016|2852.0
2853|Katia Denise Saraiva Bresciani&André Luiz Baptista Galvão&Amanda Leal de Vasconcellos&Thaís Rabelo dos Santos&Carlos Noriyuki Kaneto&Milena Araúz Viol&Jancarlo Ferreira Gomes&Elizabeth Bisland|aspect felin toxoplasmosi|2016|2853.0
2854|Cristiane Neri Nobre&Magali Rezende Gouvea Meireles&Niltom Vieira Junior&Monica Neli de Resende&Lucivânia Ester da Costa&Rejane Correa da Rocha|use softwar calculus teach learn tool|2016|2854.0
2855|DE MOURA, EDLENO SILVA&HERRERA, MAURO ROJAS&SANTOS, LEONARDO&Tayana Uchôa Conte|softwar impact economi environ|2016|2855.0
2857|Jarbas Joaci de Mesquita Sá Junior&BACKES, ANDRÉ RICARDO|elm base signatur textur classif|2016|2857.0
2858|Phillipe Rodrigues Sampaio&TOINT, PH. L.|experi deriv trust funnel method nonlinear optim problem nonlinear constraint|2016|2858.0
2860|PEDRASSANI DE LIRA, CAROLINA&Priscyla Waleska Targino de Azevedo Simões&TONIAZZO DE ABREU, LARISSA LETIELI&VEIGA SILVA, ANA CAROLINA&Leandro Luiz Mazzuchello&ROSA, MARIA INÊS&Eros Comunello&DE SOUZA PIRES, MARIA MARLENE&Luciane Bisognin Ceretta&Paulo João Martins|use data mine predict risk factor associ osteoporosi women|2016|2860.0
2861|Priscyla Waleska Targino de Azevedo Simões&Gustavo de Agostin&Ricardo Rampinelli Formigoni&Felipe Borges Tomaz&Erik Paul Winnikow|model appli breast cancer base network|2016|2861.0
2862|Priscyla Waleska Targino de Azevedo Simões&Maitê Gabriel dos Passos&Larissa Letieli de Abreu&Diego Garcia&Claudia Maria Cabral Moro Barra&Abigail Lopes&Maria Marlene de Souza Pires&Paulo João Martins&Luciane Bisognin Ceretta|accuraci decis support system retinopathi|2016|2862.0
2863|Francielle Rosso Mazzuchello&Lisiane Tuon Generoso Bitencourt&Priscyla Waleska Targino de Azevedo Simões&Josete Mazon&Valdemira Santina Dagostin&Cristiane Damiani Tomasi&Neiva Junkes Hoepers&Ioná Vieira Bez Birolo&Luciane Bisognin Ceretta|knowledg attitud adher treatment individu hypertens diabet mellitus|2016|2863.0
2864|Paula Fernanda de Araújo&Viviane Raupp Nunes de Araújo&Luciane Bisognin Ceretta&Soraia Netto&Marlowa Marcelino Crema&Priscyla Waleska Targino de Azevedo Simões&Fabiano Goulart Azambuja&Renan Antônio Ceretta|characterist patient submit surgeri clinic southern santa|2016|2864.0
2865|LUZ, EDUARDO JOSÉ DA S.&SCHWARTZ, WILLIAM ROBSON&CÁMARA-CHÁVEZ, GUILLERMO&David Menotti Gomes|base classif arrhythmia detect survey|2016|2865.0
2866|Gabriel Resende Gonçalves&Sirlene Pio Gomes da Silva Peixoto&David Menotti Gomes&William Robson Schwartz|benchmark licens plate charact segment|2016|2866.0
2869|Francisco do Nascimento Júnior&GUIMARAES, KATIA S.|copi number variat detect unravel problem aspect|2016|2869.0
2870|VOGT, NATHAN&Miguel Pinedo-Vasquez&BRONDÍZIO, EDUARDO S.&RABELO, FERNANDO G.&FERNANDES, KATIA&Almeida, Oriana&Sérgio Luiz de Medeiros Rivero&DEADMAN, PETER J.&DOU, YUE|knowledg adapt chang flood pattern amazon delta|2016|2870.0
2872|ALVES, J.R.&DE QUEIROZ, R.A.B.&Rodrigo Weber dos Santos|simul perfus contrast myocardium formul flow media|2016|2872.0
2873|Ruy Freitas Reis&Rodrigo Weber dos Santos&Marcelo Lobosco|plasma flow model interstiti tissu infect|2016|2873.0
2874|OLIVEIRA, R. S.&Rocha, B. M.&Denise Burgarelli Duczmal&Meira Junior, Wagner&Rodrigo Weber dos Santos|simul cardiac electrophysiolog combin adapt mesh refin algorithm|2016|2874.0
2875|OLIVEIRA, R. S.&GOUVÊA DE BARROS, BRUNO&GOMES, JOHNNY MOREIRA&LOBOSCO, M&ALONSO, SERGIO&Markus Baer&Rodrigo Weber dos Santos|interstiti repar fibrosi substrat cardiac ectop pacemak reentri|2016|2875.0
2876|EASTMAN, JUSTIN&SASS, JULIAN&GOMES, JOHNNY M.&Rodrigo Weber dos Santos&CHERRY, ELIZABETH M.|delay equat induc model electrophysiolog|2016|2876.0
2877|ALONSO, SERGIO&Rodrigo Weber dos Santos&BÄR, MARKUS|reentri ectop pacemak emerg dimension model slab cardiac tissu diffus near percol threshold|2016|2877.0
2878|Ruy Freitas Reis&Rodrigo Weber dos Santos&CAMPOS, J.O.&LOBOSCO, M|interstiti pressur dynam infect|2016|2878.0
2879|Tales L. Fonseca&Leonardo Goliatt&Luciana C. D. Campos&Bastos&Barra, Luis Paulo&Rodrigo Weber dos Santos|machin learn approach estim simul cardiac eject fraction electr imped tomographi|2016|2879.0
2880|Raphael Pereira Cordeiro&SACHETTO OLIVEIRA, RAFAEL&Rodrigo Weber dos Santos&LOBOSCO, M|improv perform cardiac simul multi architectur coalesc data kernel scheme|2016|2880.0
2881|Yanhui Liang&Fusheng Wang&Darren Treanor&Derek Magee&Nick Roberts&George Luiz Medeiros Teodoro&Yangyang Zhu&Jun Kong|framework vessel analysi slide imag tissu section|2016|2881.0
2882|Johannes Stegmaier&Fernando Amat&William C. Lemon&George Luiz Medeiros Teodoro&Ralf Mikut&Katie McDole&Yinan Wan&Philipp J. Keller|time dimension cell segment larg scale microscopi data develop embryo|2016|2882.0
2885|Malva Andrea Mancuso&Francéllwika Azevedo&Arci Dirceu Wastowaki&Mariele Fioreze|determin properti water sediment land use energi dispers x ray fluoresc spectrometri|2016|2885.0
2886|Cristiane Graepin&Malva Andrea Mancuso&Mariza Camargo&José Luiz Silvério da Silva&Willian Borba|aquif recharg estim framework water bodi partial forest sub basin northwest rio grand|2016|2886.0
2887|Moser Silva Fagundes&OSSOWSKI, SASCHA&CERQUIDES, JESÚS&NORIEGA, PABLO|design evalu norm agent base normat decis process|2016|2887.0
2890|LOPES, CARLA DINIZ&BECKER, TIAGO&DE JESUS KOZAKEVICIUS, ALICE&RASIA-FILHO, ALBERTO A.&MACQ, BENOIT&Altamiro Amadeu Susin|evalu wavelet method compar individu risk alcohol|2016|2890.0
2891|Ricardo Tavares Antunes de Oliveira&Thaíze Fernandes Oliveira&Paulo Renato Alves Firmino&Tiago Alessandro Espinola Ferreira|copula base time seri combin forecast|2016|2891.0
2892|Elia Yathie Matsumoto&DEL-MORAL-HERNANDEZ, EMILIO|improv regress predict point reliabl estim base error scenario|2016|2892.0
2894|Caio Araújo Teixeira Campos&Abner Luiz Panho Marciano&Omar Paranaiba Vilela Neto&Frank Sill|use univers clock scheme|2016|2894.0
2898|Juliana de Melo Bezerra&Gabriel Chagas Marques&Celso Massaki Hirata|measur friendship strength onlin social network|2016|2898.0
2899|Juliana de Melo Bezerra&Lara Santos Diniz&Victor da Silva Montalvão&Celso Massaki Hirata|motiv onlin team investig task signific coordin incent mechan|2016|2899.0
2910|Cassius Ariovaldo Paim&Jorge Luis Victória Barbosa|octopus model aid care diseas|2016|2910.0
2915|JOHN, EDWARD SIMON&RIGO, SANDRO JOSÉ&Jorge Luis Victória Barbosa|robot adapt multimod interact improv peopl communic disord|2016|2915.0
2917|Fabio Rossi&Miguel Xavier&Cesar Augusto Fonticielha De Rose|e eco perform awar energi effici cloud data center orchestr|2016|2917.0
2920|Adriano Pasqualotti|technolog age signific interact inform age keynot|2016|2920.0
2921|Pablo Pasqualotti&SILVA, PETTER F.&OLIVEIRA SIQUEIRA, L.&Adriano Pasqualotti|effect care train game marker pain|2016|2921.0
2923|Fernando Moraes de Oliveira&LANZILLOTTI, REGINA S.&DA COSTA, ROSA M.E. MOREIRA&VENTURA, PAULA&GONCALVES, RAQUEL&DE CARVALHO, LUIS A. VIDAL|realiti exposur therapi patient control logic system|2016|2923.0
2924|MALONE, SPARKLE L.&TULBURE, MIRELA G.&PÉREZ-LUQUE, ANTONIO J.&ASSAL, TIMOTHY J.&BREMER, LEAH L.&Debora Pignatari Drucker&HILLIS, VICKEN&VARELA, SARA&GOULDEN, MICHAEL L.|drought resist california ecosystem evalu chang carbon dynam satellit imageri|2016|2924.0
2925|Vinicius Rosa Cota&DRABOWSKI, BRUNA MARCELA BACELLAR&DE OLIVEIRA, JASIARA CARLA&Moraes, Márcio Flávio Dutra|amygdala develop prosthesi tempor code stimul|2016|2925.0
2931|CARDOSO, SILVIO D.&AMANQUI, FLOR K.&SERIQUE, KLEBERSON J.A.&DOS SANTOS, JOSÉ L.C.&Dilvan de Abreu Moreira|web interact gazett support link open data|2016|2931.0
2932|Tiago de Oliveira Januario&Sebastián Alberto Urrutia|neighborhood structur robin schedul problem|2016|2932.0
2934|Rafael Augusto de Melo&Phillippe Samer&Sebastián Alberto Urrutia|decomposit approach heurist generat span tree number branch vertic|2016|2934.0
2935|CAVALCANTE, EVELLYN&OPPEN, JOHAN&Phillippe Samer Lallo Dias&Sebastián Alberto Urrutia|combinatori relax bound preprocess berth alloc problem|2016|2935.0
2936|Januario, Tiago&Sebastián Alberto Urrutia&DE WERRA, DOMINIQUE|sport schedul search space connect riffl shuffl driven approach|2016|2936.0
2938|Gustavo Magalhães Moura&Rodrigo Luis de Souza da Silva|analysi evalu featur detect track techniqu focus augment realiti applic|2016|2938.0
2939|Tiago Roberto Balen&Vaz, Rafael G.&FERNANDES, GUSTAVO S.&Goncalez, Odair L.|influenc altern bias tid effect irradi mix signal programm array|2016|2939.0
2940|GONZALEZ, CARLOS J.&CHENET, CRISTIANO P.&Tiago Roberto Balen|fault inject mix signal programm soc design divers mitig|2016|2940.0
2941|FUSCO, DANIEL&Tiago Roberto Balen|radiat effect low power ultra power voltag refer|2016|2941.0
2945|LA ROSA CENTENO, LUDIMILA&DE CASTRO, FERNANDO CÉSAR COMPARSI&Maria Cristina Felippetto De Castro&MÜLLER, CANDICE&RIBEIRO, SANDRO MACHADO|radio signal classif base subspac decomposit network|2016|2945.0
2947|VALLE, ODILSON&MONTEZ, CARLOS&MEDEIROS DE ARAUJO, GUSTAVO&Francisco Vasques&MORAES, RICARDO|retransmiss mechan base cooper relay network code|2016|2947.0
2949|Ricardo Sousa Silvestre|karma theori determin fatal freedom|2016|2949.0
2950|Daniel Avila Vecchiato&VIEIRA, MARCO&MARTINS, ELIANE|peril android secur configur|2016|2950.0
2952|RAJARAMAN, ASHOK&João Paulo Pereira Zanetti&MANUCH, JAN&CHAUVE, CEDRIC|algorithm complex result map problem|2016|2952.0
2954|STOREY, MARGARET-ANNE&ZAGALSKY, ALEXEY&Fernando Marques Figueira Filho&SINGER, LEIF&GERMAN, DANIEL|social communic channel shape challeng participatori cultur softwar develop|2016|2954.0
2955|AGUIAR, Y.Q. DE&ZIMPECK, A.L.&Cristina Meinhardt&REIS, R.|event fault reliabl evalu tool|2016|2955.0
2956|Lorena da Silva Paes&Juliana Pereira Borges&Felipe Amorim Cunha&Maria das Graças Coelho de Souza&Fátima Zely Garcia de Almeida Cyrino&Daniel Alexandre Bottino&Eliete Bouskela&Paulo Farinatti|oxygen exchang ratio distanc comparison method equal exercis volum rat|2016|2956.0
2957|ANDRADE, EWERTON&Marcos Antonio Simplicio Junior&BARRETO, PAULO&SANTOS, PAULO|password hash secur time memori trade off|2016|2957.0
2958|Marcos Antonio Simplicio Junior&Marcos Vinicius Maciel da Silva&Renan Cerqueira Afonso Alves&Tiago Shibata|lightweight escrow authent agreement internet thing|2016|2958.0
2959|João Henrique Gonçalves Sá&Marina de Fátima de Sá Rebelo&Marco Antonio Gutierrez&Alexandra Brentani&Sandra Grisi&Leonardo Horn Iwaya&Marcos Antonio Simplicio Junior&Tereza Cristina Melo de Brito Carvalho|secur mobil health system larg scale data collect primari care|2016|2959.0
2961|Daniel Pedro Bezerra Chaves&Carlos Eduardo Correia de Souza&Cecilio José Lins Pimentel|map shape symmetri|2016|2961.0
2962|SOUZA, CARLOS&EVANGELISTA, JOÃO&Daniel Pedro Bezerra Chaves&PIMENTEL, CECILIO|spectral analysi chaotic map base hyperbol tangent function|2016|2962.0
