|autores|titulo|ano|group
751|DE SIQUEIRA, MARCOS ANTONIO&VAN ?T HOOFT, FABIAN NICOLAAS CHRISTIAAN&DE OLIVEIRA, JULIANO RODRIGUES FERNANDES&Edmundo Roberto Mauro Madeira&ROTHENBERG, CHRISTIAN ESTEVE|provid optic network servic polici base transport|2015|751.0
752|Ariadne de Andrade Costa&COPELLI, MAURO&KINOUCHI, OSAME|synaps produc self organ critic|2015|752.0
753|Gerson de Souza Faria&KIM, HAE YONG|identif press key time differ arriv vibrat|2015|753.0
755|Josh Merel&Donald Matthew Pianto&John P. Cunningham&Liam Paninski|encod decod optim brain comput interfac|2015|755.0
756|Milana Lima dos Santos&DI SANTO, SILVIO GIUSEPPE|evalu voltag profil joul loss wavelength power transmiss line|2015|756.0
757|Tiago dos Santos Patrocínio&Ivan Saraiva Silva|method classifi paper begin student natur languag process embed processor case studi|2015|757.0
758|Eugênio Spanó Rosa&RICARDO AUGUSTO MAZZA&MORALES, R. E.&HENDY T. RODRIGUES&Cristiane Cozin|analysi slug track model ga liquid flow pipe|2015|758.0
759|José Renato Gaziero Cella&Marlus Heriberto Arns de Oliveira|case anonym effect inform freedom|2015|759.0
761|KRAMER, RAPHAEL&SUBRAMANIAN, ANAND&Thibaut Victor Gaston Vidal&CABRAL, LUCÍDIO DOS ANJOS F.|approach pollut rout problem|2015|761.0
762|Thibaut Victor Gaston Vidal&BATTARRA, MARIA&SUBRAMANIAN, ANAND&ERDOG'AN, GÜNE'|cluster vehicl rout problem|2015|762.0
763|Thibaut Victor Gaston Vidal&CRAINIC, TEODOR GABRIEL&GENDREAU, MICHEL&PRINS, CHRISTIAN|time problem algorithm time decis sequenc activ|2015|763.0
764|LAHRICHI, NADIA&CRAINIC, TEODOR GABRIEL&GENDREAU, MICHEL&REI, WALTER&CRI'AN, GLORIA CERASELA&Thibaut Victor Gaston Vidal|search framework decis attribut optim applic|2015|764.0
765|KRAMER, RAPHAEL&MACULAN, NELSON&SUBRAMANIAN, ANAND&Thibaut Victor Gaston Vidal|speed departur time optim algorithm pollut rout problem|2015|765.0
766|EL HACHEMI, NIZAR&CRAINIC, TEODOR GABRIEL&LAHRICHI, NADIA&REI, WALTER&Thibaut Victor Gaston Vidal|solut integr optim applic search vehicl rout|2015|766.0
767|Thibaut Victor Gaston Vidal&MACULAN, NELSON&OCHI, LUIZ SATORU&VAZ PENNA, PUCA HUACHI|neighborhood implicit custom select vehicl rout problem profit|2015|767.0
768|Thibaut Victor Gaston Vidal&CRAINIC, TEODOR GABRIEL&GENDREAU, MICHEL&PRINS, CHRISTIAN|time window relax vehicl rout heurist|2015|768.0
769|ALI, NAUMAN BIN&PETERSEN, KAI&Breno Bernard Nicolau de França|evalu simul assist valu stream map softwar product develop case|2015|769.0
770|Breno Bernard Nicolau de França&Guilherme Horta Travassos|simul base studi softwar engin matter valid|2015|770.0
771|Rodrigo Rocha Gomes e Souza&Roberto Bittencourt&Christina Brandão Von Flach|reject review backout issu reopen|2015|771.0
772|Rodrigo Rocha Gomes e Souza&Christina von Flach Garcia Chavez&BITTENCOURT, ROBERTO A.|rapid releas patch backout softwar analyt approach|2015|772.0
773|FARIAS, KLEINNER&Alessandro Garcia&JON WHITTLE&Christina von Flach Garcia Chavez&Lucena, Carlos|evalu effort compos design model control experi|2015|773.0
775|CHODORIWSKY, JACOB&Lucia Rosana Moura|algorithm group test complex|2015|775.0
776|Jonathan Leontino Medina&Maria Istela Cagnin&Debora Maria Barroso Paiva|investig access web base map|2015|776.0
777|VIEIRA, VILSON&Renato Fabbri&SBRISSA, DAVID&DA FONTOURA COSTA, LUCIANO&TRAVIESO, GONZALO|approach paint style|2015|777.0
778|Flávio Mota Medeiros&Christian Kästner&Márcio de Medeiros Ribeiro&Sarah Nadi&GHEYI, ROHIT|love hate relationship c preprocessor interview studi artifact|2015|778.0
779|Marcela Quiroz Castellanos&Laura Cruz Reyes&José Torres - Jiménez&Claudia Guadalupe Gómez Santillán&Héctor J. Fraire Huacuja&Adriana Cesário de Faria Alvim|group algorithm control gene transmiss bin pack problem|2015|779.0
780|Pablo Alberto Dalbem de Castro|immun inspir extrem learn machin perform evalu conceptu analys|2015|780.0
781|Cássio Martini Martins Pereira&DE MELLO, RODRIGO F.|homolog time seri data cluster|2015|781.0
782|Cássio Martini Martins Pereira&DE MELLO, RODRIGO F.|pt project topolog stream cluster algorithm|2015|782.0
783|Joao Gari da Silva Fonseca Junior&Oozeki Takashi&Hideaki Ohtake&Takashima Takumi&Ogimoto Kazuhiko|use maximum likelihood input data similar obtain predict interv forecast photovolta power gener|2015|783.0
784|IWAFUNE, YUMIKO&IKEGAMI, TAKASHI&Joao Gari da Silva Fonseca Junior&OOZEKI, TAKASHI&Ogimoto, Kazuhiko|home energi manag batteri system consid divers household|2015|784.0
785|OHTAKE, HIDEAKI&Joao Gari da Silva Fonseca Junior&Takashima, Takumi&OOZEKI, TAKASHI&SHIMOSE, KEN-ICHI&YAMADA, YOSHINORI|characterist irradi forecast obtain japan meteorolog agenc mesoscal model|2015|785.0
787|BAHIA, RITA DE CÁSSIA&AGUILAR-VILDOSO, CARLOS IVAN&Edna Dora Martins Newman Luz&Uilson Vanderlei Lopes&MACHADO, REGINA CELLE REBOUÇAS&Ronan Xavier Corrêa|resist black pod diseas segreg cacao tree popul|2015|787.0
788|Uilson Vanderlei Lopes&José Raimundo Bonadie Marques|divers inbreed inbreed depress rubber tree hevea spp|2015|788.0
789|Milton Macoto Yamada&Fábio Gelape Faleiro&Uilson Vanderlei Lopes&José Luis Pires|paramet resist ceratocysti wilt infect|2015|789.0
792|Amighi, Afshin&Pedro de Carvalho Gomes&Gurov, Dilian&Huisman, Marieke|provabl control flow graph java program except|2015|792.0
793|Veronica Oliveira de Carvalho&Fabiano Fernandes dos Santos&Solange Oliveira Rezende|metric associ rule cluster assess|2015|793.0
794|Lázaro Pereira de Oliveira&Claudio Pitassi&Antonio Augusto Goncalves|technolog cooper network bio role inform commun technolog|2015|794.0
795|EMMERTON, CRAIG A.&ST. LOUIS, VINCENT L.&HUMPHREYS, ELYN R.&GAMON, JOHN A.&BARKER, JOEL D.&Gilberto Zonta Pastorello|ecosystem exchang co rapidli chang arctic landscap|2015|795.0
796|MENDES ARRUDA, PRISCILLA&CANAL NETO, ANTÔNIO&Mauro Cesar Martins Campos&COELHO DA CRUZ, HENRIQUE RAULINO&DOS SANTOS, FÁBIO ALVES|molecul adapt basi set optim quantum mont carlo method|2015|796.0
798|Ricardo dos Santos Ferreira&Luciana Rocha&José Augusto Miranda Nacif&André Gustavo Santos&Stephan Wong&Luigi Carro|runtim placement rout low complex graph travers|2015|798.0
799|VIANA, SADRAQUE S.&VIEIRA, LUIZ F. M.&VIEIRA, MARCOS A. M.&José Augusto Miranda Nacif&VIEIRA, ALEX B.|survey design sensor node|2015|799.0
800|Elisia Rodrigues Corrêa&Gil Carlos Rodrigues Medeiros&Willian Silva Barros&Valmor João Bianchi|evalu rank macadamia genotyp model|2015|800.0
801|FRAZZON, ENZO MOROSINI&Moisés Lima Dutra&VIANNA, WILLIAM BARBOSA|big data appli physic logist system conceptu model perspect|2015|801.0
803|BRAZIL, EMILIO VITAL&AMORIM, RONAN&Mario Costa Sousa&Luiz Velho&Luiz Henrique de Figueiredo|sketch base model mesh|2015|803.0
804|Julliany Sales Brandão&Thiago Ferreira de Noronha&Mauricio Guilherme de Carvalho Resende&Celso Carneiro Ribeiro|algorithm round load schedul|2015|804.0
806|Anisio Mendes Lacerda&SANTOS, RODRYGO L. T.&VELOSO, ADRIANO&Ziviani, Nivio|improv deal recommend explor exploit strategi|2015|806.0
809|Fabricio Buzeto&Tiago Barros Pontes e Silva&Carla Denise Castanho&Ricardo Pezzuol Jacobi|platform build reconfigur game|2015|809.0
811|Laércio Lima Pilla&BOZZETTI, TIAGO C&CASTRO, MÁRCIO&NAVAUX, PHILIPPE O A&MÉHAUT, JEAN-FRANÇOIS|benchmark extens evalu global schedul algorithm|2015|811.0
812|Laércio Lima Pilla&OLIVEIRA, DANIEL A. G.&LUNARDI, CAIO&NAVAUX, Philippe O. A.&CARRO, LUIGI&RECH, PAOLO|memori access time input size effect parallel processor reliabl|2015|812.0
813|CRUZ, EDUARDO H.M.&DIENER, MATTHIAS&ALVES, MARCO A.Z.&Laércio Lima Pilla&NAVAUX, PHILIPPE O.A.|local awar page tabl thread data map|2015|813.0
814|Min C Lin&Veronica Moyano&Rautenbach, Dieter&Jayme Luiz Szwarcfiter|maximum number domin induc match|2015|814.0
816|Flavia Bonomo&Celina M H Figueiredo&Guillermo Duran&Luciano Grippo&Martin D Safe&Jayme Luiz Szwarcfiter|probe co probe diamond graph|2015|816.0
817|Victor Campos&Rudini SAMPAIO&Ana Silva&Jayme Luiz Szwarcfiter|graph convex path order|2015|817.0
818|LIN, MIN CHIH&SOULIGNAC, FRANCISCO J.&Jayme Luiz Szwarcfiter|algorithm cluster edit problem graph|2015|818.0
821|Bernardo José da Silva Estácio&Rafael Prikladnicki|distribut pair program systemat literatur review|2015|821.0
822|Fabio Calefato&LANUBILE, FILIPPO&Tayana Uchôa Conte&Rafael Prikladnicki|assess impact time machin translat meet softwar project|2015|822.0
825|Alcides de Castro Amorim Neto&Prakki Satyamurth&Francis Wagner|characterist system amazon basin|2015|825.0
826|Rafael Garcia Miani&Estevam Rafael Hruschka Júnior|explor associ rule grow knowledg base|2015|826.0
827|Paulo Henrique Barchi&Estevam Rafael Hruschka Júnior|approach ontolog extens machin read|2015|827.0
831|Agnelo Rocha da Silva&Moghaddam, Mahta|design implement low power mid rang magnet induct base wireless underground sensor network|2015|831.0
832|Andrea Cassioli&Oktay Gunluk&Carlile Campos Lavor&Leo Liberti|vertex order distanc geometri|2015|832.0
833|Carlile Campos Lavor&R. Alves&Weber Figueiredo&Antonio Petraglia&Nelson Maculan|clifford algebra distanc geometri problem|2015|833.0
834|Andrea Cassioli&Benjamin Bardiaux&Guillaume Bouvier&Antonio Mucherino&Rafael Alves&Leo Liberti&Michael Nilges&Carlile Campos Lavor&Therese Malliavin|algorithm enumer protein conform verifi set distanc restraint|2015|834.0
835|Diogo de Carvalho Bezerra&Leandro Chaves Rêgo|multipli probabl distribut elicit problem applic confeder cup|2015|835.0
836|Leandro Chaves Rêgo&DOS SANTOS, ANDREA MARIA|probabilist prefer graph model conflict resolut|2015|836.0
838|BIANCHI, REINALDO A.C.&CELIBERTO, LUIZ A.&SANTOS, PAULO E.&Jackson Paul Matsuura&LOPEZ DE MANTARAS, RAMON|transfer knowledg heurist reinforc learn case base approach|2015|838.0
842|ALMEIDA, JURANDY&Jefersson Alex dos Santos&Waner Miranda&Bruna Alberton&Patrícia Morelatto&Torres, Ricardo da S.|deriv veget indic phenolog analysi program|2015|842.0
843|Lílian Chaves Brandão dos Santos&Silvio Jamil Ferzoli Guimarães&Jefersson Alex dos Santos|effici unsupervis band select rhythm|2015|843.0
850|BORGES, HUDSON S.&Marco Tulio de Oliveira Valente|mine usag pattern android|2015|850.0
851|Andre Hora&Nicolas Anquetil&Anne Etien&Stephane Ducasse&Marco Tulio de Oliveira Valente|automat detect system specif convent develop|2015|851.0
853|William Wagner Matos Lira&GianCarlo de Gusmão Gonçalves&ARAUJO, CATARINA NOGUEIRA&Adeildo Soares Ramos Junior&FRERY, ALEJANDRO CÉSAR|effect drill salt rock select case|2015|853.0
854|Artur Gomes de Oliveira&Ruth Gonçalves Duarte&Odésia Fernanda Gomes de Assis&João Batista Furlan Duarte&Juan Carlos Alvarado Alcocer|sustain solut bring profit|2015|854.0
855|Juan Carlos Alvarado Alcocer&João Batista Furlan Duarte&Marcelo Pereira&Mona Lisa Moura de Oliveira&Rita Karolinny Chaves de Lima&DAYSE MARIA BENEVIDES DE QUEIROZ&Glaydson Francisco Barros de Oliveira|mass energi balanc cashew nut shell gasif pilot unit util power gener|2015|855.0
856|Ivana Cardial de Miranda Pereira&FRANCISCO, NELSON|simul model hybrid genet algorithm energi awar manet rout plan|2015|856.0
857|MARCIA REGINA KONOPATSKI&Eduardo Godoy de Souza&Lucia Helena Pereira Nóbrega&Claudio Leones Bazzi&Davi Marcondes Rocha|variabl chemic attribut soil plant yield pear orchard|2015|857.0
858|Claudio Leones Bazzi&Eduardo Godoy de Souza&MARCIA REGINA KONOPATSKI&Lucia Helena Pereira Nóbrega&Miguel Oribe Opazzo|manag zone appli pear orchard|2015|858.0
859|DIEGO DOS SANTOS&Eduardo Godoy de Souza&Lúcia Helena Nóbrega&Claudio Leones Bazzi&Fernando Nakayama de Queiroz|physic properti soil soybean yield plant cover crop|2015|859.0
860|Gabrielle Jacklin Eler&SANTOS, ISRAEL SOUZA&DE MORAES, AMARILIS GIARETTA&COMAR, JURANDIR FERNANDO&Peralta, Rosane Marina&Bracht, Adelar|n gallat inhibitor pyruv carboxyl lactat gluconeogenesi|2015|860.0
863|MORENO, ADRIANA S.&PONARD, DENISE&MONNIER, NICOLE&LUNARDI, JOEL&BORK, KONRAD&SILVA, JR., WILSON ARAUJO&ARRUDA, L. KARLA&VALLE, SOLANGE O.R.&LEVY, SOLONI&FRAN'A, ALFEU T.&SERPA, FARADIBA S.&Helen Andrade Arcuri&PALMA, MARIO S.&CAMPOS, WAGNER N.&DIAS, MARINA M.|coagul factor xii gene mutat brazilian famili hereditari normal inhibitor|2015|863.0
864|DOS SANTOS-PINTO, JOSÉ ROBERTO APARECIDO&Helen Andrade Arcuri&PRIEWALDER, HELGA&SALLES, HELIANA CLARA&Palma, Mario Sérgio&LUBEC, GERT|structur model spider silk protein|2015|864.0
866|Jefferson Gustavo Martins&Oliveira, L. S.&BRITTO, A. S.&Sabourin, R.|forest speci recognit base classifi select dissimilar featur vector represent|2015|866.0
867|Marcelo Daniel Berejuck|network chip load balanc base interleav flit techniqu|2015|867.0
869|Fábio Hernandes&Fábio Hernandes&Matheus Henrique Rocha de Souza Lourenço|algorithm minimum span tree problem uncertain structur|2015|869.0
870|Anderson Corrêa de Lima&BRANCO, RODRIGO G.&CÁCERES, EDSON N.&GAIOSO, ROUSSIAN R.A.&FERRAZ, SAMUEL&SONG, SIANG W.&MARTINS, WELLINGTON S.|cgm algorithm maximum subsequ sum relat|2015|870.0
871|DE SÁ, PABLO H.C.G.&RAMOS, ROMMEL T.J.&Adonney Allan de Oliveira Veras&CARNEIRO, ADRIANA R.&PINHEIRO, KENNY C.&PINTO, ANNE C.&SOARES, SIOMAR C.&SCHNEIDER, MARIA P.C.&AZEVEDO, VASCO&SILVA, ARTUR|impact qualiti filter seq|2015|871.0
872|MATTOS-GUARALDI, ANA L.&HIRATA, RAPHAEL&AZEVEDO, VASCO&PACHECO, LUIS G. C.&SILVA, ARTUR&RAMOS, ROMMEL T. J.&GUIMARÃES, LUIS C.&SANTOS, CAROLINA S.&Adonney Allan de Oliveira Veras&CARNEIRO, ADRIANA R.&SOARES, SIOMAR C.&RAMOS, JULIANA N.&SOUZA, CASSIUS&VIEIRA, VERONICA V.|draft genom sequenc br strain urin hospit femal patient|2015|872.0
873|CAVALCANTE, ANA LÍDIA Q.&AZEVEDO, VASCO&SILVA, ARTUR&CARNEIRO, ADRIANA R.&DIAS, LARISSA M.&ALVES, JORIANNE T. C.&Adonney Allan de Oliveira Veras&GUIMARÃES, LUIS C.&ROCHA, FLÁVIA S.&GALA-GARCÍA, ALFONSO&RETAMAL, PATRICIO&RAMOS, ROMMEL T. J.|complet genom sequenc corynebacterium pseudotuberculosi strain isol hors chile|2015|873.0
874|GOMES DE SÁ, PABLO&SCHNEIDER, MARIA&SILVA, ARTUR&Adonney Allan de Oliveira Veras&FONTANA, CARLA SUERTEGARAY&ALEIXO, ALEXANDRE&BURLAMAQUI, TIBÉRIO&MELLO, CLAUDIO VIANNA&DE VASCONCELOS, ANA TEREZA RIBEIRO&PROSDOCIMI, FRANCISCO&RAMOS, ROMMEL|assembl annot rufou belli thrush genom|2015|874.0
875|PACHECO, LUIS G. C.&CARVALHO, ALEX F.&LEAL, CARLOS G.&FIGUEIREDO, HENRIQUE C. P.&RAMOS, JULIANA N.&VIEIRA, VERONICA V.&FARFOUR, ERIC&GUISO, NICOLE&HIRATA, RAPHAEL&AZEVEDO, VASCO&SILVA, ARTUR&MATTOS-GUARALDI, ANA L.&Rommel Thiago Juca Ramos&SANTOS, CAROLINA S.&Adonney Allan de Oliveira Veras&GUIMARÃES, LUIS C.&ABREU, VINÍCIUS&PEREIRA, FELIPE L.&SOARES, SIOMAR C.&DORELLA, FERNANDA A.|draft genom sequenc speci human corynebacteria implic better identif test|2015|875.0
876|LUQUE, A&NOBRE, MR&Maria Tereza Fernandes Abrahao|cost util secondari prevent propens score method databas|2015|876.0
877|LACHOWSKI, ROSANA&PELLENZ, MARCELO&Manoel Camillo de Oliveira Penna Neto&Edgard Jamhour&SOUZA, RICHARD|effici distribut algorithm construct span tree wireless sensor network|2015|877.0
878|MARIANI, WAGNER C.&Manoel Camillo de Oliveira Penna Neto&PELLENZ, MARCELO E.&Edgard Jamhour|channel alloc algorithm co exist base station ieee network|2015|878.0
880|CAMARGO, KAMILLA G&FERRARI, FABIANO C&Sandra Camargo Pinto Ferraz Fabbri|characteris state practic softwar test base process|2015|880.0
882|MATUSZEWSKI, DAMIAN J.&Roberto Marcondes Cesar Junior&STRICKLER, J. RUDI&BALDASSO, LUIS F.&LOPES, RUBENS M.|rhythm particl analysi sampl flow system applic plankton monitor|2015|882.0
884|MESQUITA, RAFAEL G.&SILVA, RICARDO M.A.&Carlos Alexandre Barros de Mello&MIRANDA, PÉRICLES B.C.|tune document imag race algorithm|2015|884.0
885|ROE, EDWARD&Carlos Alexandre Barros de Mello|restor imag color postcard|2015|885.0
886|Alberto Nicodemus Gomes Lopes Filho&Carlos Alexandre Barros de Mello|model forc reconstruct string degrad digit|2015|886.0
888|Lucia Vilela Leite Filgueiras&Soraia Silva Prietch&PRETI, JOÃO PAULO DELGADO|empower assist technolog mobil devic dui ecosystem|2015|888.0
889|SILVA, FRANCISCO AIRTON&MACIEL, PAULO&Rubens de Souza Matos Júnior|schedul tool cloud comput|2015|889.0
890|Jamilson Dantas&Rubens de Souza Matos Júnior&Jean Araujo&MACIEL, PAULO|eucalyptu base cloud avail model comparison cost cloud|2015|890.0
891|Silvio do Lago Pereira&Luiz Felipe Zarco dos Santos&Lucio Nunes de Lira|dialogu system coher reason inconsist knowledg base|2015|891.0
892|USBERTI, Fábio Luiz&Christiano Lyra Filho&Celso Cavellucci&José Federico Vizcaino González|criteria optim mainten activ power distribut network|2015|892.0
893|DE ASSIS, LAURA SILVA&GONZALEZ, JOSE FEDERICO VIZCAINO&USBERTI, FABIO LUIZ&Christiano Lyra Filho&Celso Cavellucci&VON ZUBEN, FERNANDO J.|switch alloc problem power distribut system|2015|893.0
894|LONGO, DOUGLAS HIURA&Patrícia Vilain|user scenario user interact diagram|2015|894.0
895|LONGO, DOUGLAS HIURA&WILGES, BEATRIZ&Patrícia Vilain&CISLAGHI, RENATO|fixtur setup object notat implicit test fixtur|2015|895.0
896|REIS-CUNHA, JOÃO LUÍS&RODRIGUES-LUIZ, GABRIELA F.&VALDIVIA, HUGO O.&Rodrigo de Paula Baptista&MENDES, TIAGO A. O.&DE MORAIS, GUILHERME LOSS&GUEDES, RAFAEL&Macedo, Andrea M.&BERN, CARYN&GILMAN, ROBERT H.&LOPEZ, CARLOS TALAVERA&ANDERSSON, BJÖRN&VASCONCELOS, ANA TEREZA&BARTHOLOMEU, DANIELLA C.|copi number variat reveal level plastic trypanosoma strain|2015|896.0
899|LAZZARINI, VICTOR&Keller, Damián&Marcelo Soares Pimenta|prototyp ubiquit music ecosystem|2015|899.0
900|Sandra Aparecida de Amo&Mouhamadou Saliou Diallo&Cheikh Talibouya Diop&Arnaud Giacometti&Arnaud Soulet|prefer mine user profil construct|2015|900.0
901|Priscila Vanessa da Silva Zabala Capriles&Luiz Phillippe Ribeiro Baptista&Isabella Alvim Guedes&Ana Carolina Ramos Guimarães&Marcelo Alves Ferreira&Laurent Emmanuel Dardenne|model dock studi isomeras leishmania major homo sapien analysi leishmaniasi treatment|2015|901.0
902|BONIOLO, GIOVANNI&D?AGOSTINO, MARCELLO&PIAZZA, MARIO&Gabriele Pulcini|ad logic toolbox biolog|2015|902.0
903|PIAZZA, MARIO&Gabriele Pulcini|unifi logic context sensit tabl|2015|903.0
904|CIARELLI, PATRICK MARQUES&Elias Silva de Oliveira|achiev compromis perform complex structur approach|2015|904.0
906|Malcon Miranda Mikami&Keyla Menecrys Sandrino&Maria Salete Marcon Gomes Vaz|approach model evolut databas model entiti framework code|2015|906.0
907|Maria Salete Marcon Gomes Vaz&Denia Falcao de Bittencourt&Monica Cristine Scherer Vaz&Albino Szesz Junior|inform technolog commun educ practic|2015|907.0
908|Mauren Louise Sguario Coelho de Andrade&ARRUDA, L.V.R.&MORALES, R.E.M.|segment phase flow represent level set method priori knowledg|2015|908.0
909|Alex Lopes Pereira&Osamu Saotome&Daniel Julien Sampaio|patch base histogram contour estim foreground classif|2015|909.0
910|DORS, O. L.&CARDACI, M. V.&HÄGELE, G. F.&Irapuan Rodrigues de Oliveira Filho&GREBEL, E. K.&PILYUGIN, L. S.&Priscila Freitas Lemes&KRABBE, A. C.|abund nuclei star form galaxi|2015|910.0
911|HERNANDEZ-JIMENEZ, J. A.&M.G. PASTORIZA&Charles José Bonatto&Irapuan Rodrigues de Oliveira Filho&Ângela C. Krabbe&Cláudia Winge|photometri dynam merger|2015|911.0
913|Aloizio Pereira da Silva&BURLEIGH, SCOTT&HIRATA, CELSO M.&OBRACZKA, KATIA|survey congest control delay disrupt network|2015|913.0
914|Orlando Lee&Mario Leston Rey|algorithm pack branch digraph|2015|914.0
915|Andréia Cristina dos Santos Gusmão&Letícia Rodrigues Bueno&Rodrigo de Alencar Hausen&Celina Miraglia Herrera de Figueiredo&Luerbio Faria|note level problem|2015|915.0
916|Luís Felipe Ignacio Cunha&Luis Antonio Kowada&Rodrigo de Alencar Hausen&Celina Miraglia Herrera de Figueiredo|faster algorithm sort transposit|2015|916.0
917|GREFFIER, J.&Francesco Macri&LARBI, A.&FERNANDEZ, A.&KHASANOVA, E.&Fabricio Ramos Silvestre Pereira&Choukri Mekkaoui&BEREGI, J.P.|dose reduct reconstruct optim ct protocol practic|2015|917.0
918|Daniel Fuentes&Hermano Tavares&Clarice Gorenstein&Patricia Rzezak&Fabricio Ramos Silvestre Pereira&Leandro F. Malloy-Diniz&Luciana C. Santos&Fábio L. S. Duran&Maria A. Barreiros&Cláudio C. Castro&Geraldo F. Busatto|map brain abnorm treat gambler|2015|918.0
924|Christian Baudet&Beatrice Donati&Blerina Sinaimeri&Pierluigi Crescenzi&Gautier, C.&Catherine Matias&SAGOT, M.- F.|reconstruct approxim bayesian comput|2015|924.0
926|BESSON, FELIPE&MOURA, PAULO&Fabio Kon&MILOJICIC, DEJAN|bring test driven develop web servic|2015|926.0
927|Martín Augusto Gagliotti Vigil&BUCHMANN, JOHANNES&CABARCAS, DANIEL&WEINERT, CHRISTIAN&WIESMAIER, ALEXANDER|integr authent proof exist term archiv survey|2015|927.0
928|Rodrigo da Rosa Righi&RODRIGUES, VINICIUS&ANDRE DACOSTA, CRISTIANO&GALANTE, GUILHERME&BONA, LUIS&FERRETO, TIAGO|automat resourc elast high perform applic cloud|2015|928.0
929|Rodrigo da Rosa Righi&RODRIGUES, VINICIUS FACCO&DA COSTA, CRISTIANO ANDRÉ&KREUTZ, DIEGO&HEISS, HANS-ULRICH|cloud base asynchron elast iter applic|2015|929.0
930|Rodrigo da Rosa Righi&DA COSTA, CRISTIANO ANDRÉ&RODRIGUES, VINICIUS FACCO&ROSTIROLLA, GUSTAVO|analysi perform energi consumpt enabl cloud elast applic|2015|930.0
931|Joslaine Cristina Jeske de Freitas&Stéphane Julia&Leiliane Pereira de Rezende|resourc alloc mechan time constraint propag techniqu net|2015|931.0
932|André Albino Pereira&João Bosco Mangueira Sobral&Carla Merckle Westphall|feder ident system cloud base environ|2015|932.0
933|Daniel Camozzato&Leandro Dihl&Ivan Silveira&Fernando Pinho Marson&Soraia Raupp Musse|floor plan gener build sketch|2015|933.0
935|Amyr Borges Fontes Neto&Soraia Raupp Musse&Catherine Pelachaud|emot contagion model crowd|2015|935.0
937|Karen Santin&Lucicléia Santos Guimarães Souza&Marcelo Cardoso Barbosa&Pedro Domingos Antoniolli&Ana Rita Tiradentes Terra Argoud|implement suppli manag process furnitur industri case studi|2015|937.0
938|Mariana Freitas Gonçalves&Pedro Domingos Antoniolli&Gustavo Benevides&Antonio Carlos Giuliani&Ana Rita Tiradentes Terra Argoud|propos reduct die consumpt tire multin industri|2015|938.0
939|Pedro Domingos Antoniolli&Carlos Roberto Camello Lima&Ana Rita Tiradentes Terra Argoud&João Batista de Camargo Junior|lean offic appli project manag compani case studi|2015|939.0
940|Rodrigo Duarte Soliani&João Batista de Camargo Junior&Ana Rita Tiradentes Terra Argoud&Mauro Vivaldini&Pedro Domingos Antoniolli|analysi load schedul system implement brazilian santo port|2015|940.0
941|Rodrigo Duarte Soliani&Ana Rita Tiradentes Terra Argoud|analysi logist infrastructur sugar bulk produc export state sao|2015|941.0
942|Pedro Domingos Antoniolli&Jhonathan Ferreira&Vania Carvalho Jesus&Ana Rita Tiradentes Terra Argoud&João Batista de Camargo Junior|logist transport leather industri case studi|2015|942.0
943|PRECUP, RADU-EMIL&ANGELOV, PLAMEN&Bruno Sielly Jales Costa&SAYED-MOUCHAWEH, MOAMAR|overview fault diagnosi natur inspir control process applic|2015|943.0
945|CONCI, AURA&GALVÃO, STEPHENSON S.L.&SEQUEIROS, GIOMAR O.&Debora Christina Muchaluat Saade&MACHENRY, TRUEMAN|measur compar region interest segment imag|2015|945.0
951|V. Behbood&J. Lu&G. Zhang&Witold Pedrycz|step bridg refin domain adapt algorithm applic bank failur predict|2015|951.0
952|Witold Pedrycz&SUCCI, GIANCARLO&SILLITTI, ALBERTO&ILJAZI, JOANA|data descript framework inform granul|2015|952.0
953|IZAKIAN, HESAM&Witold Pedrycz&JAMAL, IQBAL|cluster time seri data time warp distanc|2015|953.0
954|WANG, SHIPING&Witold Pedrycz&ZHU, QINGXIN&ZHU, WILLIAM|featur select project redund|2015|954.0
955|LIANG, DECUI&Witold Pedrycz&LIU, DUN&HU, PEI|way decis base decis set assess aid group decis make|2015|955.0
956|BALAMASH, ABDULLAH&Witold Pedrycz&AL-HMOUZ, RAMI&MORFEQ, ALI|expans inform granul refin inform content use system model|2015|956.0
957|LIU, XIAODONG&WANG, XIANCHANG&Witold Pedrycz|cluster interpret|2015|957.0
958|WANG, XIANCHANG&LIU, XIAODONG&Witold Pedrycz&ZHANG, LISHI|rule base decis tree|2015|958.0
959|CHEN, JIQIANG&Witold Pedrycz&HA, MINGHU&MA, LITAO|set valu sampl base support vector regress applic|2015|959.0
960|WANG, SHIPING&Witold Pedrycz&ZHU, QINGXIN&ZHU, WILLIAM|subspac learn featur select matrix factor|2015|960.0
962|LU, WEI&CHEN, XUEYAN&Witold Pedrycz&LIU, XIAODONG&YANG, JIANHUA|inform granul improv forecast time seri|2015|962.0
963|Witold Pedrycz&AL-HMOUZ, RAMI&BALAMASH, ABDULLAH SAEED&MORFEQ, ALI|design model approach model|2015|963.0
964|PORTMANN, EDY&MEIER, ANDREAS&CUDRÉ-MAUROUX, PHILIPPE&Witold Pedrycz|fora set base framework reput manag|2015|964.0
966|LI, MIN&Frederico Gadelha Guimarães&Lowther, David A.|algorithm design|2015|966.0
967|ZULIANI, JOÃO BATISTA QUEIROZ&WEISS COHEN, MIRI&BATISTA, LUCAS DE SOUZA&Frederico Gadelha Guimarães|topolog optim ant coloni optim genet algorithm|2015|967.0
970|DE OLIVEIRA, FERNANDO BERNARDES&ENAYATIFAR, RASUL&SADAEI, HOSSEIN JAVEDANI&Frederico Gadelha Guimarães&POTVIN, JEAN-YVES|cooper coevolutionari algorithm multi depot vehicl rout problem|2015|970.0
973|Vanessa Stephan Lopes&Carmen Lucia Tancredo Borges|impact combin integr wind gener small hydropow plant system reliabl|2015|973.0
974|Erica Akemi Tanaka&Sergio Ricardo Nozawa&Alessandra Alaniz Macedo&José Augusto Baranauskas|approach relev decis tree appli|2015|974.0
975|Pedro Santoro Perez&NOZAWA, SÉRGIO RICARDO&Alessandra Alaniz Macedo&BARANAUSKAS, JOSÉ AUGUSTO|window improv model|2015|975.0
977|WINTER, JEAN M.&Muller, Ivan&SOATTI, GLORIA&SAVAZZI, STEFANO&NICOLI, MONICA&BECKER, LEANDRO BUSS&Joao Cesar Netto&PEREIRA, CARLOS E.|wireless coexist spectrum sens industri internet thing studi|2015|977.0
978|GOMES FILHO, JONAS&Marius Strum&Wang Jiang Chau|genet algorithm hardwar core placement map base reconfigur system|2015|978.0
979|CASTRO MARQUEZ, CARLOS IVAN&Marius Strum&Wang Jiang Chau|sequenti equival check methodolog verifi design high level function protocol specif model|2015|979.0
980|Johnny M Gomes&Adriele Alvarenga&RIcardo Silva Campos&Bernardo Martins Rocha&Ana Paula Couto da Silva&Rodrigo Weber dos Santos|uniform method solv cardiac model base chain formul|2015|980.0
