|autores|titulo|ano|group
1515|Neil de Medeiros&Luciano Pessanha Moreira&Bressan, J.D.&Lins, J.F.C.&Gouvêa, J.P.|bound sensit analysi process|2010|1515.0
1516|Medeiros, Neil de&Luciano Pessanha Moreira&Bressan, José Divo&Jefferson Fabrício Cardoso Lins&Jayme Pereira de Gouvêa|sensit analysi process experi design|2010|1516.0
1518|Simone Vasconcelos Silva&Aura Conci&Rita de Cássia Fernandes de Lima|use numer simul find best extern breast prosthes analys influenc tumor depth tumor size imag|2010|1518.0
1522|Márcia Häfele Islabão Franco&Antonio Carlos da Rocha Costa&Helder Coelho|exchang valu social power support choic partner|2010|1522.0
1523|Fontes, P.R.&Lúcio Alberto de Miranda Gomide&Edimar Aparecida Filomeno Fontes&Eduardo Mendes Ramos&Alcinéia de Lemos Souza Ramos|composit color stabil carbon monoxid treat dri porcin blood|2010|1523.0
1524|Sérgio Augusto de Albuquerque Fernandes&Soria Vanessa Matarazzo&Alcinéia de Lemos Souza Ramos&Eduardo Mendes Ramos&Danilo Vinicius Sila Veras&Franklin R. Pinheiro&Sant´Clair Lage Neto&Ludmila, A. Requião&Thiago, S. Amui&Joel Camilo S. Carneiro|evalu buffalo butter|2010|1524.0
1525|JOÃO DE DEUS DE SOUZA CARNEIRO&CAMILA CARVALHO MENEZES&Sandra Maria Pinto&Michele Alves Claúdio&Alcinéia de Lemos Souza Ramos&Ana Carla Marques Pinheiro|propos improv market yogurt|2010|1525.0
1526|Franklin de Lima Marquezino&Renato Portugal&Fernando Deeke Sasse|obtain quantum fourier transform qr decomposit|2010|1526.0
1527|Gonzalo Abal&Raul Donangelo&Franklin de Lima Marquezino&Renato Portugal|search honeycomb network|2010|1527.0
1528|Franklin de Lima Marquezino&Renato Portugal&Gonzalo Abal|mix time quantum walk grid|2010|1528.0
1529|Alexandre Ádames Alves Pontes&Francisco Milton Mendes Neto&Gustavo Augusto Lima de Campos|system detect passiv student problem base learn|2010|1529.0
1531|Thiago Ribeiro de Alencar&Patricia Teixeira Leite Asano|develop intellig tool plan oper|2010|1531.0
1532|Rodrigo Garófallo Garcia&Ibiara Correia Lima de Almeida Paz&Fabiana R. Caldara&Irenilza de Alencar Nääs&Danilo Florentino Pereira&L W Freitas&A. W. SCHWINGEL&N. D. S. LIMA&J D Graciano|effect litter materi drink water qualiti broiler product|2010|1532.0
1533|Ibiara Correia Lima de Almeida Paz&F. Cavichiolo&Rodrigo Garófallo Garcia&R Bernardi&Irenilza de Alencar Nääs&Fabiana R. Caldara&L W Freitas&L O Seno&V M O S Ferreira&Danilo Florentino Pereira|select appropri bed reduc locomot problem broiler|2010|1533.0
1534|Danilo Florentino Pereira&Marcos Martinez do Vale&Braian Renan Zevolli&Douglas D'Alessandro Salgado|estim mortal lay hen temperatur increas|2010|1534.0
1535|Marcos Martinez do Vale&Daniella Jorge de Moura&Danilo Florentino Pereira|character heat wave affect mortal rate broiler day market age|2010|1535.0
1537|Joao Mario Andrade Pinto&João Carlos Figueira Pujol|network approach fatigu life predict|2010|1537.0
1541|Stefan Oliveira&João Carlos Gluz|agent base cognit model human resourc compet manag|2010|1541.0
1547|Renato Simões Moreira&Otávio Noura Teixeira&Glauber Duarte Monteiro&Átila Siqueira Soares&Roberto Célio Limão de Oliveira|iter genet algorithm real paramet function optim problem|2010|1547.0
1548|Renato Simões Moreira&Otávio Noura Teixeira&Roberto Célio Limão de Oliveira|mix theori genet algorithm build new natur inspir meta heurist real paramet function optim problem|2010|1548.0
1549|Cesar Augusto Tacla&Ademir Freddo&Emerson Cabrera Paraiso&Milton Pires Ramos&Emerson Cabrera Paraiso&Gilson Sato|support team cooper build applic domain model|2010|1549.0
1552|Fabian Abel&Ig Ibert Bittencourt&Evandro de Barros Costa&Nicola Henze&Daniel Krause&Julita Vassileva|recommend onlin discuss forum e learn system|2010|1552.0
1557|Ricardo Fabbri&Benjamin Kimia|curv sketch curv base stereo reconstruct calibr|2010|1557.0
1558|Roberto Aizik Tenenbaum&Julio Cesar Boscher Torres&José Francisco Lucio Naranjo|network gener realiti appli escap train condit|2010|1558.0
1561|Eraldo Luís Rezende Fernandes&Ruy Luiz Milidiú&Raúl P. Rentería|machin learn method relat extract text|2010|1561.0
1562|Andrade, Ana Lucia S.&Park, In H.&Franco, Cáritas M.&Lamaro-Cardoso, Juliana&André, Maria Cláudia D.P.B.&Leandro Luís Galdino de Oliveira&Kipnis, André&Rocha, Cristyane G.B.B.&Andrade, João G.&Alves, Sueli L.A.|streptococcu carriag isol genet carriag isol express type infant|2010|1562.0
1563|Jornada, F H&Gava, V&Martinotto, A L&Luciano Azevedo Cassol&Perottoni, C A|model carbon structur constraint|2010|1563.0
1567|Hermann Redies|littl wood rail mangl caatinga vocal habitat|2010|1567.0
1569|Nayat Sánchez Pi&Javier Carbo&José Manuel Molina|analysi design multi agent system gaia methodolog airport case use|2010|1569.0
1570|Nayat Sánchez Pi&José Manuel Molina|approach provis e servic u commerc environ|2010|1570.0
1575|Luiz Gustavo Leão Fernandes&Mariana Kolberg&Cleber Roberto Milani|interv self verifi linear system solver multicor comput|2010|1575.0
1576|Mariana Kolberg&Luiz Gustavo Leão Fernandes&Dalcidio Claudio|parallel self verifi linear system solver cluster comput|2010|1576.0
1577|Marcus Vinicius Maltempi&Ana Paula dos Santos Malheiros|distanc mathemat educ brazil research practic polici|2010|1577.0
1578|Maurício Rosa&Marcus Vinicius Maltempi|onlin mathemat educ context|2010|1578.0
1579|Fernando Alfredo Auat Cheein&Lopez, Natalia&Soria, Carlos M&di Sciascio, Fernando A&Lobo Pereira, Fernando&Carelli, Ricardo|slam algorithm appli robot assist navig environ|2010|1579.0
1582|de Oliveira, M. S.&Balthazar, M. L. F.&Anelyssa D'Abreu&Clarissa Lin Yasuda&Benito P. Damasceno&Fernando Cendes&Gabriela Castellano|mr imag textur analysi corpu callosum thalamu amnest mild cognit impair mild alzheim diseas|2010|1582.0
1583|Sandra Patricia Cuellar Baena&J. M. Morales&H. Martinetto&J. Calvar&G. Sevlever&Gabriela Castellano&M. Cerda-Nicolas&B. Celda&Daniel Monleón|metabol profil ependymoma astrocytoma|2010|1583.0
1584|Sean Wolfgang Matsui Siqueira&Eduardo Neves Motta&Alexandre Albino Andreatta|rule base method popul ontolog text|2010|1584.0
1586|Alexandre Trindade Simões da Motta&Felipe de Assis Ribeiro Carvalho&Ana Emília Oliveira&Lúcia Cevidanes&Marco Antonio de Oliveira Almeida|editor summari superimposit cone beam ct model surgeri|2010|1586.0
1587|Cevidanes, Lucia H.C.&Alexandre Trindade Simões da Motta&Proffit, William R.&Ackerman, James L.&Martin Styner|base superimposit evalu tissu chang|2010|1587.0
1588|de Assis Ribeiro Carvalho, Felipe&Cevidanes, Lucia Helena Soares&Alexandre Trindade Simões da Motta&de Oliveira Almeida, Marco Antonio&Ceib Phillips|assess advanc year surgeri|2010|1588.0
1589|Alexandre Trindade Simões da Motta&Felipe de Assis Ribeiro Carvalho&Lúcia Cevidanes&Marco Antonio de Oliveira Almeida|editor summari assess advanc surgeri model superimposit|2010|1589.0
1590|CARVALHO, F. A. R.&Cevidanes, Lucia Helena Soares&Alexandre Trindade Simões da Motta&de Oliveira Almeida, Marco Antonio&Ceib Phillips|editor comment|2010|1590.0
1593|Umberto Lucangelo&Agostino Accardo&Fabio Riscica|instrument volum measur frequenc ventil|2010|1593.0
1594|Umberto Lucangelo&Alessandro Bernardi&Massimo Ferluga&Massimo Borelli&Vittorio Antonaglia&Walter Araujo Zin&Fabio Riscica|ga distribut compart model ventil frequenc pressur control mode|2010|1594.0
1595|Chauã Coluene Queirolo&Luciano Silva&Olga Regina Pereira Bellon&Maurício Pamplona Segundo|face recognit simul anneal surfac interpenetr measur|2010|1595.0
1596|Maurício Pamplona Segundo&Luciano Silva&Olga Regina Pereira Bellon&Chauã Coluene Queirolo|face segment landmark detect rang imag|2010|1596.0
1598|Lyrene Fernandes da Silva&Thais Vasconcelos Batista&Sérgio Castelo Branco Soares&Lidiane Santos|role featur goal model develop softwar product line|2010|1598.0
1607|Irenilza de Alencar Nääs&Anderson Luiz de Souza&Ibiara Correia Lima de Almeida Paz&Marta dos Santos Baracho&Adriana Gomes de Menezes&Karla A. O. Lima&Mario Mollo Neto&BUENO, Leda Gobbo de Freitas&Victor Ricardo Ciaco de Carvalho&Ianê Almeida|assess locomot defici broiler chicken|2010|1607.0
1608|Mario Mollo Neto&Oduvaldo Vendrametto&Waker, Robert Ari|analysi ethanol larg scale product network brazil|2010|1608.0
1610|Wagner Costa Botelho&Oduvaldo Vendrametto&Mario Mollo Neto|drywal nonsustain dispos disabl qualif human resourc innov|2010|1610.0
1613|Asté, Marie&Havet, Frédéric&Claudia Linhares Sales&Claudia Linhares Sales|grundi number product graph|2010|1613.0
1615|Milene Arantes&Adilson Gonzaga|human gait recognit extract fusion global motion featur|2010|1615.0
1617|MELIANDE, PATRICIA&DO NASCIMENTO, ELSON ANTONIO&Rogério Fernandes de Lacerda|transient evalu oil pipelin|2010|1617.0
1618|Anna Carolina Raduenz&Priscila Hoffmann&Vera Radunz&Grace T M Dal Sasso&Patricia Marck&Isabel Cristina Alves Maliska|nurs care patient safeti visual medic organ storag distribut photograph research method|2010|1618.0
1620|Kiev Santos da Gama&Didier Donsez|survey approach address depend attribut servic platform|2010|1620.0
1621|Sakzad, Amin&Sadeghi, Mohammad-Reza&Daniel Panario|code girth tanner graph represent|2010|1621.0
1625|Omidi Koma, Behzad&Wang, Qiang&Daniel Panario|number polynomi degre n given trace term|2010|1625.0
1626|Gao, Zhicheng&Laferriere, D.&Daniel Panario|decompos combinatori structur alg log type posit log expon|2010|1626.0
1627|Dong, Li&Gao, Zhicheng&Richmond, B.&Daniel Panario|compon size structur alg log type|2010|1627.0
1630|Frederico Luiz Gonçalves de Freitas&Zacharias Candeias Jr.&Heiner Stuckenschmidt|usag semant technolog check document consist|2010|1630.0
1631|Georgi, Benjamin&Ivan Gesteira Costa Filho&Schliep, Alexander|python mixtur packag tool cluster data|2010|1631.0
1632|Alexander Victor Ocsa Mamani&Elaine Parros Machado de Sousa|hash structur similar search|2010|1632.0
1634|Anderson Alvarenga de Moura Meneses&Roberto Schirru|studi confin particl swarm applic reactor reload problem|2010|1634.0
1635|Anderson Alvarenga de Moura Meneses&Pinheiro, Christiano Jorge Gomes&Rancoita, Paola&Schaul, Tom&Gambardella, Luca Maria&Schirru, Roberto&Barroso, Regina Cely&de Oliveira, Luís Fernando|assess network train strategi analysi radiat imag|2010|1635.0
1636|Anderson Alvarenga de Moura Meneses&Rancoita, Paola&Schirru, Roberto&Gambardella, Luca Maria|class base search core fuel manag optim pressur water reactor|2010|1636.0
1637|Mittmann, Adiel&Nobrega, Tiago H. C.&Comunello, Eros&Pinto, Juliano P. O.&Paulo Roberto Dellani&Stoeter, Peter&Wangenheim, Aldo|perform real time interact fiber track|2010|1637.0
1638|Yakushev, Igor&Müller, Matthias J.&Lorscheider, Markus&Schermuly, Ingrid&Weibrich, Carsten&Paulo Roberto Dellani&Hammers, Alexander&Stoeter, Peter&Fellgiebel, Andreas|increas head diffus predict impair memori perform diseas|2010|1638.0
1639|Ernesto G. Birgin&Erico M. Gozzi&Mauricio G. C. Resende&Ricardo Martins de Abreu Silva|grasp set method bound constrain optim|2010|1639.0
1640|Mateus, Geraldo R.&Mauricio G. C. Resende&Ricardo Martins de Abreu Silva|grasp path assign problem|2010|1640.0
1641|Abraham Duarte&Martí, R.&Resende, M.G.C.&Ricardo Martins de Abreu Silva|grasp path heurist problem|2010|1641.0
1645|Joao Sollari Allegro Machado Lopes&BOESSENKOOL, SANNE|use comput conserv genet applic case studi penguin|2010|1645.0
1646|Joao Sollari Allegro Machado Lopes&BEAUMONT, M.A.|abc tool analysi popul data|2010|1646.0
1647|Clausi, D A&Qin, A K&Chowdhury, M S&Yu, P.&Philippe Maillard|magic map guid ice classif system|2010|1647.0
1648|Barbosa, Ivan Seixas&Philippe Maillard|map wetland complex savannah imag assess potenti region base classifi|2010|1648.0
1649|Philippe Maillard&Costa-Pereira, Priscilla S.|estim age regener landsat tm data|2010|1649.0
1652|Quintão, Frederico P.&da Cunha, Alexandre Salles&Geraldo Robson Mateus&Lucena, Abilio|cardin tree problem reformul relax|2010|1652.0
1657|SALES, MARCIA BARROS DE&Andréia Alves dos Santos Schwaab&NASSAR, SILVIA MODESTO|applic bayesian network assist expans digit inclus peopl|2010|1657.0
1661|Leandro Farias Estrozi&Jorge Navaza|ab resolut particl reconstruct symmetri adapt function way|2010|1661.0
1662|Desfosses, A.&Goret, G.&Leandro Farias Estrozi&Ruigrok, R. W. H.&Gutsche, I.|nucleoprotein orient measl viru nucleocapsid electron microscopi|2010|1662.0
1664|Marco Antonio Garcia de Carvalho&Anselmo Castelo Branco Ferreira&André Luis da Costa|imag segment base similar graph normal cut|2010|1664.0
1667|Thiago Casé Ribeiro&Glauber Ventrice&Ariane Machado Lima&Luiz Paulo Andrioli|investig giant gt repress format partial overlap pair rule stripe|2010|1667.0
1669|GOMES, DIOGO&AGUIAR, RUI L.&Susana Isabel Barreto de Miranda Sargento|cross system approach multimedia servic multicast g network|2010|1669.0
1672|Thereza Penna Firme&Vathsala I Stone&Ana Carolina Letichevsky&Angela C Dannemann|captur mean context evalu|2010|1672.0
1673|Clauirton A. Siebra&LINO, NANCY L.&Fabio Queda Bueno da Silva&André Luís M. Santos|issu test manag platform|2010|1673.0
1674|João Batista da Rocha Junior&Akrivi Vlachou&Christos Doulkeridis&Kjetil Nørvåg|process k spatial prefer queri|2010|1674.0
1675|Leandro Maciel Almeida&Teresa Bernarda Ludermir|methodolog optim paramet perform network|2010|1675.0
1676|Daniel Ludovico Guidoni&Raquel Aparecida de Freitas Mini&Antonio Alfredo Ferreira Loureiro|design sensor network base world concept comput network|2010|1676.0
1678|Buczkowska, Agnieszka&Emilia Katarzyna Witkowska Nery&Górski, ?ukasz&Zamojska, Anna&Szewczyk, Krzysztof W.&Wróblewski, Wojciech&Ciosek, Patrycja|monitor methan ferment sequenc flow array miniatur state electrod|2010|1678.0
1679|Emilia Katarzyna Witkowska Nery&Zamojska, Anna&Szewczyk, Krzysztof W.&Ciosek, Patrycja|monitor digest flow array miniatur ion select electrod|2010|1679.0
1681|Raydonal Ospina Martínez&Silvia Lopes de Paula Ferrari|beta distribut|2010|1681.0
1683|Eduardo Alves do Valle Junior&Matthieu Cord&Sylvie Philipp-Foliguet&David Gorisse|index person imag collect solut|2010|1683.0
1688|Emerson Carlos Pedrino&José Hiroki Saito&Valentin O. Roda|program approach reconfigur imag process architectur|2010|1688.0
1689|Lionel Valet&Beatriz de Souza Leite Pires de Lima&Alexandre Gonçalves Evsukoff|genet algorithm base fusion system optim imag interpret|2010|1689.0
1690|Daumke, P.&Schulz, S.&Müller, M. L.&Dzeyk, W.&Prinzen, L.&Edson José Pacheco&Secco Cancian, P.&Nohama, P.&Markó, K.|base semant retriev clinic bibliograph document|2010|1690.0
1691|Livy Maria Real Coelho|categori morpholog|2010|1691.0
1692|Wellington Pinheiro dos Santos&Francisco Marcos de Assis&Ricardo Emmanuel de Souza&Priscilla B. Mendes&Henrique S. S. Monteiro&Havana D. Alves|fuzzi base non imag classif cluster|2010|1692.0
1693|DITTRICH, YVONNE&Sharp, Helen&THEOPHILUS, HEIKE WINSHIERS&Cleidson Ronald Botelho de Souza&KORPELA, MIKKO&Singer, Janice|aspect softwar engin|2010|1693.0
1696|Antonio Carlos Henriques Marques&José Laércio Doricio&Paulo Celso Greco Júnior|comput simul analysi laminar boundari layer airfoil profil ultra number|2010|1696.0
1699|JUNIOR, GERALDO BRAZ&Leonardo de Oliveira Martins&SILVA, ARISTÓFANES CORREA&Anselmo Cardoso de Paiva|comparison support vector machin bayesian neural network perform breast tissu function mammograph imag|2010|1699.0
1702|Massimo De Gregorio&ROSSI, SILVIA|architectur control behavior base system|2010|1702.0
1704|José Viterbo Filho&Markus Endler&Gustavo Luiz Bastos Baptista|tier approach decentr reason ambient intellig|2010|1704.0
1706|Luis Guerrero&Sergio Fabian Ochoa&Hector Horta|develop augment object process perspect|2010|1706.0
1707|Paulino, Glaucio H.&Park, Kyoungsoo&Waldemar Celes Filho&Espinha, Rodrigo|cohes fractur simul perturb edg swap oper|2010|1707.0
1709|Priscila América Solís Mendez Barreto&Paulo Henrique Portela de Carvalho&Tiago Flor Bento|multimedia network simul fluid flow model|2010|1709.0
1712|Marcelo Eduardo Pellenz&Richard Demo Souza&Mauro Sergio Pereira Fonseca|error control code sensor network|2010|1712.0
1713|Marcelo Esteban Coniglio&Martín Figallo|calculi preserv rule elimin|2010|1713.0
1714|Marcia dos Angeles Leite&Mara Lucia Fernandes Carneiro&Marcia Helena Nicolini Castro|distanc educ train pharmacist research prospect evalu process|2010|1714.0
1716|Matos, Débora&Concatto, Caroline&Kreutz, Márcio&Luigi Carro&Susin, Altamiro&Fernanda Gusmão de Lima Kastensmidt|router low power perform|2010|1716.0
1717|Sant'Anna, Annibal Parracho&Eduardo Uchoa Barboza&Soares de Mello, Joao Carlos|classif team brazilian soccer championship criteria composit|2010|1717.0
1719|Santos, Marcelo&Drummond, Lúcia M.A.&Eduardo Uchoa Barboza|distribut ascent algorithm hop constrain tree problem|2010|1719.0
1723|Jancarlo Ferreira Gomes&Celso&João Paulo&Sumie Hoshino Shimizu&Alexandre Xavier Falcão|autom diagnosi imag analysi|2010|1723.0
1724|Tayana Uchôa Conte&Reinaldo Cabral&Guilherme Horta Travassos|appli ground theori qualit analysi observ studi softwar engin experi report|2010|1724.0
1726|Dellamonica Jr., Domingos&Magnant, Colton&Daniel Morgato Martin|rainbow path|2010|1726.0
1728|Fabricio Alves Barbosa da Silva&Mário Jorge Costa Gaspar da Silva&Francisco Couto|epidem marketplac e scienc platform epidem model analysi|2010|1728.0
1729|Luis Filipe Lopes&Fabricio Alves Barbosa da Silva&Francisco Couto&João Zamite&Hugo Ferreira|epidem marketplac inform manag system epidemiolog data|2010|1729.0
1731|Sérgio Luiz de Medeiros Rivero&Cooney Seisdedos, Paul|amazon frontier capit accumul look tree|2010|1731.0
1735|Alaide Barbosa Martins&Marcelo Teixeira de Azevedo&Sergio T. Kofuji|simplifi approach intrus detect base anomali control data acquisit system|2010|1735.0
1737|Cannataro, Mario&Romberg, Mathilde&Sundnes, Joakim&Rodrigo Weber dos Santos|section challeng comput scienc|2010|1737.0
1738|Elisa Portes dos Santos&Flávio Dickstein&Paulo Goldfeld&Rodrigo Weber dos Santos&Carolina Ribeiro Xavier&Carolina Ribeiro Xavier|automat histori match petroleum reservoir method|2010|1738.0
1739|Carolina Ribeiro Xavier&Carolina Ribeiro Xavier&Elisa Portes dos Santos&Ronan Mendonça Amorim&Marcelo Lobosco&Flávio Dickstein&Rodrigo Weber dos Santos&Paulo Goldfeld|perform evalu reservoir simul multi core cluster|2010|1739.0
1740|Tarcísio Hebert de Paula&Marcelo Lobosco&Rodrigo Weber dos Santos|web base tool automat segment|2010|1740.0
1741|Ricardo Silva Campos&Micael Peters Xavier&Marcelo Lobosco&Rodrigo Weber dos Santos|perform evalu grid base heart simul|2010|1741.0
1742|Rocha, Bernardo&Fernando Otaviano Campos&Plank, Gernot&Rodrigo Weber dos Santos&Liebmann, Manfred&Haase, Gundolf|simul electr activ heart graphic process unit|2010|1742.0
1743|Fernando Otaviano Campos&Thomas Wiener&Prassl, Anton J.&Helmut Ahammer&G. Plank&Rodrigo Weber dos Santos&D. Sanchez-Quintana&Ernst Hofer|comput model atrial tissu base describ electro anatom impact microstructur endocardiac potenti electr near field|2010|1743.0
1744|Costa, Caroline Mendonça&Rodrigo Weber dos Santos|limit cardiac model case gap junction coupl|2010|1744.0
1745|Amorim, Ronan Mendonca&Rocha, Bernardo M.&Fernando Otaviano Campos&Rodrigo Weber dos Santos|code gener solver membran dynam|2010|1745.0
1746|Bernardo Lino de Oliveira&Joakim Sundnes&Rodrigo Weber dos Santos|develop model electromechan myocyt|2010|1746.0
1749|Matos, Debora&Caroline Martins Concatto&Kologeski, Anelise&Carro, Luigi&Kastensmidt, Fernanda&Altamiro Amadeu Susin&Kreutz, Marcio|monitor adapt coupl perform tune|2010|1749.0
1750|Marcos Paulo Alves de Sousa&Filho, Manoel Ribeiro&Nunes, Marcus Vinícius Alves&Lopes, Andrey da Costa|mainten oper unit energi power system realiti|2010|1750.0
1751|Marcelo HOUNSELL&Edgar Luis da Silva&MANOEL RIBEIRO FILHO&Marcos Paulo Alves de Sousa|model distinguish educ train environ applic|2010|1751.0
1752|Marcos Paulo Alves de Sousa&Filho, Manoel Ribeiro&Nunes, Marcus VinÃ&shy;cius Alves&Lopes, Andrey da Costa|learn tool unit|2010|1752.0
1754|Rodrigo Rubira Branco&Celso Massaki Hirata|stream analysi network file avoid posit detect client attack|2010|1754.0
1755|Liliane do Nascimento Vale&Stéphane&Núbia Rosa da Silva&Márcio Souza Dias|simul industri metabol predic transit petri net combin differenti equat|2010|1755.0
1757|Amarolinda I. C. Z. Saccol&Nicolau Reinhard&Jorge Luis Victória Barbosa&Eliane Schlemmer|m learn mobil learn practic train experi profession|2010|1757.0
1759|Alexandre Lorenzatti&Mara Abel&Sandro Rama Fiorini&Ariane Kravczyk Bernardes&Claiton M.S. Scherer|primit knowledg|2010|1759.0
1761|DA SILVA, A MARQUES&BRAMBILLA, C&ARGENTA, J&FRANC'OIS, D&COTRIM, D&Cesar Augusto Fonticielha De Rose|th design commun practic nuclear medicin base grid technolog|2010|1761.0
1764|Stanley Loh&Daniel Lichtnow&Adriana Justin Cerveira Kampff&José Palazzo Moreira de Oliveira|recommend complementari materi chat discuss knowledg manag e learn|2010|1764.0
1766|Vandermi João da Silva&Vicente Ferreira de Lucena Junior|integr convent medic devic brazilian digit tv mobil phone|2010|1766.0
1768|João Henrique de Souza Pereira&Eduardo de Souza Santos&Fabíola Souza Fernandes Pereira&Pedro Frosi Rosa&Sérgio Takeo Kofuji|layer optim propos post network|2010|1768.0
1769|Jacinto C. A. Cansado&João Henrique de Souza Pereira&Edson T. Midorikawa|consid frequenc dimens demand adapt algorithm|2010|1769.0
1773|Vieira Kritz, Maurício&Trindade dos Santos, Marcelo&Sebastián Alberto Urrutia&Schwartz, Jean-Marc|organis network cycl flux distribut|2010|1773.0
1774|da Silva, Rodrigo Ferreira&Sebastián Alberto Urrutia|gener heurist travel salesman problem time window|2010|1774.0
1775|Medeiros, André César&Sebastián Alberto Urrutia|optim method determin trajectori vehicl|2010|1775.0
1780|Leite, Sandro Passos&Walsan Wagner Pereira&da Silva, Ademir Xavier&da Fonseca, Evaldo Simões&de Souza Patrão, Karla Cristina|altern irradi system effici manganes bath determin|2010|1780.0
1781|Bittencourt, Guilherme Rodrigues&Cristina de Souza Patrão, Karla&Leite, Sandro Passos&Walsan Wagner Pereira&Simões da Fonseca, Evaldo|determin semi relationship manganes hydrogen atom ratio physic densiti concentr aqueou solut manganes sulphat|2010|1781.0
1782|Salgado, A.P.&Walsan Wagner Pereira&da Fonseca, E.S.&Patrão, K.C.S.&Batista, D.V.S.|calibr evalu neutron survey meter linac facil|2010|1782.0
1783|Trindade, Diego von B. M.&Halmenschlager, Vitor&Ortolan, Leonardo&Maria Cristina Felippetto De Castro&De Castro, Fernando C. C.&Ourique, Fabrício|tap alloc concurr dd equal|2010|1783.0
1784|Denis Gonçalves Cople&Eduardo Siqueira Brick|simul framework system life cycl cost analysi|2010|1784.0
1785|MORAES, RICARDO&PORTUGAL, PAULO&Francisco Vasques&CUSTÓDIO, RICARDOF|assess ieee protocol limit deal real time commun|2010|1785.0
1786|MORAES, RICARDO&Francisco Vasques&PORTUGAL, PAULO&SOUTO, PEDRO F.|forc collis resolut approach priorit traffic base network|2010|1786.0
1787|MORAES, RICARDO&Francisco Vasques&PORTUGAL, PAULO|survey real time commun base network|2010|1787.0
1788|Ricardo Sousa Silvestre|formal theori chang anomali|2010|1788.0
1790|Ricardo Sousa Silvestre|logic plan agenc branch time|2010|1790.0
1791|Wellington Claiton Leite&CHINELATTO, A. S. A.&André Mauricio Brinatti&Mauricio Aparecido Ribeiro&André Vitor Chaves de Andrade&CHINELATTO, A. L.|studi crystallit size yttria stabil zirconia powder method|2010|1791.0
1793|Camarozano, Ana Cristina&Garcia de Almeida Cyrino, Fátima Zely&Daniel Alexandre Bottino&Eliete Bouskela|effect ultrasound microcircul observ hamster cheek pouch|2010|1793.0
1794|Marcos Antonio Simplicio Junior&Paulo Sérgio Licciardi Messeder Barreto&Cintia Borges Margi&Tereza Cristina Melo de Brito Carvalho|survey manag mechan distribut wireless sensor network|2010|1794.0
1799|Luiz Fernando Jacintho Maia|note fuzzi function applic fuzzi control|2010|1799.0
1800|BOUSSIER Sylvain&Michel Vasquez&VIMONT Yannick&HANAFI said&Philippe Yves Paul Michelon|multi level search strategi multidimension knapsack problem|2010|1800.0
1801|Andrea Linhares&Philippe Yves Paul Michelon&Dominique Feillet|exact site avail approach model d|2010|1801.0
1803|Henry Ponti Medeiros&Holguín, Germán&Shin, Paul J.&Park, Johnny|histogram base particl filter object track base camera|2010|1803.0
1804|Yoder, Josiah&Henry Ponti Medeiros&Park, Johnny&Kak, Avinash C.|cluster base distribut face track camera network|2010|1804.0
1805|Vilson Luiz Dalle Mole&Araújo, Aluizio Fausto Ribeiro|grow self organ surfac map learn surfac topolog point cloud|2010|1805.0
1806|Bianconi, André&Von Zuben, Cláudio J&Adriane Beatriz de Souza Serapião&Govone, José S|use network analys ecolog diptera calliphorida compar model|2010|1806.0
1807|Bianconi, André&Zuben, Cláudio J. Von&Adriane Beatriz de Souza Serapião&Govone, José S.|artifici neural network approach analys nutrit ecolog blowfli speci|2010|1807.0
1808|Medeiros, Marcos D.&Gonçalves, Luiz Marcos G.&Alejandro César Frery Orgambide|fuzzi logic enhanc stereo match imag|2010|1808.0
1809|Abraão D. C. Nascimento&Renato J. Cintra&Alejandro César Frery Orgambide|hypothesi test speckl data distanc|2010|1809.0
1810|Marcelo Almirón&Bruno Lopes Vieira&Alyson L. C. Oliveira&Antonio Carlos de Medeiros&Alejandro César Frery Orgambide|numer accuraci spreadsheet|2010|1810.0
1812|Alejandro César Frery Orgambide&Jacobo-Berlles, Julio&Gambini, Juliana&Mejail, Marta E.|polarimetr sar imag segment b spline model|2010|1812.0
1813|Mauricio Uriona Maldonado&NORBERTO DIAS&Gregório Jean Varvakis Rados|initi benchmark innov manag technolog firm case studi commun manufactur sector|2010|1813.0
1814|Mauricio Uriona Maldonado&Souza, Leonardo Leocádio Coelho&Varvakis, Gregorio|focu practic servic process innov energi sector|2010|1814.0
1815|da Silva, João Viçozo&Vidal, Luciano N.&Pedro Antonio Muniz Vazquez&Bruns, Roy E.|cluster configur interact quantum calcul intens|2010|1815.0
1818|Torres, Jorge B.&Barros, Eduardo M.&Coelho, Roberta R.&Rejane Magalhães de Mendonça Pimentel|feed plant implic control|2010|1818.0
