|autores|titulo|ano|group
1664|Daniel Helbig&Caio César Cardoso da Silva&Mauro de Vasconcellos Real&Elizaldo Domingues dos Santos&Liércio André Isoldi&Luiz Alberto Oliveira Rocha|studi buckl phenomenon perfor thin steel plate employ comput model design method|2016|1664.0
1666|Ruth da Silva Brum&Jairo V. Ramalho&Luiz Alberto Oliveira Rocha&Liércio André Isoldi&Elizaldo Domingues dos Santos|transient model analyz influenc air veloc duct diamet perform earth air heat|2016|1666.0
1671|DOS SANTOS, ELIZALDO DOMINGUES&RODRIGUES, MARCO PAULSEN&DE ANDRADE, THIAGO SMITH V.C.&Liércio André Isoldi&FRANÇA, FRANCIS HENRIQUE RAMOS&ROCHA, LUIZ ALBERTO OLIVEIRA|numer studi differ closur approach predict forc convect turbul cylindr caviti flow|2016|1671.0
1672|Felipe dos Anjos Lima&Edward David Moreno&Wanderson Roger Azevedo Dias|perform analysi low cost cluster parallel applic arm processor|2016|1672.0
1673|Paulo Eduardo Battistella&Christiane Anneliese Gresse von Wangenheim|game teach comput higher educ review|2016|1673.0
1674|Christiane Anneliese Gresse von Wangenheim&WITT, TALITA A.&Borgatto, Adriano Ferreti&NUNES, JULIANE VARGAS&LACERDA, THAISA CARDOSO&KRONE, CAROLINE&SOUZA, LAÍS DE OLIVEIRA|usabl score mobil phone applic base heurist|2016|1674.0
1675|Giani Petri&Christiane Anneliese Gresse von Wangenheim|evalu educ game systemat literatur review|2016|1675.0
1677|Itamar Iliuk&Jose manoel Balthazar&Angelo Marcelo Tusset&José Roberto Castilho Piqueira|analysi loss flow accid hypothesi plate type fuel surround water channel code|2016|1677.0
1678|BALTHAZAR, J.M.&BRASIL, REYOLANDO MANOEL LOPES REBELLO DA F&FELIX, J.L.P.&Angelo Marcelo Tusset&PICCIRILLO, VINICIUS&Itamar Iliuk&Rocha, Rodrigo Tumolin&Airton Nabarrete&Clivaldo de Oliveira|dynam behaviour nis frame includ nonlinear|2016|1678.0
1679|Wenjuan Gong&Xuena Zhang&Jordi Gonzàlez&Andrews Cordolino Sobral&Thierry BOUWMANS&Changhe Tu&El-hadi Zahzah|human pose estim monocular imag survey|2016|1679.0
1680|Thierry BOUWMANS&Andrews Cordolino Sobral&JAVED, SAJID&JUNG, SOON KI&ZAHZAH, EL-HADI|decomposit rank plus matric background foreground separ review evalu scale dataset|2016|1680.0
1681|Andrews Cordolino Sobral&ZAHZAH, EL-HADI|matrix tensor complet algorithm background model initi evalu|2016|1681.0
1682|NEVES, JOSEMIR ARAUJO&Sílvio de Barros Melo&SAMPAIO, EVERARDO VALADARES DE SÁ BARRETO|index suscept drought semiarid northeast|2016|1682.0
1683|ALENCAR, NAMOM&Angelo Roncalli Alencar Brayner&FILHO, JOSE AGUIAR&LOPES, HAMILTON|scan scan oper exploit parallel|2016|1683.0
1684|Chaulio R. Ferreira&Marcus Vinícius Alvim Andrade&Salles Viana Gomes de Magalhães&Franklin, W. Randolph|effici extern memori algorithm terrain comput|2016|1684.0
1685|Salles Viana Gomes de Magalhães&Marcus Vinícius Alvim Andrade&Franklin, W. Randolph&Wenli Li|point locat queri uniform grid|2016|1685.0
1687|Simone Dantas de Souza&Faria, Luerbio&DE FIGUEIREDO, CELINA M.H.&TEIXEIRA, RAFAEL B.|probe problem np versus dichotomi|2016|1687.0
1688|Danilo Artigas&Simone Dantas de Souza&OLIVEIRA, ALONSO L. S.&SILVA, THIAGO M. D.|analysi contour graph|2016|1688.0
1689|ALVARADO, JOSÉ D.&Simone Dantas de Souza&RAUTENBACH, DIETER|equal domin tree|2016|1689.0
1690|ALVARADO, JOSÉ D.&Simone Dantas de Souza&RAUTENBACH, DIETER|averag domin domin|2016|1690.0
1692|ALVARADO, JOSÉ D.&Simone Dantas de Souza&RAUTENBACH, DIETER|domin set induc compon|2016|1692.0
1696|Marcelo de Gomensoro Malheiros&WALTER, MARCELO|sort strategi neighbor search|2016|1696.0
1698|JÚNIOR, GILENO LACERDA&Melline Fontes Noronha&DE SOUSA, SANDERSON TARCISO&CABRAL, LUCÉLIA&DOMINGOS, DANIELA&SÁBER, MÍRIAN&DE MELO, ITAMAR&OLIVEIRA, VALÉRIA|potenti soil caatinga biom sourc mine lignocellulos degrad enzym|2016|1698.0
1701|SILVA, ALEKSANDRA DO SOCORRO DA&Silvana Rossy de Brito&VIJAYKUMAR, NANDAMUDI LANKALAPALLI&ROCHA, CLÁUDIO ALEX JORGE DA&MONTEIRO, MAURÍLIO DE ABREU&COSTA, JOÃO CRISÓSTOMO WEYL ALBUQUERQUE&FRANCÊS, CARLOS RENATO LISBOA|social network analysi mine monitor identifi problem scale inform communic technolog intervent|2016|1701.0
1702|Silvana Rossy de Brito&DA SILVA, ALEKSANDRA DO SOCORRO&CRUZ, ADEJARD GAIA&MONTEIRO, MAURÍLIO DE ABREU&VIJAYKUMAR, NANDAMUDI LANKALAPALLI&DA SILVA, MARCELINO SILVA&COSTA, JOÃO CRISÓSTOMO WEYL ALBUQUERQUE&FRANCÊS, CARLOS RENATO LISBOA|concentr access inform communic technolog municip brazilian legal amazon|2016|1702.0
1703|Silvana Rossy de Brito&do Socorro da Silva, Aleksandra&DA MATA, EULÁLIA CARVALHO&VIJAYKUMAR, NANDAMUDI LANKALAPALLI&DA ROCHA, CLÁUDIO ALEX JORGE&DE ABREU MONTEIRO, MAURÍLIO&COSTA, JOÃO CRISÓSTOMO WEYL ALBUQUERQUE&FRANCÊS, CARLOS RENATO LISBOA|approach evalu scale train intervent|2016|1703.0
1704|DONATI, ANA R. C.&PEREIRA, GISLAINE A.&BRASIL, FABRICIO L.&GALLO, SIMONE&LIN, ANTHONY A.&TAKIGAMI, ANGELO K.&ARATANHA, MARIA A.&JOSHI, SANJAY&BLEULER, HANNES&CHENG, GORDON&RUDOLPH, ALAN&SHOKUR, SOLAIMAN&NICOLELIS, MIGUEL A. L.&MORYA, EDGARD&CAMPOS, DEBORA S. F.&Renan Cipriano Moioli&GITTI, CLAUDIA M.&AUGUSTO, PATRICIA B.&TRIPODI, SANDRA&PIRES, CRISTHIANE G.|term train brain machin interfac base gait protocol induc partial neurolog recoveri parapleg patient|2016|1704.0
1705|SHOKUR, SOLAIMAN&GALLO, SIMONE&Renan Cipriano Moioli&DONATI, ANA RITA C.&MORYA, EDGARD&BLEULER, HANNES&NICOLELIS, MIGUEL A.L.|assimil leg percept floor textur patient receiv tactil feedback|2016|1705.0
1709|CACIQUE BRAGA, PEDRO HENRIQUE&Ismar Frango Silveira|slap storyboard languag anim program|2016|1709.0
1714|DE JESUS DOS SANTOS, ALYSON&COSTA, LUÍS HENRIQUE M.K.&Marcus de Lima Braga&BRACONNOT VELLOSO, PEDRO&GHAMRI-DOUDANE, YACINE|character delay disrupt network amazon basin|2016|1714.0
1716|Marjori Naiele Mocelin Klinczak&Celso Antônio Alves Kaestner|comparison cluster algorithm identif topic twitter|2016|1716.0
1717|Éfren Lopes de Souza&Eduardo Freire Nakamura&Richard Werner Pazzi|target track sensor network|2016|1717.0
1718|Rogerio Galante Negri&Dutra&Sidnei Joao Siqueira Sant'Anna|compar support vector machin approach area classif|2016|1718.0
1719|Rogerio Galante Negri&Dutra&Sidnei Joao Siqueira Sant'Anna&Dengsheng Lu|examin region base method land cover classif distanc|2016|1719.0
1720|PEREIRA, LUCIANA OLIVEIRA&FREITAS, CORINA C.&Sidnei Joao Siqueira Sant'Anna&REIS, MARIANE SOUZA|data evalu land use land cover map amazon region|2016|1720.0
1722|CARVALHO, GUSTAVO&Cavalcanti, Ana&Augusto Cezar Alves Sampaio|model time system languag requir|2016|1722.0
1723|Mariella Berger Andrade&DE SOUZA, ALBERTO F.&DE OLIVEIRA NETO, JORCY&DE AGUIAR, EDILSON&OLIVEIRA-SANTOS, THIAGO|track vg ram weightless neural network|2016|1723.0
1725|SILVA, LUÍS ALEXANDRE ESTEVÃO&SIQUEIRA, MARINEZ FERREIRA&PINTO, FLÁVIA DOS SANTOS&BARROS, FELIPE SODRÉ M.&Geraldo Zimbrao da Silva&SOUZA, JANO MOREIRA|appli data mine techniqu distribut analysi plant speci co occurr|2016|1725.0
1726|CALED, DANIELLE&BEYSSAC, PEDRO&XEXÉO, GERALDO&Geraldo Zimbrao da Silva|buzzword detect scenario|2016|1726.0
1729|Jonathan Simon Prates&Sandro José Rigo&Cristiano André da Costa&Jorge L. V. Barbosa|role cognit base model multimod interact system dialogu manag|2016|1729.0
1730|Tiago Wiedemann&Jorge L. V. Barbosa&Sandro José Rigo&Debora Nice Ferrari Barbosa|model learn object recommend similar session|2016|1730.0
1732|MANO, LEANDRO Y.&KRISHNAMACHARI, BHASKAR&Jó Ueyama&Bruno Squizato Faiçal&NAKAMURA, LUIS H.V.&GOMES, PEDRO H.&LIBRALON, GIAMPAOLO L.&MENEGUETE, RODOLFO I.&FILHO, GERALDO P.R.&GIANCRISTOFARO, GABRIEL T.&PESSIN, GUSTAVO|exploit technolog enhanc health smart home identif emot recognit|2016|1732.0
1733|Bruno Squizato Faiçal&PESSIN, GUSTAVO&FILHO, GERALDO P. R.&CARVALHO, ANDRÉ C. P. L. F.&GOMES, PEDRO H.&Jó Ueyama|tune control rule spray pesticid crop field approach environ|2016|1733.0
1737|MACÊDO FILHO, HÉLIO B.&MACHADO, RAPHAEL C.S.&Celina Miraglia Herrera de Figueiredo|complex colour weak graph graph have cliqu size|2016|1737.0
1738|MACHADO, RAPHAEL C.S.&Celina Miraglia Herrera de Figueiredo|time graph distanc diamet approxim|2016|1738.0
1739|GUSMÃO, ANDRÉIA C.S.&BUENO, LETÍCIA R.&HAUSEN, RODRIGO A.&Celina Miraglia Herrera de Figueiredo&FARIA, LUERBIO|note level problem|2016|1739.0
1742|FARIA, L&Celina Miraglia Herrera de Figueiredo&RICHTER, R. BRUCE&VRT'O, IMRICH|upper bound rectilinear cross number n|2016|1742.0
1745|COELHO, H.&Luerbio Faria&Silvain Gravier&Sulamita Klein|orient color planar bipartit degre orient graph|2016|1745.0
1746|BASTE, JULIEN&Luerbio Faria&Sulamita Klein&SAU, IGNASI|parameter complex dichotomi r delet|2016|1746.0
1747|Luerbio Faria&HON, WING-KAI&KLOKS, TON&LIU, HSIANG-HSUAN&WANG, TAO-MING&WANG, YUE-LI|complex minus domin|2016|1747.0
1748|JESUS, M. A.&Vania Vieira Estrela|introduct data mine appli health orient databas|2016|1748.0
1749|FERREIRA, MARCELO R.P.&Francisco de Assis Tenorio de Carvalho&SIMÕES, EDUARDO C.|kernel base cluster method weight variabl|2016|1749.0
1750|SU, SHUN-FENG&PEDRYCZ, WITOLD&HONG, TZUNG-PEI&Francisco de Assis Tenorio de Carvalho|guest editori special issu granular symbol data process|2016|1750.0
1751|Francisco de Assis Tenorio de Carvalho&BERTRAND, PATRICE&SIMÕES, EDUARDO C.|batch algorithm interv valu data weight variabl|2016|1751.0
1752|Fabiana B. T. Alves&Denise S. Wambier&Jenny H. A. Alvarez&José Carlos Ferreira da Rocha&Thais R. Kummer&Vanessa C. de Castro&Howard Cabral&Vitoldo Antônio Kozlowski Jr|children day nurseri facil associ risk nonnutrit suck habit|2016|1752.0
1753|Giovani Pieri&Werner Kraus Junior&FARINES, JEAN-MARIE|network format algorithm bus rider|2016|1753.0
1758|Leonardo Andrade Ribeiro&Natália Cristina Schneider&Andrei de Souza Inácio&Harley Miguel Wagner&Aldo von Wangenheim|bridg databas applic declar similar match|2016|1758.0
1762|Carlos Alberto Alonso Sanches&Nei Yoshihiro Soma|resolut problem time comput|2016|1762.0
1763|Andre Schneider de Oliveira&DE PIERI, EDSON ROBERTO&MORENO, UBIRAJARA FRANCO&MARTINS, DANIEL|approach singular invers kinemat error chain davi method|2016|1763.0
1764|Luís Alexandre Estevão da Silva|data mine approach standard collector name herbarium databas|2016|1764.0
1769|GOMEZ CAICEDO, JHON ALEXANDER&MATTIA, OSCAR E.&KLIMACH, HAMILTON&Sergio Bampi|v suppli nanowatt sub bandgap curvatur compens voltag refer|2016|1769.0
1770|SOARES, LEONARDO BANDEIRA&DA COSTA, EDUARDO ANTONIO CÉSAR&Sergio Bampi|design area energi fir filter adder circuit|2016|1770.0
1771|Pablo Alfredo Saip Baier&Jürgen Alfred Baier-Saip&Klaus Schilling&Jauvane Cavalcante de Oliveira|simul minim invas vascular intervent hardwar softwar|2016|1771.0
1772|LEITE, DIEGO Q.&DUARTE, JULIO C.&NEVES, LUIZ P.&Jauvane Cavalcante de Oliveira&GIRALDI, GILSON A.|hand gestur recognit depth data cave applic interact|2016|1772.0
1773|ZAITCHIK, BENJAMIN F.&HAYDEN, MARY H.&Daniel Antunes Maciel Villela&LORD, CYNTHIA C.&KITRON, URIEL D.&CARVAJAL, JOSÉ JOAQUÍN&CÂMARA, DANIEL C. P.&DOS REIS, IZABEL C.|climat inform arbovirus risk monitor opportun challeng|2016|1773.0
1774|Claudia Torres Codeço&Daniel Antunes Maciel Villela&Marcelo F. Gomes&Leonardo Soares Bastos&Oswaldo G. Cruz&Claudio José Struchiner&Luiz Max de Carvalho&Flavio Codeço Coelho|reason miss olymp game rio de janeiro respons letter dr colleagu dr margaret chan director general threat game|2016|1774.0
1775|Daniel Antunes Maciel Villela|analysi capac vector born diseas moment generat function|2016|1775.0
1776|GARCIA, GABRIELA DE AZAMBUJA&DOS SANTOS, LILHA MARIA BARBOSA&Daniel Antunes Maciel Villela&MACIEL-DE-FREITAS, RAFAEL|releas estim aed diptera culicida popul size surviv|2016|1776.0
1777|COELHO, FLAVIO CODEÇO&Daniel Antunes Maciel Villela&ARMSTRONG, MARGARET&DUROVNI, BETINA&SARACENI, VALERIA&LEMOS, CRISTINA&CODECO, CLAUDIA TORRES&CAMARGO, SABRINA&CARVALHO, LUIZ MAX DE&BASTOS, LEONARDO&ARDUINI, DENISE|incid adult women rio de janeiro suggest contribut transmiss men women|2016|1777.0
1778|SOUZA, PABLO RODRIGO&Euripedes Guilherme de Oliveira Nobrega|health monitor methodolog damag isol base arrang|2016|1778.0
1779|Ádamo Lima de Santana|view machin learn data analysi practic load forecast power system|2016|1779.0
1780|Antônio Cordeiro de Santana&Mário Miguel amin&Nilson Luiz Costa&Ádamo Lima de Santana&Marcos Antônio Souza dos Santos|valuat manag roundwood region state para|2016|1780.0
1782|Bruno Santos do Nascimento&Adriana Santarosa Vivacqua&Marcos Roberto da Silva Borges|architectur select visual inform emerg situat|2016|1782.0
1785|Nilander R. M. de Moraes&Sérgio Mariano Dias&Henrique Cota de Freitas&Luis Enrique Zárate Gálvez|parallel closur algorithm generat set implic rule|2016|1785.0
1786|Gustavo Mello Machado&Sebastian Boblest&ERTL, THOMAS&Filip Sadlo|space time bifurc line extract coher structur|2016|1786.0
1789|Krause, Jonas&Heitor Silvério Lopes|comput method schedul pipelin network|2016|1789.0
1793|Phelipe Sena Oliveira&Adaildo Gomes D'Assunção&Eduardo Amorim Souza&Custódio Peixeiro|techniqu antenna design base spider optim algorithm|2016|1793.0
1794|Filipe Pohlmann Gonzaga&Natan Chini&Claudio Luis Cruz de Oliveira&Gustavo Mirapalheta|communic optim base analysi|2016|1794.0
1797|Renan Sales Barros&Marcelo Walter|synthesi human skin pigment disord|2016|1797.0
1801|Paula Peixoto Assemany&Maria Lúcia Calijuri&Mariana Daniel Tango&COUTO, EDUARDO AGUIAR|energi potenti biomass cultiv effluent meat process plant|2016|1801.0
1802|LORENTZ, JULIANA F.&Maria Lúcia Calijuri&MARQUES, EDUARDO GOMES&Alessandra Carreiro Baptista|analysi appli landslid suscept map|2016|1802.0
1803|CASTRO, JACKELINE DE SIQUEIRA&Maria Lúcia Calijuri&Paula Peixoto Assemany&CECON, PAULO ROBERTO&DE ASSIS, IGOR RODRIGUES&RIBEIRO, VINÍCIUS JOSÉ|soil greenhous gas emiss volatil plant growth|2016|1803.0
1804|Taynan de Oliveira Costa&Maria Lúcia Calijuri&AVELAR, NAYARA VILELA&CARNEIRO, ANG?LICA DE C?SSIA DE OLIVEIRA&DE ASSIS, LET?CIA RODRIGUES|potenti biomass rate pond product|2016|1804.0
1806|Guy-Emmanuel Rigo&Cristiane Drebes Pedron&Mário Caldeira&Cintia Cristina Silva de Araujo|adopt higher educ institut|2016|1806.0
1807|Ivo Kenji Koga&ALMEIDA, E.|file transfer log analysi data center case studi|2016|1807.0
1808|Inmaculada Hernández Salmerón|enterpris inform integr|2016|1808.0
1809|Rivero, Carlos R.&Inmaculada Hernández Salmerón&Ruiz, David&Corchuelo, Rafael|map knowledg base exchang sampl|2016|1809.0
1811|Leonardo Nascimento Ferreira&Zhao, Liang|time seri cluster communiti detect network|2016|1811.0
1812|GOMES, ROBSON K.&DE OLIVEIRA, LUIZ P.L.&Luiz Gonzaga da Silveira Junior&TOGNOLI, FRANCISCO M.W.&VERONEZ, MAURICIO R.&DE SOUZA, MARCELO K.|algorithm detect orient estim structur lidar scan outcrop|2016|1812.0
1813|DE SÁ, ALAN OLIVEIRA&Nadia Nedjah&Luiza de Macedo Mourelle|distribut local swarm system swarm intellig algorithm|2016|1813.0
1814|DE MENDONÇA, RAFAEL MATHIAS&Nadia Nedjah&Luiza de Macedo Mourelle|distribut algorithm task assign swarm robot|2016|1814.0
1815|Nadia Nedjah&CALAZAN, ROGÉRIO DE MORAES&Luiza de Macedo Mourelle|particl dimens cooper orient parallel strategi effici high dimens problem optim graphic process unit|2016|1815.0
1816|Nadia Nedjah&SILVA, FELIPE P. DA&SÁ, ALAN O. DE&Luiza de Macedo Mourelle&BONILLA, DIANA A.|massiv design m base network imag classif|2016|1816.0
1817|DE SÁ, ALAN OLIVEIRA&Nadia Nedjah&Luiza de Macedo Mourelle|distribut local swarm robot min max particl swarm optim|2016|1817.0
1818|Nadia Nedjah&Luiza de Macedo Mourelle&WANG, CHAO|parallel pipelin architectur effici implement advanc encrypt standard algorithm reconfigur hardwar|2016|1818.0
1819|Nadia Nedjah&CALAZAN, ROGÉRIO DE M.&Luiza de Macedo Mourelle&WANG, CHAO|parallel implement cooper particl swarm optim core multi core architectur|2016|1819.0
1820|Edgard de Macedo Silva&Josinaldo Pereira LEITE&Francisco A. de França Neto&João P. Leite&Walter M. L. Fialho&Victor Hugo Costa de Albuquerque&J M R S TAVARES|evalu magnet permeabl microstructur character duplex stainless steel|2016|1820.0
1821|Francisco Diego Lima Moreira&Maurício Nunes Kleinberg&Hemerson Furtado Arruda&Francisco Nélio Costa Freitas&Marcelo Monteiro Valente Parente&Victor Hugo Costa de Albuquerque&Pedro Pedrosa Rebouças Filho|measur techniqu base balloon activ contour method|2016|1821.0
1823|Jailson A. da Nóbrega&Diego D. S. Diniz&Antonio Almeida Silva&Theophilo M. Maciel&Victor Hugo Costa de Albuquerque&João Manuel R. S. Tavares|numer evalu temperatur field residu stress steel weld joint finit element method|2016|1823.0
1824|DE MACEDO SILVA, EDGARD&LEITE, JOSINALDO PEREIRA&LEITE, JOÃO PEREIRA&FIALHO, WALTER MACEDO LINS&Victor Hugo Costa de Albuquerque&TAVARES, JOÃO MANUEL R. S.|induc magnet field detect sigma phase duplex stainless steel|2016|1824.0
1825|GOMES, SAMUEL LUZ&Elizângela de S. Rebouças&Edson Cavalcanti Neto&J. P. Papa&Victor Hugo Costa de Albuquerque&Pedrosa Pedrosa Rebouças Filho&TAVARES, J.M.R.S.|embed time speed limit sign recognit imag process machin learn techniqu|2016|1825.0
1827|SILVA, EDGARD&MARINHO, LEANDRO&FILHO, PEDRO&LEITE, JOÃO&LEITE, JOSINALDO&FIALHO, WALTER&Victor Hugo Costa de Albuquerque&TAVARES, JOÃO|classif induc magnet field signal microstructur character sigma phase duplex stainless steel|2016|1827.0
1832|SILVA, EDGARD&PAULA, ALYSSON&LEITE, JOSINALDO&LEITE, JOAO&ANDRADE, LUCIA&Victor Hugo Costa de Albuquerque&TAVARES, JOAO|detect magnet easi direct steel induc field|2016|1832.0
1834|MARTELLO, FELIPE&ANDRIOLLI, FERNANDO&DE SOUZA, THAMYRYS BEZERRA&DODONOV, PAVEL&Milton Cezar Ribeiro|edg land use effect dung beetl coleoptera scarabaeida scarabaeina veget|2016|1834.0
1835|MEDEIROS, HUGO REIS&THIBES HOSHINO, ADRIANO&Milton Cezar Ribeiro&DE OLIVEIRA MENEZES JUNIOR, AYRES|landscap complex affect cover speci rich weed environ|2016|1835.0
1836|MUYLAERT, RENATA L.&STEVENS, RICHARD D.&Milton Cezar Ribeiro|threshold effect habitat loss bat rich forest landscap|2016|1836.0
1837|SANTOS, PALOMA MARQUES&CHIARELLO, ADRIANO GARCIA&Milton Cezar Ribeiro&RIBEIRO, JOHN WESLEY&PAGLIA, ADRIANO PEREIRA|landscap influenc habitat occup endang mane sloth bradypus landscap|2016|1837.0
1838|TIBÚRCIO, GABRIELA SANTOS&CARVALHO, CAROLINA DA SILVA&FERREIRA, FABIO COP&GOITEIN, ROBERTO&Milton Cezar Ribeiro|landscap effect occurr ichthyofauna order stream brazil|2016|1838.0
1839|DA SILVEIRA, NATALIA STEFANINI&NIEBUHR, BERNARDO BRANDÃO S.&MUYLAERT, RENATA DE LARA&Milton Cezar Ribeiro&PIZO, MARCO AURÉLIO|effect land cover movement frugivor bird heterogen landscap|2016|1839.0
1841|DUARTE, GABRIELA TEIXEIRA&Milton Cezar Ribeiro&PAGLIA, ADRIANO PEREIRA|ecosystem servic model tool defin prioriti area conserv|2016|1841.0
1842|MAGIOLI, MARCELO&FREGONEZI, GABRIELA DE LIMA&DO PRADO, HELENA ALVES&FERREIRA, MITRA KATHERINA&Milton Cezar Ribeiro&VILLELA, PRISCILLA MARQUI SCHMIDT&COUTINHO, LUIZ LEHMANN&RODRIGUES, MÁRCIA GONÇALVES&FERRAZ, KATIA MARIA PASCHOALETTO MICCHI DE&SETZ, ELEONORE ZULNARA FREIRE&PERCEQUILLO, ALEXANDRE REIS&RONDON, MICHELLE VIVIANE DE SÁ SANTOS&KUHNEN, VANESSA VILLANOVA&CANHOTO, MARIANA CRISTINA DA SILVA&DOS SANTOS, KAREN EVELYN ALMEIDA&KANDA, CLAUDIA ZUKERAN|connect maintain assemblag divers landscap|2016|1842.0
1843|FAMPA, MARCIA&Jon Lee&Wendel Alexandre Xavier de Melo|branch bound algorithm euclidean tree problem n space|2016|1843.0
1844|FAMPA, MARCIA&Jon Lee&Wendel Alexandre Xavier de Melo|optim quadrat|2016|1844.0
1845|Francisco Alixandre Ávila Rodrigues&Jeová F. S. Rocha Neto&Regis Cristiano Pinheiro Marques&Fátima Nelsizeuma Sombra de Medeiros&Juvêncio S. Nobre|sar imag segment rough inform|2016|1845.0
1846|REBOUÇAS, ELIZÂNGELA S.&BRAGA, ALAN M.&Regis Cristiano Pinheiro Marques&REBOUÇAS FILHO, PEDRO PEDROSA|approach calcul densiti cast iron graphit level set|2016|1846.0
1847|NOBRE, RICARDO H.&RODRIGUES, FRANCISCO A. A.&Regis Cristiano Pinheiro Marques&NOBRE, JUVENCIO S.&NETO, JEOVA F. S. R.&MEDEIROS, FATIMA N. S.|sar imag segment entropi|2016|1847.0
1849|Miguel Elias Mitre Campista&Rafael Pinaud Laufer&Pedro Braconnot Velloso&ABBAS JAMALIPOUR|softwar network|2016|1849.0
1850|COSTA, NAYARA SILVA&DA SILVA, CARLOS ALBERTO LOPES&MONTEIRO FERREIRA, DANIELA CARVALHO&Luciano Vieira Lima|teach learn structur knowledg map analysi new approach|2016|1850.0
1851|HELIO OLIVEIRA FERRARI&Luciano Vieira Lima|innov educ develop collect potenti thought concept digit cultur|2016|1851.0
1852|MEDEIROS, AMANDA L.&SCORTECCI, KATIA C.&FURTADO, CRISTIANE M.&LEITE, FRANCINALDO S.&SOUTO, VALESKA S.&DE SETTA, NATHALIA&VAN SLUYS, MARIE-ANNE&Joao Paulo Fumio Whitaker Kitajima&COSTA, ANA PAULA P.&BENEDITO, VAGNER A.|dissect sugarcan flower equatori field condit|2016|1852.0
1853|Dalcimar Casanova&FLORINDO, J.B.&FALVO, M.&BRUNO, O.M.|textur analysi descriptor estim interfer color channel|2016|1853.0
1855|Francisco Heron de Carvalho Junior&REZENDE, CENEZ ARAÚJO&DE CARVALHO SILVA, JEFFERSON&GUIMARÃES AL-ALAM, WAGNER&UCHOA DE ALENCAR, JOÃO MARCELO|abstract type system compon base perform comput platform|2016|1855.0
1856|Francisco Heron de Carvalho Junior&REZENDE, CENEZ ARAÚJO|perform evalu execut environ comput represent array|2016|1856.0
1857|Flávia Pisani&Daniel Carlos Guimarães Pedronette&Ricardo da Silva Torres&Edson Borin|space rank acceler sort rank list step system|2016|1857.0
1860|MATA, CARMEN&Wanderson de Oliveira Leite&MORENO, RICARDO&AGUDELO, JOHN R.&ARMAS, OCTAVIO|predict nox emiss fuel consumpt citi bus real oper condit mean biharmon map|2016|1860.0
1861|Jose Ricardo de Almeida Torreao|quantum mechan signal tune approach striat cortex|2016|1861.0
1862|Jose Ricardo de Almeida Torreao|general signal tune approach signal represent analysi|2016|1862.0
1864|LOPES, ANDRE TEIXEIRA&Edilson de Aguiar&SOUZA, ALBERTO F. DE&OLIVEIRA-SANTOS, THIAGO|facial express recognit convolut neural network cope data train sampl order|2016|1864.0
1866|Filipe Wall Mutz&VERONESE, LUCAS P.&OLIVEIRA-SANTOS, THIAGO&Edilson de Aguiar&AUAT CHEEIN, FERNANDO A.&FERREIRA DE SOUZA, ALBERTO|scale map field scenario car|2016|1866.0
1867|ROCHA, ROGÉRIO VINÍCIUS MATOS&Dany Sanchez Dominguez&Susana Marrero Iglesias&BARROS, RICARDO CARVALHO DE|finit element method spectral green function slab geometri neutron diffus multipli media energi group|2016|1867.0
1868|Érica Josiane Coelho Gouvêa&REGIS, ROMMEL G.&SOTERRONI, ALINE C.&SCARABELLO, MARLUCE C.&RAMOS, FERNANDO M.|optim q gradient|2016|1868.0
1869|Gabriel Henrique de Almeida Pereira&LOHMANN, MARCIEL&MAGANHOTTO, RONALDO FERREIRA|propos evalu indic delimit map water bodi imag landsat satellit|2016|1869.0
1871|Marina Esther Groshaus&LIN, MIN CHIH&SZWARCFITER, JAYME L.|neighborhood helli graph|2016|1871.0
1872|Marina Esther Groshaus&MONTERO, LEANDRO|bound number twin graph|2016|1872.0
1873|PENNA, PEDRO H.&CASTRO, MÁRCIO&FREITAS, HENRIQUE C.&BROQUEDIS, FRANÇOIS&Jean-Francois Paul Fernand Méhaut|design methodolog workload loop schedul strategi base algorithm simul|2016|1873.0
1874|RAMOS, PABLO&VARGAS, VANESSA&BAYLAC, MAUD&VILLA, FRANCESCA&REY, SOLENNE&CLEMENTE, JUAN ANTONIO&ZERGAINOH, NACER-EDDINE&Jean-Francois Paul Fernand Méhaut&VELAZCO, RAOUL|evalu sensit nm multi core processor mev neutron|2016|1874.0
1875|CASTRO, MÁRCIO&FRANCESQUINI, EMILIO&DUPROS, FABRICE&AOCHI, HIDEO&NAVAUX, PHILIPPE O.A.&Jean-Francois Paul Fernand Méhaut|seismic wave propag simul power perform|2016|1875.0
1876|Rodolfo Adamshuk Silva&Simone do Rocio Senger de Souza&Paulo Sérgio Lopes de Souza|systemat review search base mutat test|2016|1876.0
1877|Olga Nikolaevna Goussevskaia&VIEIRA, LUIZ F.M.&VIEIRA, MARCOS A.M.|wireless schedul multipl data rate physic interfer disk graph|2016|1877.0
1879|Rodrigo Rocha Silva&Celso Massaki Hirata&Joubert de Castro Lima|comput big data cube memori|2016|1879.0
1881|Henrique Santos Fernandes&Matheus Bernardes de Moura&Paulo Cesar da Costa Guadelupe&Marcio Zamboti Fortes&Natalia Castro Fernandes|softwar manag transform devic|2016|1881.0
1882|Fausto Guzzo da Costa&RIOS, R.A.&DE MELLO, R.F.|system tool detect concept drift data stream|2016|1882.0
1884|D'ANGELO, MARCOS F.S.V.&PALHARES, REINALDO M.&MAIA, RENATO D.&Joao Batista Mendes&EKEL, PETR YA.&CANGUSSU, CAMILA K.S.&AGUIAR, LUCAS A.|monitor induct machin possibl fault detect fuzzi bayesian approach problem time seri multipl chang point detect|2016|1884.0
1885|D?ANGELO, MARCOS F.S.V.&PALHARES, REINALDO M.&CAMARGOS FILHO, MURILO C.O.&MAIA, RENATO D.&Joao Batista Mendes&EKEL, PETR YA.|fault classif approach appli tennesse eastman benchmark process|2016|1885.0
1886|AGRA, AGOSTINHO&Marcio Costa Santos&NACE, DRITAN&POSS, MICHAEL|program approach class robust optim problem|2016|1886.0
1888|ALMEIDA, MARIZA&SANTOS, DOUGLAS&ARAGÃO, LUIZIANA&NOGUEIRA, GABRIEL&Andréa Soares Bonifácio&SIMÕES, BRUNO&TERRA, BRANCA|expand vision univers case studi brazil|2016|1888.0
1889|Renata Maria Abrantes Baracho Porto&Paloma Albuquerque Diesel|inform manag process extract student dropout indic cours distanc mode|2016|1889.0
1890|Darrell Fielder&Urcun Tanik&Cristiane Chaves Gattaz&Murat Tanik&Fuad Gattaz Sobrinho|converg implic energi complex system|2016|1890.0
1891|Carla Ilane Moreira Bezerra&ANDRADE, ROSSANA M.C.&MONTEIRO, JOSE MARIA|explor qualiti measur evalu featur model case studi|2016|1891.0
1892|CARVALHO, RAINARA MAIA&DE CASTRO ANDRADE, ROSSANA MARIA&DE OLIVEIRA, KÁTHIA MARÇAL&DE SOUSA SANTOS, ISMAYLE&Carla Ilane Moreira Bezerra|qualiti characterist measur comput interact evalu system|2016|1892.0
1895|Ernesto Sasaki Imakuma&USSAMI, EDSONYASSUSHI&MEYER, ALBERTO|train model cadav establish|2016|1895.0
1896|KAWAMOTO, FLAVIO MASATO&PAJECKI, DENIS&JOAQUIM, HENRIQUE DAMETO&RICCIOPPO, DANIEL OLIVEIRA&Ernesto Sasaki Imakuma&MACACARI, RODRIGO&SANTO, MARCO AURELIO|revis band roux en y gastric bypass pouch resiz redo gastrojejun anastomosi ring migrat pouch dilat|2016|1896.0
