autores*|*titulo*|*ano
Victor Hugo Masutani&ARTERO, ALMIR OLIVETTE&Leandro Luiz de Almeida&Francisco Assis da Silva*|*RECONHECIMENTO DE OBJETOS COLORIDOS E MAOS USANDO CORES E FORMAS*|*2013
Leandro Luiz de Almeida&Francisco Assis da Silva&Maria Stela Veludo de Paiva&ARTERO, ALMIR OLIVETTE*|*Super-Resolution Images Enhanced for Applications to Character Recognition*|*2013
Ely França dos Santos Ferreira&Francisco Assis da Silva&PAZOTI, MÁRIO AUGUSTO&Leandro Luiz de Almeida&Robson Augusto Siscoutto*|*EXTRACAO DE SEMENTES DE RODOVIAS A PARTIR DE IMAGENS AEREAS DIGITAIS*|*2013
CAMELO, LETÍCIA APARECIDA DE MOURA&Francisco Assis da Silva&Ricardo Luís Barbosa&PAZOTI, MÁRIO AUGUSTO&Leandro Luiz de Almeida*|*DETECCAO, RECONHECIMENTO E GEORREFERENCIAMENTO DE LOGOTIPOS*|*2013
Aloísio Carlos de Pina&DE PINA, ALINE APARECIDA&ALBRECHT, CARL HORST&LEITE PIRES DE LIMA, BEATRIZ SOUZA&JACOB, BRENO PINHEIRO*|*ANN-based surrogate models for the analysis of mooring lines and risers*|*2013
JUNIOR, LAFAETE CREOMAR LIMA&FILHO, ARMANDO CARLOS DE PINA&Aloísio Carlos de Pina*|*Study and Modeling of an Underwater Cleaning Robot*|*2013
BIRGIN, ERNESTO G.&FEOFILOFF, PAULO&FERNANDES, CRISTINA G.&MELO, EVERTON L.&Marcio Takashi Iura Oshiro&RONCONI, DÉBORA P.*|*A MILP model for an extended version of the Flexible Job Shop Problem*|*2013
Eduardo Nazareth Paiva*|*O automovel (FNM - FIAT) Alfa Romeo 2300 a partir de sua publicidade: um ensaio demonstrando a justaposicao da alma do negocio ao espirito cientifico*|*2013
Tiago Pessoa Ferreira de Lima&Teresa Bernarda Ludermir*|*An automatic method for construction of ensembles to time series prediction*|*2013
Patricia Kayser Vargas Mangan*|*La informatica y la inclusion de personas jovenes y adultas ciegas en la ensenanza superior: la accesibilidad web como estrategia para la inclusion digital y cultural*|*2013
Sóstenes Pereira Gomes&RIBEIRO, GLAYDSTON MATTOS&LORENA, LUIZ ANTONIO NOGUEIRA*|*Dispersion for the point-feature cartographic label placement problem*|*2013
CHAVES, GUILHERME M.&TERÇARIOLI, GISELA R.&PADOVAN, ANA CAROLINA B.&ROSAS, ROBERT C.&Renata Carmona e Ferreira&MELO, ANALY S. A.&COLOMBO, ARNALDO L.*|*Candida mesorugosa sp. nov., a novel yeast species similar to Candida rugosa, isolated from a tertiary hospital in Brazil*|*2013
Renata Carmona e Ferreira&Fernando Antoneli&Marcelo R. S. Briones*|*The hidden factors in impact factors: a perspective from Brazilian science*|*2013
REAL, F.&MORTARA, R. A.&BARBIERI, C. L.&MIECZKOWSKI, P.&DA SILVEIRA, J. F.&BRIONES, M. R. D. S.&PEREIRA, G. A. G.&BAHIA, D.&VIDAL, R. O.&CARAZZOLLE, M. F.&MONDEGO, J. M. C.&COSTA, G. G. L.&HERAI, R. H.&WURTELE, M.&DE CARVALHO, L. M.&Renata Carmona e Ferreira*|*The Genome Sequence of Leishmania (Leishmania) amazonensis: Functional Annotation and Extended Analysis of Gene Models*|*2013
Danielle C. F. Silva&Richard C. Silva&Renata Carmona e Ferreira&Marcelo Briones*|*Examining marginal sequence similarities between bacterial type III secretion system components and Trypanosoma cruzi surface proteins: horizontal gene transfer or convergent evolution?*|*2013
Ramisch, Carlos&Aline Villavicencio&Valia Kordoni*|*Introduction to the special issue on multiword expressions*|*2013
AGUIAR, ALEXANDRA&Sérgio Johann Filho&MAGALHAES, FELIPE&HESSEL, FABIANO*|*On the design space exploration through the Hellfire Framework*|*2013
Raphael Winckler de Bettio&Denilson Alves Pereira&Ronei Ximenes Martins&Tales Heimfarth*|*The Experience of Using the Scrum Process in the Production of Learning Objects for Blended Learning*|*2013
Raphael Winckler de Bettio&André Hermenegildo Costa Silva&Tales Heimfarth&André Pimenta Freire*|*Model and implementation of body movement recognition using Support Vector Machines and Finite State Machines with Cartesian coordinates input for gesture-based interaction*|*2013
FERRAZ, INHAÚMA&Ana Cristina Bicharra Garcia*|*Ontology in association rules*|*2013
DA SILVA, CINTIA RC&Ana Cristina Bicharra Garcia*|*A collaborative working environment for small group meetings in Second Life*|*2013
Débora Nice Ferrari Barbosa&Jorge Luis Victória Barbosa&PATRICIA BRANDALISE SCHERER BASSANI&João Henrique da Rosa&Marcus Vinícius Lewis Martins&Cássia Pereira Nino*|*Content management in a ubiquitous learning environment*|*2013
PATRICIA BRANDALISE SCHERER BASSANI&Débora Nice Ferrari Barbosa*|*Cooperation and participation in online education social presence in collective writing environments*|*2013
PATRICIA BRANDALISE SCHERER BASSANI&Débora Nice Ferrari Barbosa&N Mappeli&Lucas Silva Sauter&Frozza, M*|*Cooperacao e participacao na educacao online: a presenca social em ambientes de escrita coletiva*|*2013
Angélica Luísa Nienow&PATRICIA BRANDALISE SCHERER BASSANI&Débora Nice Ferrari Barbosa*|*Politicas Publicas para a Inclusao Digital nas Escolas Publicas Brasileiras*|*2013
PATRICIA BRANDALISE SCHERER BASSANI&Débora Nice Ferrari Barbosa*|*A importancia da presenca social na formacao de comunidades virtuais de aprendizagem na educacao online*|*2013
Débora Nice Ferrari Barbosa&PATRICIA BRANDALISE SCHERER BASSANI*|*Em direcao a uma aprendizagem mais ludica, significativa e participativa: experiencias com o uso de jogos educacionais, tecnologias moveis e comunidade virtual com sujeitos em tratamento oncologico*|*2013
PATRICIA BRANDALISE SCHERER BASSANI&Débora Nice Ferrari Barbosa&Patrícia Thoma Eltz*|*Praticas pedagogicas com a web 2.0 no ensino fundamental*|*2013
Marco Antonio de Barros Ceze&FIDKOWSKI, KRZYSZTOF J.*|*Anisotropic hp-Adaptation Framework for Functional Prediction*|*2013
Nelson Yoshihare Kume&Isabel Cristina Italiano*|*O desenho da roupa plissada*|*2013
Danielle Paganini Beduschi&Isabel Cristina Italiano*|*Guidelines for Patternmaking Teaching and for Didactic Materials*|*2013
Danielle Paganini Beduschi&Isabel Cristina Italiano*|*Descricao e Analise da Evolucao dos Metodos e Obras de Modelagem Plana no Brasil: De 1960 aos Dias Atuais*|*2013
Nelson Yoshihare Kume&Isabel Cristina Italiano*|*Ilustrissimo desenho de moda*|*2013
Ivandre Paraboni&VAN DEEMTER, KEES*|*Reference and the facilitation of search in spatial domains*|*2013
Douglas Fernandes Pereira da Silva Júnior&Ivandre Paraboni&Eder Miranda de Novais*|*Um Sistema de Realizacao Superficial para Geracao de Textos em Portugues*|*2013
Ulisses Martins Dias&Dias, Zanoni*|*HEURISTICS FOR THE TRANSPOSITION DISTANCE PROBLEM*|*2013
Sigmundo Preissler Junior&João Artur de Souza&Gertrudes A. Dandolini&Tales Vicente Viegas&William Alberto Cruz Castañeda*|*PROPOSTA DE UM MODELO PARA PREDICAO DE MANUTENCOES DE EQUIPAMENTOS MEDICO-HOSPITALARES: UM ESTUDO MULTICASOS EM HOSPITAIS DA GRANDE FLORIANOPOLIS (SC)*|*2013
Sigmundo Preissler Junior*|*A CERTIFICACAO DIGITAL NA GESTAO DOCUMENTAL ACADEMICA: UM ESTUDO DE CASO*|*2013
Kellyanne Carvalho Alves&MEIRELLES, Mariana&Tatiana Aires Tavares&Guido Lemos de Souza Filho*|*Producao de Conteudos Interativos: uma experiencia do projeto Estacao-Escola de Televisao Digital/Lavid/XPTA.LAB*|*2013
Joao Ricardo Andreo&Eduardo Martins Morgado*|*Uma metodologia para adaptacao de videos institucionais em Tv Digital: Explorando a interatividade GINGA*|*2013
Eduardo Martins Morgado&Joao Ricardo Andreo*|*Um estudo sobre a utilizacao do software SCRATCH como ferramenta de apoio ao ensino da disciplina de logica de programacao*|*2013
Eduardo Martins Morgado*|*O Brasil no Global Innovation Index 2012. Aprofundando o Entendimento dos Resultados*|*2013
Joao Ricardo Andreo&Eduardo Martins Morgado*|*Um estudo sobre a utilizacao do software SCRATCH como ferramenta de apoio ao ensino da disciplina de logica de programacao*|*2013
José Domingo Álvarez&Juana López Redondo&Eduardo Camponogara&Júlio Elias Normey Rico&Manuel Berenguel&Pilar Martínez Ortigosa*|*Optimizing building comfort temperature regulation via model predictive control*|*2013
Ríad Mattos Nassiffe&Eduardo Camponogara&George Marconi de Araújo Lima*|*Optimizing QoS in energy-aware real-time systems*|*2013
SCHERER, H.F.&Manuel Pasamontes&Guzmán, J.L.&Álvarez, J.D.&Eduardo Camponogara&NORMEY-RICO, J.E.*|*Efficient building energy management using distributed model predictive control*|*2013
VASIRANI, MATTEO&KLÜGL, FRANZISKA&Eduardo Camponogara&HATTORI, HIROMITSU*|*Editorial: Special Issue on Intelligent Agents in Traffic and Transportation*|*2013
Quiles&Márcio Porto Basgalupp&Barros, Rodrigo C.*|*An Oscillatory Correlation Model for Semi-Supervised Classification*|*2013
Barros, Rodrigo C.&Márcio Porto Basgalupp&André C. P. L. F. de Carvalho&Alex A. Freitas*|*Automatic Design of Decision-Tree Algorithms with Evolutionary Algorithms*|*2013
Hugo Barbalho&Rosseti, Isabel&Martins, Simone L.&Alexandre Plastino de Carvalho*|*A hybrid data mining GRASP with path-relinking*|*2013
Mariana Tasca Fontenelle Lôbo&Bianca Zadrozny&Alexandre Plastino de Carvalho*|*A Relevance Measure for Multivalued Attributes*|*2013
KAKITANI, MARCOS&BRANTE, GLAUBER&SOUZA, RICHARD DEMO&Anelise Munaretto Fonseca&IMRAN, MUHAMMAD ALI*|*Energy efficiency of some non-cooperative, cooperative and hybrid communication schemes in multi-relay WSNs*|*2013
SKYRME, ALEXANDRE&Noemi de La Rocque Rodriguez&IERUSALIMSCHY, ROBERTO*|*A survey of support for structured communication in concurrency control models*|*2013
Rodrigo Geraldo Ribeiro&FIGUEIREDO, LUCÍLIA&CAMARÃO, CARLOS*|*Mechanized metatheory for a $$lambda $$  -calculus with trust types*|*2013
Rodrigo Geraldo Ribeiro&CAMARÃO, CARLOS*|*Ambiguity and context-dependent overloading*|*2013
Rodrigo Geraldo Ribeiro&CAMARÃO, CARLOS&FIGUEIREDO, LUCÍLIA*|*Terminating constraint set satisfiability and simplification algorithms for context-dependent overloading*|*2013
Vinícyus Santos Guimarães&Ivanor Nunes de Oliveira&Cláudio Rodolfo Sousa de Oliveira&Maísa Soares dos Santos Lopes&Jeferson Alves Oliveira&Robson Mendes Reis*|*UM AMBIENTE PARA AS PRATICAS LABORATORIAIS DE FISICA: ESTUDO DO PENDULO MATEMATICO*|*2013
Mitchel Soni Felske&Diana Francisca Adamatti*|*Proposta de uma Arquitetura Hibrida para Massively Multiplayer Online Games*|*2013
Carlos Madsen&Diana Francisca Adamatti*|*Using Artificial Neural Networks in NPC Decision-Making Process*|*2013
Dinarte Mello da Luz Junior&Marcus Guimaraes&Regina Barwaldt&Diana Francisca Adamatti&Carla I. M. de Felipe*|*Um Modelo de Ferramenta Computacional Aplicada ao Processo de Aprendizagem Especial: As Tecnologias Assistivas*|*2013
Marcelo de Almeida Maia&Raquel Fialho de Queiroz Lafetá*|*On the impact of trace-based feature location in the performance of software maintainers*|*2013
Marcelo de Almeida Maia&Allysson Costa e Silva&Ilmério Reis da Silva*|*On the Influence of Latent Semantic Analysis Parameterization for Bug Localization*|*2013
Ricardo de Andrade Araújo&Adriano Lorena Inacio de Oliveira&Silvio Romero de Lemos Meira*|*A Swarm-based Evolutionary Morphological Approach for Binary Classification Problems*|*2013
Iuri Santos Souza&Gecynalda Gomes&Paulo Anselmo da Mota Silveira Neto&Ivan do Carmo Machado&Eduardo Santana de Almeida&Silvio Romero de Lemos Meira*|*Evidence of Software Inspection on Feature Specification for Software Product Lines*|*2013
Eduardo Santana de Almeida&Luanna Lopes Lobato&Paulo Anselmo da Mota Silveira Neto&Eduardo Santana de Almeida&Silvio Romero de Lemos Meira*|*RISK MANAGEMENT IN SOFTWARE PRODUCT LINE ENGINEERING: A MAPPING STUDY*|*2013
Yguaratã Cerqueira Cavalcanti&Paulo Anselmo da Mota Silveira Neto&Daniel Lucrédio&Tassio Vale&Eduardo Santana de Almeida&Silvio Romero de Lemos Meira*|*The Bug Report Duplication Problem: An Exploratory Study*|*2013
DURAO, FREDERICO&CARACIOLO, MARCEL PINHEIRO&MELO, BRUNO&Silvio Romero de Lemos Meira*|*Towards effective course-based recommendations for public tenders*|*2013
Edeilson Milhomem da Silva&Diego Oliveira Rodrigues&Jackson Gomes de Souza&Parcilene Fernandes de Brito&Ana Carolina Salgado&Silvio Romero de Lemos Meira*|*Inferring Hidden Trust Relationships in Social Networks for Encouraging Collaboration and Cooperation among Individuals*|*2013
Jackson Gomes de Souza&Edeilson Milhomem da Silva&Parcilene Fernandes de Brito&José Alfredo F. Costa&Ana Carolina Salgado&Silvio Romero de Lemos Meira*|*Using Graph Clustering for Community Discovery in Web-Based Social Networks*|*2013
Jefferson L. M. da Silveira&Flávio Keidi Miyazawa&Eduardo Candido Xavier*|*Heuristics for the Strip Packing Problem with Unloading Constraints*|*2013
MOISÉS DA SILVEIRA, JEFFERSON LUIZ&Eduardo Candido Xavier&MIYAZAWA, FLÁVIO KEIDI*|*A note on a two dimensional knapsack problem with unloading constraints*|*2013
Thiago Bruno Melo de Sales&Leandro Melo de Sales&Hyggo Oliveira de Almeida&Angelo Perkusich&Marcello Alves de Sales Junior*|*Multilevel security in UPnP networks for pervasive environments*|*2013
Villas, Leandro&Azedinne Boukerche&Heitor Soares Ramos Filho&Horácio A. B. Fernandes de Oliveira&Regina B. Araujo&Antonio Alfredo Ferreira Loureiro*|*DRINA: A Lightweight and Reliable Routing Approach for in-Network Aggregation in Wireless Sensor Networks*|*2013
Rui Maia Diamantino*|*Cama de gato: uma ficcao do desejo para alem do synthome?*|*2013
Gabriela Trindade&Rui Maia Diamantino*|*Amor de transferencia: um estudo de caso baseado em In Treatment*|*2013
Rui Maia Diamantino*|*Dos restos, a metafora: um retorno ao ?Caso Signorelli?, de Freud*|*2013
Nara Núbia Vieira&André Luiz Fernandes Cançado*|*Identificacao de Conglomerados Espaciais de Acidentes Aereos no Brasil*|*2013
Luanna Lopes Lobato&BITTAR, THIAGO JABUR&NETO, PAULO ANSELMO DA MOTA SILVEIRA&MACHADO, IVAN DO CARMO&DE ALMEIDA, EDUARDO SANTANA&Silvio Romero de Lemos Meira*|*RISK MANAGEMENT IN SOFTWARE PRODUCT LINE ENGINEERING: A MAPPING STUDY*|*2013
Santos, Jane Meri&de Sá, Leandro Melo&Neyval Costa Reis Junior&Horan, Nigel John*|*Kinetic models of hydrogen sulphide formation in anaerobic bioreactors*|*2013
Bruno José Torres Fernandes&CAVALCANTI, GEORGE D. C.&REN, TSANG I.*|*AutoAssociative Pyramidal Neural Network for one class pattern classification with implicit feature extraction*|*2013
Bruno José Torres Fernandes&CAVALCANTI, GEORGE D. C.&REN, TSANG I.*|*Lateral Inhibition Pyramidal Neural Network for Image Classification*|*2013
Kátia Santiago Ventura&Sandra de Albuquerque Siebra&André Felipe de Albuquerque Fell*|*A Importancia da Visao Sistemica para a Implementacao da Lei de Acesso a Informacao nas Instituicoes: o caso da Universidade Federal de Pernambuco*|*2013
Alex Mateus Porn&Leticia Mara Peres*|*Teste de Arquetipos*|*2013
ALANA REGINA BIAGI SILVA LISBOA&Cinthyan Renata Sachs Camerlengo de Barbosa*|*Lexicon of Orchids*|*2013
Ricardo Poley Martins Ferreira&Henrique Pacca Loureiro Luna&Phillipe Mahey&Mauricio Cardoso de Souza*|*Global optimization of capacity expansion and flow assignment in multicommodity networks*|*2013
GOLDBARG, MARCO C.&GOLDBARG, ELIZABETH F.G.&ASCONAVIETA, PAULO H.&MENEZES, MATHEUS DA S.&Henrique Pacca Loureiro Luna*|*A transgenetic algorithm applied to the Traveling Car Renter Problem*|*2013
Valeska Guimarães Rezende da Cunha*|*O TELEDUC NOS CURSOS DE FORMACAO DE COORDENADORES REGIONAIS PEDAGOGICOS E PRECEPTORES EM CURSOS DE GRADUACAO A DISTANCIA.*|*2013
Joaquín Pérez&Carlos Eduardo Santos Pires&Leandro Balby Marinho&Adriana Mexicano&Miguel Hidalgo*|*Early Classification: A New Heuristic to Improve the Classification Step of K-Means*|*2013
Paulo Sousa&Carlos Eduardo Santos Pires&Ana Carolina Salgado*|*A Method for Building Personalized Ontology Summaries*|*2013
AMBERGER, M.&BADE, K.&MEISER, J.&Danays Kunka&MOHR, J.*|*Electroplating of Micropatterned Nickel Phase Gratings for X-ray Phase Contrast Tomography*|*2013
Valéria Farinazzo Martins&Ana Grasielle Côrrea&Marcelo de Paiva Guimarães*|*Avaliacao de usabilidade para aplicacoes de realidade aumentada*|*2013
Valéria Farinazzo Martins&Alisson José Gregório de Oliveira&Marcelo de Paiva Guimarães*|*Implementacao de um laboratorio de realidade virtual de baixo custo: estudo de caso de montagem de um laboratorio para o ensino de Matematica*|*2013
Diego Roberto Colombo Dias&Moacyr Francischetti Corrêa&José Remo Ferreira Brega&Luis Carlos Trevelin&Marcelo de Paiva Guimarães*|*Teacher-learning process based on na immersive and interactive environment*|*2013
Eduardo da Silva&Murilo W S Lima&Luiz Carlos Pessoa Albini*|*Uma Avaliacao do Esquema de Gerenciamento de Chave Baseado em Identidade Identity Key Management*|*2013
CLASSE, TADEU&Regina Maria Maciel Braga&Fernanda Claudia Alves Campos&DAVID, JOSÉ MARIA N.*|*A Semantic Peer-to-Peer Network for Service Composition in Scientific Domains*|*2013
Nuria Pons Villardel Camas&Renata Aquino Ribeiro&Monica dos Santos Mandaji*|*A INTEGRACAO DE REDES SOCIAIS E A PESQUISA EM EDUCACAO, COMUNICACAO E TECNOLOGIA: ESTUDO DE CASO DO BLOG WEB CURRICULO*|*2013
Monica dos Santos Mandaji&Renata Aquino Ribeiro*|*Tecnologias de Informacao e Comunicacao: como utiliza-las para a colaboracao nas praticas pedagogicas?*|*2013
Nuria Pons Villardel Camas&Monica dos Santos Mandaji&Renata Aquino Ribeiro&Neli Maria Mengalli*|*PROFESSOR E CULTURA DIGITAL: REFLEXAO TEORICA ACERCA DOS NOVOS DESAFIOS NA ACAO FORMADORA PARA NOSSO SECULO*|*2013
Ana Trindade Winck&Karina Machado&Osmar Norberto de Souza&Duncan D. Ruiz*|*Context-based preprocessing of molecular docking data*|*2013
Rogelma Maria da Silva Ferreira&Luciano Calheiros Lapas&Fernando Albuquerque de Oliveira*|*General scaling relations in anomalous diffusion*|*2013
Agustín Pérez-Madrid&Luciano Calheiros Lapas&José Miguel Rubí*|*A Thermokinetic Approach to Radiative Heat Transfer at the Nanoscale*|*2013
Diego Tefili&Guillaume Barrault&Alexandre André Ferreira&Julio Apolinário Cordioli&Djones Vinicius Lettnin*|*Implantes cocleares: aspectos tecnologicos e papel socioeconomico*|*2013
LOPES, MILENE ELIZABETH RIGOLIN FERREIRA&Carlos Henrique Quartucci Forster*|*Application of Human Error Theories for the Process Improvement of Requirements Engineering*|*2013
NAKAGAWA, ELISA Y.&Pablo Oliveira Antonino de Assis&BECKER, MARTIN&MALDONADO, JOSÉ C.&STORF, HOLGER&VILLELA, KARINA B.&ROMBACH, DIETER*|*Relevance and perspectives of AAL in Brazil*|*2013
Elisa Yumi Nakagawa&Pablo Oliveira Antonino de Assis&BECKER, MARTIN&Maldonado, José C.&STORF, HOLGER&VILLELA, KARINA B.&ROMBACH, DIETER*|*Relevance and perspectives of AAL in Brazil*|*2013
Alex Antonio Florindo&Leandro Martin Totaro Garcia&Vanessa Martins Valente Guimarães&Emanuel Péricles Salvador&Homero Fonseca Filho&Rodrigo Siqueira Reis&José Cazuza de Farias Júnior*|*Escore de ambiente construido relacionado com a pratica de atividade fisica no lazer: aplicacao numa regiao de baixo nivel socioeconomico*|*2013
Kelly Samara da Silva&Adair da Silva Lopes&Giovâni Firpo Del Duca&Leandro Martin Totaro Garcia&Markus Vinicius Nahas*|*Padroes de envolvimento em atividades fisicas de lazer em trabalhadores com diferentes situacoes economicas: uma analise descritiva*|*2013
Leandro Martin Totaro Garcia&Renata Fonseca Inácio Osti&Evelyn Helena Corgosinho Ribeiro&Alex Antonio Florindo*|*Validacao de dois questionarios para a avaliacao da atividade fisica em adultos*|*2013
RÊGO, A.T.&HANRIOT, S.M.&OLIVEIRA, A.F.&BRITO, P.&Tarcísio Flávio Umbelino Rêgo*|*Automotive exhaust gas flow control for an ammonia-water absorption refrigeration system*|*2013
José Wilson Vieira&Viriato Leal Neto&José de Melo Lima Filho&Alex Cristóvão Holanda de Oliveira*|*Desenvolvimento de Algoritmos Simuladores de Fontes Radioativas Planares para Uso em Modelos Computacionais de Exposicao*|*2013
Gutemberg Luiz Sales Claudino&Viriato Leal Neto&José Wilson Vieira&Alex Cristóvão Holanda de Oliveira*|*Desenvolvimento de um Algoritmo Simulador de Fonte Radioativa Planar para Avaliacoes Dosimetricas em Acidentes Envolvendo Radiofarmacos Usados em Medicina Nuclear*|*2013
Moacir Antonelli Ponti&Mascarenhas, Nelson D. A.&Ferreira, Paulo J. S. G.&Suazo, Claudio A. T.*|*Three-dimensional noisy image restoration using filtered extrapolation and deconvolution*|*2013
Moacir Antonelli Ponti*|*Segmentation of Low-Cost Remote Sensing Images Combining Vegetation Indices and Mean Shift*|*2013
Marcelo Ribeiro Xavier da Silva&Lau Cheuk Lung&Leandro Quibem Magnabosco&Luciana de Oliveira Rech*|*Vbam - Byzantine Atomic Multicast in LAN Based on Virtualization Technology*|*2013
Jhonatan da Rosa&Murillo Titon de Souza&Luciana de Oliveira Rech&Leandro Quibem Magnabosco&Lau Cheuk Lung*|*Co-Evolution of Antagonistic Intelligent Agents Using Genetic Algorithms*|*2013
Diego Roberto Colombo Dias&Gustavo Jordan Castro Brasil&Bruno Barberi Gnecco&Mário Popolin Neto&Isabeli Andreoli Agostinho&Richard Valdívia&José Remo Ferreira Brega&Luis Carlos Trevelin*|*Desenvolvimento de Aplicacoes com Interface Natural de Usuario e Dispositivos PrimeSense como Meio de Interacao para Ambientes Virtuais*|*2013
Bruno Barberi Gnecco&Rodrigo de Godoy Domingues&Gustavo Jordan Castro Brasil&Diego Roberto Colombo Dias&Luis Carlos Trevelin*|*Estrategias Mistas de Mecanismos para Imersao em Modelos de Interacao. Tendencias e Tecnicas em Realidade Virtual e Aumentada*|*2013
Marcelo de Paiva Guimarães&Diego Colombo Dias&Moacyr Francischetti Corrêa&José Remo Ferreira Brega&Luis Carlos Trevelin*|*Teacher-learning process based on an immersive and interactive environment*|*2013
Sandra M. Leandro Koizimi&Luis Carlos Trevelin&José Dalton Cruz Pessoa&Luis Carlos Cunha Junior&Gustavo Henrique de Almeida Teixeira*|*Quantification of soluble solids in reconstituted acai (Euterpe Oleracea Mart.) pulp using near-infrared*|*2013
João Carlos Prates&Eduardo Fritzen&Sean Wolfgand Matsui Siqueira&Maria Helena L.B. Braz&Leila Cristina VASCONCELOS DE ANDRADE*|*Contextual web searches in Facebook using learning materials and discussion messages*|*2013
RODRIGUEZ, PAULA&TABARES, VALENTINA&DUQUE, NESTOR&OVALLE, DEMETRIO&Rosa Maria Vicari*|*BROA: An agent-based model to recommend relevant Learning Objects from Repository Federations adapted to learner profile*|*2013
Valentina Tabares&Néstor Darío Duque Méndez&Julián Moreno&Demetrio A Ovalle&Rosa Maria Vicari*|*Evaluacion de la calidad de metadatos en repositorios digitales de objetos de aprendizaje*|*2013
Liliana Maria Passerino&Maria Rosangela Bez&Rosa Maria Vicari*|*Formacao de Professores em Comunicacao Alternativa para criancas com TEA: contextos em acao*|*2013
SILVA, FERNANDO&Luis Miguel Parreira e Correia*|*An experimental study of noise and asynchrony in elementary cellular automata with sampling compensation*|*2013
SANTANA, PEDRO&MENDONÇA, RICARDO&Luis Miguel Parreira e Correia&BARATA, JOSÉ*|*Neural-swarm visual saliency for path following*|*2013
SANTANA, PEDRO&Luis Miguel Parreira e Correia&MENDONÇA, RICARDO&ALVES, NELSON&BARATA, JOSÉ*|*Tracking natural trails with swarm-based visual saliency*|*2013
Luiz Henrique Keng Queiroz Júnior&Ferreira, Antonio G.&Giraudeau, Patrick*|*Optimization and practical implementation of ultrafast 2D NMR experiments*|*2013
SOARES, DIEGO CARVALHO&SANTORO, FLÁVIA MARIA&Fernanda Araujo Baião Amorim*|*Discovering collaborative knowledge-intensive processes through e-mail mining*|*2013
Flavia Maria Santoro&Eduardo Costa Ramos&Fernanda Araujo Baião*|*Thinking Out of the Box: Discovering the Relevance of External Context to Business Processes*|*2013
DE OLIVEIRA, DANIEL&OCAÑA, KARY A.C.S.&OGASAWARA, EDUARDO&DIAS, JONAS&GONÇALVES, JOÃO&Fernanda Araujo Baião&Marta Lima de Queiros Mattoso*|*Performance evaluation of parallel strategies in public clouds: A study with phylogenomic workflows*|*2013
Henrik Leopold&Rami-Habib Eid-Sabbagh&Jan Mendling&Leonardo Guerreiro Azevedo&Fernanda Araujo Baião*|*Detection of naming convention violations in process models for different languages*|*2013
Tatiane Lima da Silva&Fernanda Araujo Baião Amorim&Jonice de Oliveira Sampaio&Marta Lima de Queirós Mattoso&Vanessa Braganholo Murta*|*Towards Recommendations for Horizontal XML Fragmentation*|*2013
Edurado Costa Ramos&Flávia Maria Santoro&Fernanda Araujo Baião Amorim*|*Watch Out and Improve IT: Adapting COBIT 5.0 Framework based on External Context Discovery*|*2013
Alex Alves&Anselmo Guedes&Kate Revoredo&Fernanda Araujo Baião*|*UMA METODOLOGIA PARA O APRENDIZADO DE UM MODELO CLASSIFICADOR PARA O ALINHAMENTO DE ONTOLOGIAS*|*2013
Leonardo Guerreiro Azevedo&Flávia Maria Santoro&Fernanda Araujo Baião Amorim&Thaíssa Diirr Pinto de Medeiros&Alexandre Souza&Jairo Francisco de Souza&Henrique Prado Sousa*|*A Method for Bridging the Gap between Business Process Models and Services*|*2013
Guina Guadalupe Sotomayor Alzamora&RAUPP, FERNANDA M.P.&PIZZOLATO, NELIO D.&XAVIER, ADILSON E.*|*The air transportation hub-and-spoke design problem: comparison between a continuous and a discrete solution method*|*2013
Luís Carlos Costa Fonseca&Lidinalva de Almada Coutinho&Lanylldo Araujo dos Santos*|*Ferramenta para estimar a proficiencia e individuos baseada na Teoria de Resposta ao Item*|*2013
CANUTO, ANNE M.P.&PINTRO, FERNANDO&João Carlos Xavier Júnior*|*Investigating fusion approaches in multi-biometric cancellable recognition*|*2013
Tereza Cristina Giannini&Daniel Chapman&Jacobus Biesmeijer&Antonio Mauro Saraiva&Isabel Alves dos Santos*|*Improving species distribution models using biotic interactions: a case study of parasites, pollinators and plants*|*2013
Tereza Cristina Giannini&Pinto, C. E.&Andre Luis Acosta&Mariana Taniguchi&Antonio Mauro Saraiva&Isabel Alves dos Santos*|*Interactions at large spatial scale: The case of Centris bees and floral oil producing plants in South America*|*2013
Tereza Cristina Giannini&Andre Luis Acosta&SILVA, C. I&Oliveira, P.E.A.M.&Vera Lucia Imperatriz Fonseca&Antonio Mauro Saraiva*|*Identifying the areas to preserve passion fruit pollination service in Brazilian Tropical Savannas under climate change*|*2013
