autores*|*titulo*|*ano
ALIEV, RAFIK A.&Witold Pedrycz&ALIZADEH, AKIF V.&HUSEYNOV, OLEG H.*|*Fuzzy optimality based decision making under imperfect information without utility*|*2013
Witold Pedrycz*|*Granular Computing as a Framework of System Modeling*|*2013
ZHAI, KUN&JIANG, NAN&Witold Pedrycz*|*Cost prediction method based on an improved fuzzy model*|*2013
BERETA, MICHA'&Witold Pedrycz&REFORMAT, MAREK*|*Analysis and design of rank-based classifiers*|*2013
BERETA, MICHA'&KARCZMAREK, PAWE'&Witold Pedrycz&REFORMAT, MAREK*|*Local descriptors in application to the aging problem in face recognition*|*2013
LIU, XIAODONG&FENG, XINGHUA&Witold Pedrycz*|*Extraction of fuzzy rules from fuzzy decision trees: An axiomatic fuzzy sets (AFS) approach*|*2013
OH, SUNG-KWUN&YOO, SUNG-HOON&Witold Pedrycz*|*Design of face recognition algorithm using PCA -LDA combined for hybrid data pre-processing and polynomial-based RBF neural networks : Design and its application*|*2013
Witold Pedrycz*|*Proximity-Based Clustering: A Search for Structural Consistency in Data With Semantic Blocks of Features*|*2013
IZAKIAN, HESAM&Witold Pedrycz&JAMAL, IQBAL*|*Clustering Spatiotemporal Data: An Augmented Fuzzy C-Means*|*2013
TAHAYORI, HOOMAN&SADEGHIAN, ALIREZA&Witold Pedrycz*|*Induction of Shadowed Sets Based on the Gradual Grade of Fuzziness*|*2013
MINGLI SONG&Witold Pedrycz*|*Granular Neural Networks: Concepts and Development Schemes*|*2013
Alan Robert Resende de Freitas&Alan Robert Resende de Freitas&Frederico Gadelha Guimarães&PEDROSA SILVA, RODRIGO CÉSAR&SOUZA, MARCONE JAMILSON FREITAS*|*Memetic self-adaptive evolution strategies applied to the maximum diversity problem*|*2013
LI, MIN&Frederico Gadelha Guimarães&Lowther, David A.*|*A Multiobjective Approach for Designing the Rotor of Brushless Motors*|*2013
Johnny Cardoso Marques&Sarasuaty Megume Hayashi yelisetty&Luiz Alberto Vieira Dias&Adilson Marques da Cunha*|*Airborne Software Certification Accomplishment Using Model-Driven Design*|*2013
KEANE, ANDREW&OCHOA, LUIS F.&Carmen Lucia Tancredo Borges&AULT, GRAHAM W.&ALARCON-RODRIGUEZ, ARTURO D.&CURRIE, ROBERT A. F.&PILO, FABRIZIO&DENT, CHRIS&HARRISON, GARETH P.*|*State-of-the-Art Techniques and Challenges Ahead for Distributed Generation Planning and Optimization*|*2013
Flávio Rodrigues M. Alves&T M L de Assis&R M Henriques&J. A. Passos Filho&S. Gomes Jr&Carmen Lucia Tancredo Borges&Ricardo Diniz Rangel&D. M. Falcão&Albino A. Aveleda&Glauco Nery Taranto*|*Ferramenta Integrada para Avaliacao da Seguranca Estatica e Dinamica de Sistemas Eletricos de Potencia*|*2013
Pinto, Roberto J.&Carmen Lucia Tancredo Borges&MACEIRA, MARIA E. P.*|*An Efficient Parallel Algorithm for Large Scale Hydrothermal System Operation Planning*|*2013
Danilo Artigas da Rocha&Simone Dantas&Mitre Costa Dourado&Szwarcfiter, J.L.&Seiichi Yamaguchi*|*On the contour of graphs*|*2013
Edgar Leonardo Romero&Marius Strum&Wang Jiang Chau*|*Manipulation of Training Sets for Improving Data Mining Coverage-Driven Verification*|*2013
Cláudio Leones Bazzi&Eduardo Godoy de Souza&Miguel Oribe Opazzo&Lucia Helena Pereira Nobrega&Davi Marcondes Rocha*|*MANAGEMENT ZONES DEFINITION USING SOIL CHEMICAL AND PHYSICAL ATTRIBUTES IN A SOYBEAN AREA*|*2013
Jean-Rémi Bourguet&THOMOPOULOS, RALLOU&MUGNIER, MARIE-LAURE&ABÉCASSIS, JOËL*|*An artificial intelligence-based approach to deal with argumentation applied to food quality in a public health policy*|*2013
Luis Manuel Garcés Socarrás&Santiago Sánchez-Solano&Piedad Brox Jiménez&Alejandro José Cabrera Sarmiento*|*Prototipado rapido de sistemas de procesado de video basados en el VFBC de Xilinx*|*2013
Elias Augusto Perdomo Hourné&Luis Manuel Garcés Socarrás&Alejandro José Cabrera Sarmiento*|*Diseno de bloques para el procesado de imagenes en lenguaje de descripcion de hardware*|*2013
Luis Manuel Garcés Socarrás&Santiago Sánchez-Solano&Piedad Brox Jiménez&Alejandro José Cabrera Sarmiento*|*Library for model-based design of image processing algorithms on FPGAs*|*2013
CASTANHO, IVANY ALVES&LOPES, AGNALDO JOSÉ&KOURY, JOSELY CORREA&TESSAROLLO, BERNARDO&Aristófanes Corrêa Silva&Rodolfo Acatauassú Nunes*|*Relationship between the Phase Angle and Volume of Tumours in Patients with Lung Cancer*|*2013
Daniel Rodrigues Ericeira&Aristófanes Corrêa Silva&Anselmo Cardoso de Paiva&Marcelo Gattass*|*Detection of masses based on asymmetric regions of digital bilateral mammograms using spatial description with variogram and cross-variogram functions*|*2013
Carolina Croccia&Rodolfo Acatauassú Nunes&Agnaldo Jose&#769; Lopes&Luis Felipe Ribeiro Pinto&Armando Ubirajara Oliveira Sabaa-Srur&Luiz Carlos Aguiar Vaz&Marcele Nogueira de Sousa Trotte&Bernardo Tessarollo&Aristófanes Corrêa Silva&Haroldo Jose&#769; de Matos*|*Royal Sun Medicinal Mushroom Agaricus brasiliensis (Higher Basidiomycetes) and the Attenuation of Pulmonary Inflammation Induced by 4-(Methylnitrosamino)-1-(3-Pyridyl)-1-Butanone (NNK)*|*2013
JUNIOR, GERALDO BRAZ&Simara Vieira da Rocha&Marcelo Gattass&Aristófanes Corrêa Silva&Anselmo Cardoso de Paiva*|*A Mass Classification using Spatial Diversity Approaches in Mammography Images for False Positive Reduction*|*2013
Paulo Sérgio Aguiar junior&Caio Nogueira Silva Belfort&Aristófanes Corrêa Silva&Pedro Henrique Bandeira Diniz&Rita de Cássia Fernandes de Lima&Aura Conci&Anselmo Cardoso de Paiva*|*Deteccao de regioes suspeitas de lesao na mama em imagen termicas utilizando spatiogram e redes neurais*|*2013
SLEIMAN, HASSAN A.&Rafael Corchuelo*|*A Survey on Region Extractors from Web Documents*|*2013
SLEIMAN, HASSAN A.&Rafael Corchuelo*|*TEX: An efficient and effective unsupervised Web information extractor*|*2013
RIVERO, CARLOS R.&HERNÁNDEZ, INMA&RUIZ, DAVID&Rafael Corchuelo*|*MostoDE: A tool to exchange data amongst semantic-web ontologies*|*2013
WANG, XIUMEI&LIN, YIXUN&CARVALHO, MARCELO H.&Cláudio Leonardo Lucchesi&SANJITH, G.&LITTLE, C.H.C.*|*A characterization of PM-compact bipartite and near-bipartite graphs*|*2013
MARCELO HENRIQUES DE CARVALHO&Cláudio Leonardo Lucchesi&U. S. R. Murty*|*On the Number of Perfect Matchings in a Bipartite Graph*|*2013
DA SILVA, CÂNDIDA NUNES&Pesci, Lissa&Cláudio Leonardo Lucchesi*|*Snarks and Flow-Critical Graphs*|*2013
Benjamin Aldo Toledo&Abraham Chian Long Chian&Erico Luiz Rempel&Rodrigo Andrés Miranda&Pablo R. Muñoz&Juan Alejandro Valdivia*|*Wavelet-based multifractal analysis of nonlinear time-series: The earthquake-driven tsunami of 27 February 2010 in Chile*|*2013
Erico Luiz Rempel&Abraham Chian-Long Chian&Axel Brandenburg&Pablo R. Muñoz&Shawn C. Shadden*|*Coherent structures and the saturation of a nonlinear dynamo*|*2013
Rodrigo Andrés Miranda Cerda&Erico Luiz Rempel&Abraham Chian Long Chian&Norbert Seehafer&Benjamin Aldo Toledo&Pablo R. Muñoz*|*Lagrangian coherent structures at the onset of hyperchaos in the two-dimensional Navier-Stokes equations*|*2013
Abraham Chian-Long Chian&Pablo R. Muñoz&Erico Luiz Rempel*|*Edge of chaos and genesis of turbulence*|*2013
Rodrigo Andrés Miranda Cerda&Abraham Chian Long Chian&Erico Luiz Rempel*|*Universal scaling laws for fully-developed magnetic field turbulence near and far upstream of the Earth?s bow shock*|*2013
ALVAREZ, A C&HIME, G&Julio Daniel Machado Silva&MARCHESIN, D*|*Analytic regularization of an inverse filtration problem in porous media*|*2013
Débora Souza&Rubens Matos&Jean Carlos Teixeira de Araujo&Vandi Alves&Paulo Romero Martins Maciel*|*A Tool for Automatic Dependability Test in Eucalyptus Cloud Computing Infrastructures*|*2013
CORRÊA DA SILVA, FLÁVIO SOARES&Mirtha Lina Fernández Venero&DAVID, DIEGO MIRA&SALEEM, MOHAMMAD&CHUNG, PAUL W.H.*|*Interaction protocols for cross-organisational workflows*|*2013
Clariana Fischer Brendler&Fábio Gonçalves Teixeira*|*Guidelines assisting the application of anthropometry in the custom product design development*|*2013
Fábio Gonçalves Teixeira&Sérgio Leandro dos Santos*|*Hypercal3d, uma ferramenta computacional para o apoio do processo de ensino-aprendizagem de geometria descritiva*|*2013
Francisco Gomes de Oliveira Neto&Patricia Duarte de Lima Machado*|*Selecao Automatica de Casos de Teste de Regressao Baseada em Similaridade e Valores*|*2013
Wilkerson de Lucena Andrade&Patricia Duarte de Lima Machado*|*Generating Test Cases for Real-Time Systems Based on Symbolic Models*|*2013
Roberta de Araújo Negrão&Marinez Meneghello Passos&Marilia Bazan Blanco&João Coelho Neto*|*Ensinar Ciencias Naturais nos anos iniciais da Educacao Basica: um desafio para o Pedagogo no Brasil*|*2013
Roberta de Araújo Negrão&João Coelho Neto&Marilia Bazan Blanco*|*A Formacao de Professores que Ensinam Matematica e suas Contextualizacoes: uma visao dos estudantes a luz de sua aplicacao*|*2013
César Angonese&Alcides Calsavara&Luiz Augusto Lima Jr*|*Workload Balance in Cloud-replicated Services*|*2013
Gerson Pastre de Oliveira&SANTOS, Rosana P*|*Formacao de professores de Matematica: tecnologia e o teorema de Tales*|*2013
Gerson Pastre de Oliveira&ARAUJO, Péricles B*|*A UTILIZACAO DO SOFTWARE GEOGEBRA EM UM PROCESSO DE ENSINO-APRENDIZAGEM DE LUGARES GEOMETRICOS*|*2013
Gerson Pastre de Oliveira&GONÇALVES, Mariana D.*|*Um estudo sobre a nocao de esquemas no ambito da Teoria dos Campos Conceituais*|*2013
MARIA TERESA M. RUZ MASTROIANNI&Gerson Pastre de Oliveira*|*Resolucao de problemas nas aulas de matematica dos anos iniciais do ensino fundamental: a influencia das concepcoes dos professores na pratica observada*|*2013
Mauricio Capobianco Lopes&FIALHO, F. A. P.&CUNHA, C. J. C. A.&NIVEIROS, S. I.*|*Business Games for Leadership Development: A Systematic Review*|*2013
Raimundo Nonato Macedo dos Santos&Nair Yumiko Kobashi*|*Estudos bibliometricos avancados como dispositivos de indicadores de tendencias nas atividades de ciencia e tecnologia*|*2013
MURILO ARTUR ARAÚJO DA SILVEIRA&Leilah Santiago Bufrem&Raimundo Nonato Macedo dos Santos&Fabio Mascarenhas e Silva&Márcio Henrique Wanderley Ferreira*|*Tendencias	da	Pesquisa	Brasileira	em	Ciencia	da	Informacao*|*2013
Nadi Helena Presser&Raimundo Nonato Macedo dos Santos&Bruno Machado Trajano*|*THE EFFICACY OF INFORMATION USE ON KNOWLEDGE CONSTRUCTION: a case study about the information impact*|*2013
Murilo Artur Araújo da Silveira&Leilah Santiago BUFREM&Raimundo Nonato Macedo dos Santos&Fábio Mascarenhas e Silva&Márcio Henrique Wanderley Ferreira*|*Dominios cientificos da Ciencia da Informacao representados no GT 7 do ENANCIB: analise de citacoes (2007-2012)*|*2013
R. H. Longaresi&Bruno Augusto Nassif Travençolo&DaSilva, L. C.&Pereira-da-Silva, M. A.&Carvalho, A. J. F.&Costa, L. da F.&Faria, R. M.*|*Replication of Submicrometric Organized Structures of Block Copolymer from Coordination-Polymer Templates*|*2013
Laurentino Duodecimo Rosado Fernandes&Fábio dos Santos Gonçalves&Bruno Morais Lemos&Adiel Queiroz Ricci&Carlos Eduardo Costa Vieira*|*PROPES: A Robotic Research Platform Using Android, Arduino and a Personal Computer*|*2013
Kleinner Silva Farias de Oliveira&Alessandro Garcia&Lucena, Carlos*|*Effects of stability on model composition effort: an exploratory study*|*2013
Luciana Foss&Simone André da Costa Cavalheiro&Nicolas Bisi&Pazzini, Vinicius&Lisane Brisolara de Brisolara&Flávio Rech Wagner*|*From UML to SIMULINK CAAM: Formal Specification and Transformation Analysis papers*|*2013
Simone André da Costa Cavalheiro&Luciana Foss&Cícero Augusto de S. Camargo&Gerson Geraldo Homrich Cavalheiro*|*A Graph Grammar to Transform a Dataflow Graph into a Multithread Graph and its Application in Task Scheduling*|*2013
CAMARGO, CÍCERO A. S.&CAVALHEIRO, GERSON G. H.&PILLA, MAURÍCIO L.&Simone André da Costa Cavalheiro&Foss, Luciana*|*Aproximating static list schedules in dynamic multithreaded applications*|*2013
Phillip Springer&RUBERT, JOSÉ BENAQUE&SORDI, VITOR LUIZ&FERRANTE, MAURIZIO*|*DESENVOLVIMENTO POR SIMULACAO COMPUTACIONAL E ANALISE DO DESEMPENHO REAL DE UMA MATRIZ PARA EXTRUSAO EM CANAL ANGULAR*|*2013
Gamba, Humberto R.&RAMBO, MARCOS V. H.&Gustavo Benvenutti Borba&MAIA, JOAQUIM M.&RAMOS, CARLOS A. S.*|*In vivo characterization of the electrical impedance between the electrodes of the electronic foramen locators*|*2013
Cláudio Sebastião Vasconcelos da Cunha Cavalcanti&GOMES, HERMAN MARTINS&QUEIROZ, JOSÉ EUSTÁQUIO RANGEL*|*A survey on automatic techniques for enhancement and analysis of digital photography*|*2013
Wesley Esdras Santiago&Rodolpho César dos Reis Tinini&Bárbara Janete Teruel Mederos&Rafael Augustus de Oliveira*|*PARTIAL DEHYDRATION OF 'Niagara Rosada' GRAPES (Vitis labrusca) TARGETING INCREASED CONCENTRATION OF PHENOLIC COMPOUNDS AND SOLUBLE SOLIDS*|*2013
Marcelo de Oliveira Albuquerque&Sean Wolfgand Matsui Siqueira&Maria Helena Lima Baptista Braz*|*A Conceptualization of Music Sound Recordings and Its Representation in an Ontology*|*2013
Marques, Aline M.&Krejci, Rafael&Sean Wolfgand Matsui Siqueira&Pimentel, Mariano&Braz, Maria Helena L.B.*|*Structuring the discourse on social networks for learning: Case studies on blogs and microblogs*|*2013
PRATES, JOÃO CARLOS&FRITZEN, EDUARDO&Sean Wolfgand Matsui Siqueira&Braz, Maria Helena L.B.&DE ANDRADE, LEILA C.V.*|*Contextual web searches in Facebook using learning materials and discussion messages*|*2013
Sérgio Donizetti Zorzo&PEREIRA BOTELHO, RODRIGO&MUNIZ DE ÁVILA, PAULO*|*Taxonomy for Privacy Policies of Social Networks Sites*|*2013
SALLAUME, SILAS&MARTINS, SIMONE DE LIMA&OCHI, LUIZ SATORU&Warley Gramacho da Silva&LAVOR, CARLILE&LIBERTI, LEO*|*A discrete search algorithm for finding the structure of protein backbones and side chains*|*2013
Wantiê Teles Adorno&Glêndara Aparecida de Souza Martins&Warley Gramacho da Silva*|*Modelagem Matematica Aplicada a Transferencia de Massa em Alimentos*|*2013
Luara de Jesus Almeida&Glêndara Aparecida de Souza Martins&Warley Gramacho da Silva*|*Otimizacao de processos utilizando a programacao linear*|*2013
Ciany Raquel de Jesus Reis&Maria Dilma de Lima&Sirlene Maria Dias de Oliv eira&Warley Gramacho da Silva&Ruberval Rodrigues de Sousa*|*O Uso de Novas Tecnologias como Ferramentas na Aprendizagem: Estudo de Caso em uma Escola Estadual em Palmas/Tocantins*|*2013
Luara de Jesus Almeida&Glêndara Aparecida de Souza Martins&Warley Gramacho da Silva*|*OTIMIZACAO DE PROCESSOS UTILIZANDO A PROGRAMACAO LINEAR*|*2013
MIRANDA, LORENA BRITO&LIMA, PALLOMA RODRIGUES DE&MARTINS, GLÊNDARAAPARECIDA DE SOUZA&Warley Gramacho da Silva*|*water absorption in bean seeds (Phaseolus vulgaris L.) DURING PROCESSIN*|*2013
Silvio Ferreira Gomes&Glêndara Aparecida de Souza Martins&Warley Gramacho da Silva*|*Impactos dos Sistemas Politicos na Educacao Brasileira*|*2013
Ana Paula Legey&Felipe Souza Garcia de Sá&Bruno Boechat Maciel&Taíssa da Costa Maia Bernardo&Daniel Ribeiro Chelles&Claudio Azevedo Passos&Antônio Carlos de Abreu Mol*|*Desenvolvimento de Videos Estereoscopicos 3D para o ensino na area Medica*|*2013
Ana Paula Legey&Arthur Borges&Claudio Azevedo Passos&Victor Gonçalves&Roberta Flavia R. Rolando&Antônio Carlos de Abreu Mol*|*FRAMEWORK PARA DESENVOLVIMENTO DE JOGOS COMPUTACIONAIS EDUCATIVOS*|*2013
Luis Fernando de Almeida&Henrique Rennó de Azeredo Freitas&José Walter Parquet Bizarria*|*Approximate Motion Model for Mobile Robots Localization*|*2013
Benedita Hirene de França Heringer&Luis Fernando de Almeida*|*Innovation or Death: An Organizational Reality*|*2013
Renato Moraes Silva&Tiago Agostinho de Almeida&Akebo Yamakami*|*Machine Learning Methods for Spamdexing Detection*|*2013
Thais Cristina Sampaio Machado&Plácido Rogério Pinheiro&Henrique Farias Landim*|*Applying Verbal Decision Analysis in the Selecting Practices of Framework SCRUM*|*2013
Luís Henrique Pequeno Almeida&Adriano Bessa Albuquerque&Plácido Rogério Pinheiro*|*A Multi-criteria Decision Model for Planning Inter-organizational Global Agile Software Development Projects*|*2013
Rommel Saraiva&Napoleão Vieira Nepomuceno&Plácido Rogério Pinheiro*|*The Generate-and-Solve Framework Revisited: Generating by Simulated Annealing*|*2013
Plácido Rogério Pinheiro&MACHADO, THAIS CRISTINA SAMPAIO&TAMANINI, ISABELLE*|*Dealing the Selection of Project Management through Hybrid Model of Verbal Decision Analysis*|*2013
Plácido Rogério Pinheiro&Paulo Roberto Oliveira*|*A Hybrid Approach of Bundle and Benders Applied Large Mixed Linear Integer Problem*|*2013
Plácido Rogério Pinheiro&SOBREIRA NETO, ÁLVARO MENESES&AGUIAR, ALEXEI BARBOSA*|*Handing Optimization Energy Consumption in Heterogeneous Wireless Sensor Networks*|*2013
JUNIOR, BONFIM A.&Plácido Rogério Pinheiro&SARAIVA, ROMMEL D.*|*A Hybrid Methodology for Nesting Irregular Shapes: Case Study on a Textile Industry**|*2013
JUNIOR, BONFIM A.&Plácido Rogério Pinheiro&SARAIVA, ROMMEL D.*|*A Hybrid Methodology for Tackling the Irregular Strip Packing Problem**|*2013
Sidnei Alves de Araújo&Wonder Alexandre Luz Alves&André Felipe Henriques Librantz&Peterson Adriano Belan*|*A comparative study of statistical methods for characterisation of materials surfaces by means of texture analysis*|*2013
ADRIANOBELAN, PETERSON&FELIPE H. LIBRANTZ, ANDRÉ&Sidnei Alves de Araújo*|*An Expert System for Improving Sieve Calibration Process*|*2013
FREITAS, MARKOS O.&Paul A. Wawrzynek&CAVALCANTE-NETO, JOAQUIM B.&VIDAL, CRETO A.&Luiz Fernando Campos Ramos Martha&Anthony R. Ingraffea*|*A distributed-memory parallel technique for two-dimensional mesh generation for arbitrary domains*|*2013
MIRANDA, ANTONIO C. O.&LIRA, WILLIAM W. M.&CAVALCANTE-NETO, JOAQUIM B.&SOUSA, RAFAEL A.&Luiz Fernando Campos Ramos Martha*|*A Three-Dimensional Adaptive Mesh Generation Approach Using Geometric Modeling With Multi-Regions and Parametric Surfaces*|*2013
Gustavo Borges Basilio&Lígia Maria Soto Urbina&Felipe Koeller Rodrigues Vieira&Márcio Cardoso Machado&Guilherme Conceição Rocha*|*O CURSO SUPERIOR EM CIENCIAS AERONAUTICAS COMO REQUISITO PARA OBTENCAO DE LICENCAS DE PILOTAGEM: UMA MEDIDA PROATIVA NA PREVENCAO DE ACIDENTES*|*2013
José Rodrigo Furlanetto de Azambuja&ALTIERI, MAURICIO&BECKER, JÜRGEN&Kastensmidt, Fernanda Lima*|*HETA: Hybrid Error-Detection Technique Using Assertions*|*2013
José Rodrigo Furlanetto de Azambuja&BROWN, GUSTAVO&Kastensmidt, Fernanda Lima&CARRO, LUIGI*|*Algorithm transformation methods to reduce the overhead of software-based fault tolerance techniques*|*2013
José Rodrigo Furlanetto de Azambuja&NAZAR, GABRIEL&RECH, PAOLO&CARRO, LUIGI&Kastensmidt, Fernanda Lima&FAIRBANKS, THOMAS&QUINN, HEATHER*|*Evaluating Neutron Induced SEE in SRAM-Based FPGA Protected by Hardware- and Software-Based Fault Tolerant Techniques*|*2013
CHIELLE, EDUARDO&José Rodrigo Furlanetto de Azambuja&BARTH, RAUL SERIO&ALMEIDA, FELIPE&Kastensmidt, Fernanda Lima*|*Evaluating Selective Redundancy in Data-Flow Software-Based Techniques*|*2013
Luciano Ost&Fernando Gehm Moraes&Marcelo Mandelli&Gabriel Marchesan Almeida&Leandro Heleno Möller&Leandro Soares Indrusiak&Gilles Sassatelli&Pascal Benoit&Manfred Glesner&Michel Robert*|*Power-Aware Dynamic Mapping Heuristics for NoC-Based MPSoCs Using a Unified Model-Based Approach*|*2013
Anderson Alvarenga Pereira&Alessandro Ricardo Caruso da Cunha&Gerson Fernando Mendes Pereira&Ana Roberta Pascom*|*Boletim Epidemiologico*|*2013
Edilson Ferneda&Hércules Antonio do Prado&Alexandre Gabriel Cancian Sobrinho&Remis Balaniuk*|*Mining High Performance Managers Based on the Results of Psychological Tests*|*2013
Hércules Antonio do Prado&Fábio Bianchi Campos&Edilson Ferneda&Nildo Nunes Cornelio*|*Prediction of Software Quality Based on Variables from the Development Process*|*2013
Luci Emidio&Luiza Beth Nunes Alonso&Edilson Ferneda&Helga Cristina Hedler*|*Acreditacao Hospitalar: estudo de caso no Brasil*|*2013
Hércules Antonio do Prado&Edilson Ferneda&Luis Claudio Rodrigues Morais&Alfredo José Barreto Luiz&Eduardo Matsura*|*On the Effectiveness of Candlestick Chart Analysis for the Brazilian Stock Market*|*2013
Hércules Antonio do Prado&Miguel Kojiio Nobre&Edilson Ferneda&Claudio Chauke Nehme&Helga Cristina Hedler*|*Sinergias entre gestao do conhecimento e planejamento tecnologico: um estudo de caso*|*2013
GU, YUNFENG&Boukerche, Azzedine&Robson Eduardo De Grande*|*Supporting multidimensional range queries in Hierarchically Distributed Tree*|*2013
Pablo Barros&Nestor Tavares Maciel Júnior&Juvenal Moreira Maia Bisneto&Bruno José Torres Fernandes&Byron Leite Dantas Bezerra&Sérgio Murilo Maciel Fernandes*|*An Effective Dynamic Gesture Recognition System based on the Feature Vector Reduction for SURF and LCS*|*2013
Jugurta Lisboa Filho&Lucas F. M. Vegi&Wagner Dias de Souza&João P. C. Lamas&Glauber L. S. Costa&Wellington M. Oliveira&Rafael Carrasco&Tiago Geraldo Ferreira&Joás W. Baia*|*Uma infraestrutura de dados espaciais para o projeto GeoMINAS com metadados definidos no perfil MGB da INDE*|*2013
Lucas F. M. Vegi&Jugurta Lisboa Filho&Joep Crompvoets&Liziane Santos Soares&J.L. BRAGA*|*A Dublin core application profile for documenting analysis patterns in a reuse infrastructure*|*2013
Wagner Dias de Souza&Rafaella da Silva Nogueira&Angelica A. de A. Ribeiro&Jarbas Nunes Vidal Filho&Alex da Silva Santos&Jaqueline Alvarenga Silveira&Daneiel Camilo de Oliveira Duarte&Jugurta Lisboa Filho*|*Reduzindo o esforco na preparacao de metadados: uso de software livre para documentar dados espaciais no perfil MGB*|*2013
Rodrigo de Melo Souza Veras&MEDEIROS, FÁTIMA NELSIZEUMA SOMBRA&ARAÚJO, FLÁVIO HENRIQUE DUARTE&SANTANA, ANDRÉ MACÊDO&SILVA, ROMUERE RODRIGUES VELOSO*|*Deteccao de exsudatos em imagens de retina por tecnicas de morfologia matematica e agrupamento nebuloso*|*2013
Romuere R. V. Silva&Kelson AIres&Rodrigo de Melo Souza Veras&Thiago Santos&Kalyf Lima&André Soares*|*Automatic Motorcycle Detection on Public Roads*|*2013
Carlos Alberto Henggeler de Carvalho Antunes&DIAS, LUIS CÂNDIDO*|*Uncertainty and robustness in planning and decision-making*|*2013
MATIAS, TIAGO&SOUZA, FRANCISCO&ARAÚJO, RUI&Carlos Alberto Henggeler de Carvalho Antunes*|*Learning of a single-hidden layer feedforward neural network using an optimized extreme learning machine*|*2013
SAFAEI, AMIR&FREIRE, FAUSTO&Carlos Alberto Henggeler de Carvalho Antunes*|*A model for optimal energy planning of a commercial building integrating solar and cogeneration systems*|*2013
SOARES, SYMONE&Carlos Alberto Henggeler de Carvalho Antunes&ARAÚJO, RUI*|*Comparison of a genetic algorithm and simulated annealing for automatic neural network ensemble development*|*2013
TROVAO, JOAO PEDRO F.&SANTOS, VICTOR D. N.&PEREIRINHA, PAULO G.&JORGE, HUMBERTO M.&Carlos Alberto Henggeler de Carvalho Antunes*|*A Simulated Annealing Approach for Optimal Power Source Management in a Small EV*|*2013
OLIVEIRA, C.&COELHO, D.&PEREIRA DA SILVA, P.&Carlos Alberto Henggeler de Carvalho Antunes*|*How many jobs can the RES-E sectors generate in the Portuguese context?*|*2013
TROVÃO, JOÃO P.&PEREIRINHA, PAULO G.&JORGE, HUMBERTO M.&Carlos Alberto Henggeler de Carvalho Antunes*|*A multi-level energy management system for multi-source electric vehicles - An integrated rule-based meta-heuristic approach*|*2013
GOMES, A.&Carlos Alberto Henggeler de Carvalho Antunes&MARTINHO, J.*|*A physically-based model for simulating inverter type air conditioners/heat pumps*|*2013
OLIVEIRA, EUNICE&Carlos Alberto Henggeler de Carvalho Antunes&GOMES, ÁLVARO*|*A comparative study of different approaches using an outranking relation in a multi-objective evolutionary algorithm*|*2013
ALVES, MARIA JOÃO&Carlos Alberto Henggeler de Carvalho Antunes&ÍNSUA, DAVID RIOS*|*Editorial*|*2013
Delfín Sánchez Sánchez&Odalys Ynerarity Castro*|*La interaccion y la interactividad, procesos esenciales en un espacio didactico virtual en la universidad actual*|*2013
Odalys Ynerarity Castro&Delfín Sánchez Sánchez*|*EL ENFOQUE HUMANISTA EN LA ENSENANZA DE LA MATEMATICA EN LA EDUCACION ESPECIAL*|*2013
José Eduardo Cogo Castanho&Rogério Thomazella&Cezar José Sant' Anna&Joaquim Brighenti Neto&JULIANO NICOLIELO TORRES*|*Acompanhamento de falhas em turbinas hidraulicas utilizando diagnostico por imagens usando robo*|*2013
Marcel Kenji de Carli Silva&Levent Tunçel*|*Optimization Problems over Unit-Distance Representations of Graphs*|*2013
André Carlos Silva&Elenice Maria Schons Silva&Luciano Nunes Capponi&Danielle Flavia de Gouvea*|*Determination of apparent apatite grade by digital image analysis*|*2013
André Carlos Silva&Elenice Maria Schons Silva&Ricardo Antonio de Rezende*|*CALCULO ITERATIVO DA CARGA CIRCULANTE EM CIRCUITOS FECHADOS*|*2013
André Carlos Silva&SCHONS SILVA, ELENICE MARIA&DE REZENDE, RICARDO ANTONIO*|*Circulating load calculation in mineral processing closed circuit operations*|*2013
André Carlos Silva&SCHONS SILVA, ELENICE MARIA&VIEIRA MATOS, JAINER DIOGO*|*Hydrocyclones simulation using a new modification in Plitt's equation*|*2013
Douglas Eduardo Valente Pires&Raquel Cardoso de Melo-Minardi&Carlos Henrique da Silveira&Frederico Ferreira Campos, filho&Wagner Meira Júnior*|*aCSM: Noise-free graph-based signatures to large-scale receptor-based ligand prediction*|*2013
Douglas Eduardo Valente Pires&David B Ascher&Tom Leon Blundell*|*mCSM: predicting the effects of mutations in proteins using graph-based signatures*|*2013
Paulo Eduardo Papotti&Antonio Francisco do Prado*|*Reengenharia e Reutilizacao de Software*|*2013
VIANA, MATHEUS C.&PENTEADO, ROSÂNGELA A.D.&Antonio Francisco do Prado*|*Domain-Specific Modeling Languages to improve framework instantiation*|*2013
Marcos Forte&DE SOUZA, WANDERLEY L.&DA SILVA, ROSELI F.&Antonio Francisco do Prado&RODRIGUES, JOSE F.*|*A Ubiquitous Reflective E-Portfolio Architecture*|*2013
João Luís Cardoso de Moraes&Wanderley Lopes de Souza&Luciana Tricai Cavalini&Luís Ferreira Pires&Antonio Francisco do Prado*|*An Approach for Message Exchange Using Archetypes*|*2013
