autores*|*titulo*|*ano
Edirlei Everson Soares de Lima&FEIJÓ, BRUNO&BARBOSA, SIMONE D.J.&FURTADO, ANTONIO L.&CIARLINI, ANGELO E.M.&POZZER, CESAR T.*|*Draw your own story: Paper and pencil interactive storytelling*|*2013
Pasqueline Dantas Scaico&Anderson Alves de Lima&Yugo Mangueira de Alencar&Jefferson Barbosa Belo da Silva&Ewerton Henning Souto Raposo&Alexandre Scaico*|*Ensino de Programacao no Ensino Medio: Uma Abordagem Orientada ao Design com a linguagem Scratch*|*2013
Adão Caron Cambraia&Pasqueline Dantas Scaico*|*Os Desafios da Educacao em Computacao no Brasil: um Relato de Experiencias com Projetos PIBID no Sul e Nordeste do pais*|*2013
RIBEIRO, CAMILA&Marcos Luiz Mucheroni*|*Dynamic Indexation in Video Metadata*|*2013
Hae Yong Kim&Maruta, Ricardo Hitoshi&Huanca, Danilo Roque&Walter Jaimes Salcedo*|*Correlation-based multi-shape granulometry with application in porous silicon nanomaterial characterization*|*2013
Gerson de Souza Faria&Hae Yong Kim*|*Identification of Pressed Keys From Mechanical Vibrations*|*2013
SANTOS, ANDRÉA CYNTHIA&LIMA, DIEGO ROCHA&Dario José Aloise*|*Modeling and solving the bi-objective minimum diameter-cost spanning tree problem*|*2013
Vinícius Maran&Deise de Brum Saccol&Giovani Rubert Librelotto&Iara Augustin*|*Uma definicao ontologica de elementos de contexto relevantes na adaptacao de documentos em ambientes hospitalares pervasivos*|*2013
Leandro Ferreira Paz&Vinícius Maran&Alencar Machado&Juliano Gomes Weber*|*MOBIDOCTOR: UMA APLICACAO MOVEL PARA ACESSO AO REGISTRO ELETRONICO DE SAUDE DE PACIENTES*|*2013
Maria Cristina Vidigal de Lima&Vanessa Cristina de Castilho&Francisco Romero Gesualdo*|*Vigotas trelicadas protendidas: analise experimental e estudo de escoramento*|*2013
Lorayne Cristina da Silva Alves&Vanessa Cristina de Castilho&Rodrigo reis de Rezende Costa&Maria Cristina Vidigal de Lima*|*Analise nao-linear de vigotas trelicadas e vigotas trelicadas protendidas para a fase de montagem*|*2013
Eduardo Filgueiras Damasceno&Mauricio Filgueiras Damasceno&Edgard Afonso Lamounier Jr*|*Analise de Desempenho De Sistemas de Geracao de Coordenadas Homogeneas em Realidade Aumentada*|*2013
Eduardo Filgueiras Damasceno&Tatiane Valau Pereira*|*Experimentacao Pedagogica de Laboratorios Virtuais para Ensino de Manutencao de Microcomputadores*|*2013
Eduardo Filgueiras Damasceno&Alexandre Cardoso&Edgard Afonso Lamounier Jr*|*Uma Tecnica de Avaliacao da Amplitude Articular por Captura de Movimento em Realidade Aumentada*|*2013
Eduardo Filgueiras Damasceno&Tatiane Valau Pereira&Luciana Alves de Lima*|*Ferramenta de Disponibilizacao de Conteudos Digitais Falados para Ensino Especial Voltado aos Deficientes Visuais*|*2013
Eduardo Filgueiras Damasceno&Daniela Cabral de Oliveira*|*Um Ambiente Virtual para Ensino de Instalacao e Manutencao de Microcomputadores*|*2013
Fernando Teubl Ferreira&Celso Kurashima&Marcio Cabral&Marcelo Zuffo*|*Analysis of a Scalable Multi-Projector System for Virtual Reality Environments*|*2013
Pablo Vinicius Alves de Barros&Nestor T. Maciel Júnior&Juvenal M. M. Bisneto&Bruno Fernandes&Byron L. D. Bezerra&Sérgio M. M. Fernandes*|*An Effective Dynamic Gesture Recognition System Based on the Feature Vector Reduction for SURF and LCS*|*2013
Ivan Bosnic&Mehran Misaghi*|*Desenvolvimento lean de software: estudo de caso em uma empresa de*|*2013
Queli Schmitz&Mehran Misaghi&Marcelo Macedo*|*Ferramenta Workflow para apoio ao processo de criacao de Conhecimento: um estudo de casos multiplos*|*2013
Cintia Ghisi&Alcir Trainotti&Mehran Misaghi*|*O estudo das leis Infometricas aplicados em um modelo de conversao do conhecimento*|*2013
MÁRIO TRAINOTTI, ALCIR&Mehran Misaghi&GHISI TRAINOTTI, CINTIA*|*Um modelo de gestao do conhecimento como proposta para um repositorio eletronico de dados*|*2013
Lúcio Fernandes Dutra Santos&Willian Dener de Oliveira&Mônica Ribeiro Porto Ferreira&Robson Leonardo Ferreira Cordeiro&Agma Juci Machado Traina&Caetano Traina Junior*|*Evaluating the Diversification of Similarity Query Results*|*2013
CASTILHOS JUNIOR, ARMANDO BORGES DE&RAMOS, NAIARA FRANCISCA&ALVES, CLARISSA MARTINS&FORCELLINI, FERNANDO ANTÔNIO&Odacir Deonisio Graciolli*|*Catadores de materiais reciclaveis: analise das condicoes de trabalho e infraestrutura operacional no Sul, Sudeste e Nordeste do Brasil*|*2013
Naiara Francisca Ramos&armando BORGES DE CASTILHOS junior&Fernando Antônio Forcellini&Odacir Deonisio Graciolli*|*Profile Survey of Waste Pickers in Brazil: Requirements for the Development of a Collection Vehicle and Optimized Routing.*|*2013
TOLEDO, B. A.&CHIAN, A. C.-L.&REMPEL, E. L.&MIRANDA, R. A.&Pablo Rubén Muñoz Gutberlet&VALDIVIA, J. A.*|*Wavelet-based multifractal analysis of nonlinear time series: The earthquake-driven tsunami of 27 February 2010 in Chile*|*2013
Chian, Abraham C.-L.&Pablo Rubén Muñoz Gutberlet&REMPEL, ERICO L.*|*Edge of chaos and genesis of turbulence*|*2013
REMPEL, ERICO L.&Chian, Abraham C.-L.&BRANDENBURG, AXEL&Pablo Rubén Muñoz Gutberlet&SHADDEN, SHAWN C.*|*Coherent structures and the saturation of a nonlinear dynamo*|*2013
Miranda, Rodrigo A.&REMPEL, ERICO L.&Chian, Abraham C.-L.&SEEHAFER, NORBERT&TOLEDO, BENJAMIN A.&Pablo Rubén Muñoz Gutberlet*|*Lagrangian coherent structures at the onset of hyperchaos in the two-dimensional Navier-Stokes equations*|*2013
Souza, Jefferson Rodrigues&Fernando Santos Osório&Gustavo Pessin&Patrick Shinzato&Denis Fernando Wolf*|*Vision-based waypoint following using templates and artificial neural networks*|*2013
Gustavo Pessin&SALES, DANIEL O.&DIAS, MAURÍCIO A.&KLASER, RAFAEL L.&Denis Fernando Wolf&Ueyama, Jó&Fernando Santos Osório&VARGAS, PATRÍCIA A.*|*Swarm intelligence and the quest to solve a garbage and recycling collection problem*|*2013
Gustavo Pessin&Fernando Santos Osório&Souza, Jefferson Rodrigues&Ueyama, Jó&COSTA, FAUSTO G.&Denis Fernando Wolf&DIMITROVA, DESISLAVA&Torsten Braun&VARGAS, PATRÍCIA A.*|*INVESTIGATION ON THE EVOLUTION OF AN INDOOR ROBOTIC LOCALIZATION SYSTEM BASED ON WIRELESS NETWORKS*|*2013
Nelson Francisco Favilla Ebecken&Nelson Francisco Favilla Ebecken&Graziella Martins Caputo*|*Concept Map Construction from E-Commerce Web Pages*|*2013
Daniel Henricus de Knegt Dutra Nicácio&BALDASSIN, ALEXANDRO&ARAÚJO, GUIDO*|*Transaction Scheduling Using Dynamic Conflict Avoidance*|*2013
MOURA, DANIEL C.&Miguel Angel Guevara López*|*An evaluation of image descriptors combined with clinical data for breast cancer diagnosis*|*2013
Miguel Angel Guevara López&POSADA, N.G.&GADELHA, J.R.&Fernando Morgado*|*Deformable models as a tool for biometric and histopathological applications*|*2013
Miguel Angel Guevara López&POSADA, N.G.&GADELHA, J.R.&Fernando Morgado*|*A novel formed classifier for analyzing cellular contents in cells images*|*2013
Sonia Alves&Nuno Lavado&L Mesquita&Miguel Angel Guevara López*|*A MULT IFACTORIAL INTEGRATIVE MODEL TO PREDICT EXTERNAL APICAL ROOT RESORPTION ASSOCIATED WITH ORTHODONTIC TREATMENT*|*2013
PEREIRA, SONIA&LAVADO, NUNO&NOGUEIRA, LUÍS&Miguel Angel Guevara López&ABREU, JOÃO&SILVA, HENRIQUETA*|*Polymorphisms of genes encoding P2X7R, IL-1B, OPG and RANK in orthodontic-induced apical root resorption*|*2013
Bruno Batagin&Alexandre Jorge Duarte de Souza&Cristiane Inácio de Campos&Danielle Goveia*|*Levantamento para implantacao de um sistema de gestao da qualidade segundo a norma NBR ISO/IEC 17025:2005 no laboratorio de celulose e papel da Unesp-Itapeva*|*2013
Nardin, Luis G.&Anarosa Alves Franco Brandão&KIRA, ELISABETI&Jaime Simão Sichman*|*Effects of reputation communication expressiveness in virtual societies*|*2013
Geison Jader Mello&Sérgio Wagner Gripp da Silveira&Raphael de Souza Rosa Gomes&Carlo Ralph De Musis&Marcelo Sacardi Biudes&Sergio Roberto de Paulo*|*ANALISE SAZONAL DA COMPLEXIDADE DO SALDO DE RADIACAO NO PANTANAL*|*2013
Geison Jader Mello&Iramaia Jorge Cabral de Paulo&Sergio Roberto de Paulo&Raphael de Souza Rosa Gomes&Nadja G. Machado&José de souza nogueira&Marcelo Sacardi Biudes*|*DIMENSAO FRACTAL DE SERIES TEMPORAIS EM DOSSEL DE FLORESTA NO PANTANAL MATO-GROSSENSE*|*2013
Geison Jader Mello&Iramaia Jorge Cabral de Paulo&Sergio Roberto de Paulo&Raphael de Souza Rosa Gomes&Nadja G. Machado&José de souza nogueira&Marcelo Sacardi Biudes*|*VARIABILIDADE SAZONAL E INTERANUAL DA DIMENSAO FRACTAL DE SERIES DE TEMPERATURA E UMIDADE RELATIVA DA AMAZONIA E PANTANAL*|*2013
Alberto Costa Neto&Rodrigo Bonifácio&Márcio Medeiros Ribeiro&Carlos Eduardo Pontual&Paulo Borba&Fernando Castor*|*A Design Rule Language for Aspect-Oriented Programming*|*2013
Silvana&Claudia Robbi Sluter*|*Estudo sobre um algoritmo para a construcao de mapas de pontos de contagem*|*2013
Andrea Faria Andrade&Claudia Robbi Sluter*|*As pesquisas sobre as proposicoes e avaliacoes da simbologia usada em mapas turisticos*|*2013
Claudia Robbi Sluter*|*Territorio*|*2013
Ádamo Lima de Santana&Maria Emília Tostes&Carlos Renato Lisboa Francês*|*A New Methodology for Grouping Electric Power Consuming Units to Meet Continuity Indicators Targets Established by the Brazilian Regulatory Agency*|*2013
Jasmine Araújo&Josiane Rodrigues&Simone Fraiha&Hermínio S. Gomes&João Crisóstomo Weyl Albuquerque Costa&Gervásio Protásio dos Santos Cavalcante&Carlos Renato Lisboa Francês*|*New Strategies for Planning and Performance Evaluation of Wireless Networks: Case Studies Based on the Cross-layer Approach*|*2013
José Jailton Junior&Tássio Costa de Carvalho&Kelvin Lopes Dias&Carlos Renato Lisboa Francês*|*A quality of experience handover architecture for heterogeneous mobile wireless multimedia networks*|*2013
BRITO, SILVANA ROSSY&SILVA, ALEKSANDRA DO SOCORRO&MARTINS, DALTON LOPES&Nandamudi Lankalapalli Vijaykumar&ROCHA, CLÁUDIO ALEX JORGE&João Crisóstomo Weyl Albuquerque Costa&Carlos Renato Lisboa Francês*|*Employing online social networks to monitor and evaluate training of digital inclusion agents*|*2013
Maria do Carmo Nicolleti&Oscar Hipólito&Maria da Graça Brasil Rocha*|*Alguns aspectos da formacao graduada em computacao no Brasil.*|*2013
Bruno Astuto Arouche Nunes&OBRACZKA, KATIA*|*A framework for modeling spatial node density in waypoint-based mobility*|*2013
DE OLIVEIRA BALDUINO, JEFFERSON&Mauro Nacif Rocha*|*Simulacao de uma rede de sensor sem fio com base nos padroes zigbee e ieee 802.11ah*|*2013
Tatiane Carolyne Carneiro&Camilo Allyson Simões de Farias*|*Otimizacao estocastica implicita e redes neurais artificiais para auxilio na operacao mensal dos reservatorios Coremas - Mae D?agua*|*2013
Camilo Allyson Simões de Farias&SANTOS, CELSO&LOURENÇO, ARTUR&CARNEIRO, TATIANE*|*KOHONEN NEURAL NETWORKS FOR RAINFALL-RUNOFF MODELING: CASE OF PIANCO RIVER BASIN*|*2013
Rafaela Alves Pereira&Camilo Allyson Simões de Farias&Emanuel Tarcísio do Rêgo Farias&Talita Dantas Pedrosa&Alan Del Carlos Chaves*|*A compostagem como alternativa para a problematica dos residuos agroindustriais no Sertao Paraibano*|*2013
Rafaela Alves Pereira&Camilo Allyson Simões de Farias&Talita Dantas Pedrosa&Emanuel Tarcísio do Rêgo Farias*|*Maturacao de compostos organicos de residuos agroindustriais*|*2013
Luara Lourenço Ismael&Rafaela Alves Pereira&Camilo Allyson Simões de Farias&Emanuel Tarcísio do Rêgo Farias*|*Avaliacao de composteiras para reciclagem de residuos organicos em pequena escala*|*2013
Talita Dantas Pedrosa&Camilo Allyson Simões de Farias&Rafaela Alves Pereira&Emanuel Tarcísio do Rêgo Farias*|*Monitoramento dos parametros fisico-quimicos na compostagem de residuos agroindustriais*|*2013
Alexandre Linhares&Chada, Daniel M.*|*What is the nature of the mind's pattern-recognition process?*|*2013
Alexandre Linhares*|*The emergence of choice: Decision-making and strategic thinking through analogies*|*2013
Fernanda da Conceição Zanin&Joana Alice Ribeiro de Freitas&Luis Allan Künzle&Raimundo Alberto Tostes*|*REUNI no Campus de Palotina da UFPR: Trabalho Docente e Acao Sindical*|*2013
Luis Fabricio Wanderley Goes&RIBEIRO, CHRISTIANE POUSA&CASTRO, MÁRCIO&MÉHAUT, JEAN-FRANÇOIS&COLE, MURRAY&CINTRA, MARCELO*|*Automatic Skeleton-Driven Memory Affinity for Transactional Worklist Applications*|*2013
Paula Miranda&Pedro Isaias&Carlos Costa&Sara Pifano*|*WEB 2.0 Technologies Supporting Students and Scholars in Higher Education*|*2013
Stefani, Aurélia&GURGEL, HELEN&LIMA, ANA CRISTINA&MORENO, EDUARDO S&MUSSET, LISE&NACHER, MATHIEU&SOARES, ALANA CS&Carme, Bernard&Emmanuel Roux&DUSFOUR, ISABELLE&CORRÊA, ANA PAULA&CRUZ, MANOEL CB&DESSAY, NADINE&GALARDO, ALLAN KR&GALARDO, CLÍCIA D&GIROD, ROMAIN&GOMES, MARGARETE SM*|*Land cover, land use and malaria in the Amazon: a systematic literature review of studies using remotely sensed data*|*2013
Emmanuel Roux&GABORIT, PASCAL&ROMAÑA, CHRISTINE A&GIROD, ROMAIN&DESSAY, NADINE&DUSFOUR, ISABELLE*|*Objective sampling design in a highly heterogeneous landscape - characterizing environmental determinants of malaria vector distribution in French Guiana, in the Amazonian region*|*2013
Maira Beatriz Hernández Moran&Annabell Del Real Tamariz*|*Na palma da mao uma proposta baseada em Localizacao para acesso rapido a atendimento em casos de emergencias medicas - DOI: 10.3395/reciis.v7i2.774pt*|*2013
Annabell Del Real Tamariz&ELIAS DA SILVA JUSTO, JOSE*|*Management of Services in Computer Networks with the help of an Intelligent Agent*|*2013
Álvaro Gonçalves de Barros&Annabell Del Real Tamariz*|*Ambiente Virtual de Aprendizagem como apoio ao ensino presencial: uma analise para a adocao como ferramenta pedagogica na construcao da autonomia no processo de ensino e aprendizagem*|*2013
GUIMARÃES, RACHEL P.&D'ABREU, ANELYSSA&YASUDA, CLARISSA L.&FRANÇA, MARCONDES C.&SILVA, BEATRIZ H. B.&Fábio Augusto Menocci Cappabianco&BERGO, FELIPE P.G.&LOPES-CENDES, ISCIA T.&CENDES, FERNANDO*|*A multimodal evaluation of microstructural white matter damage in spinocerebellar ataxia type 3*|*2013
Marcelo Rafael Borth&Henrique Shishido*|*A Comparative Analysis of Two Software Development Methodologies: Rational Unified Process and Extreme Programming*|*2013
BELLO CRUZ, J. Y.&Welington Luis de Oliveira*|*Level bundle-like algorithms for convex optimization*|*2013
Welington Luis de Oliveira&SAGASTIZÁBAL, C.*|*Level bundle methods for oracles with on-demand accuracy*|*2013
DE FIGUEIREDO, JOSÉ EDUARDO MENDES&Vera Maria Benjamim Werneck&DA COSTA, ROSA MARIA E. M.*|*Simulando a dinamica populacional de uma colmeia para o ensino de Biologia*|*2013
José Eduardo M. Figueiredo&Vera Maria Benjamim Werneck&Rosa Maria Esteves Moreira da Costa*|*A 3-D Serious Game to Simulate a Living of a Beehive*|*2013
Patrick Letouze&Mariwaldo G.Caetano&João Y.Ishihara&David Nadler Prata&George Brito*|*Evolving Interdisciplinary Research with Model-View-Controller Evolutionary Acquisition Interdisciplinary Research Project Management*|*2013
Michel Silva&Daniele Trevisan&David Nadler Prata&Elineide Marques&MARCELO LISBOA&Monica Prata*|*Exploring an Ichthyoplankton Database from a Freshwater Reservoir in Legal Amazon*|*2013
Patrick Letouze Moreira&Mariwaldo Gomes Caetano&João Ishihara&David Prata&Geroge Brito*|*Evolving Interdisciplinary Research with Model-View-Controller Evolutionary Acquisition Interdisciplinary Research Project Management*|*2013
CLIMACO, GLAUBOS&CHAGAS, FERNANDO&SILVA, VALÉRIA M.&BARBOSA, GENTIL V.&Patrick Letouzé Moreira*|*A Web System for Farming Management*|*2013
Eduardo Soares Ogasawara&Daniel Cardoso Moraes de Oliveira&Fábio Paschoal Jr&Rafael Castaneda&Myrna Amorim&Renato Campos Mauro&Jorge Soares&João Roberto Quadros&Eduardo Bezerra da Silva*|*A Forecasting Method for Fertilizers Consumption in Brazil*|*2013
Victor Ströele de Andrade Menezes&Geraldo Zimbrão da Silva&Jano Moreira de Souza*|*Group and Link Analysis of Multi-Relational Scientific Social Networks*|*2013
Italo Valença Mariotti Tasso&BUSCAGLIA, GUSTAVO C.*|*A finite element method for viscous membranes*|*2013
CAVALCANTE, Y.L.&HAUSER-DAVIS, R.A.&SARAIVA, A.C.F.&BRANDÃO, I.L.S.&OLIVEIRA, T.F.&Antonio Morais da Silveira*|*Metal and physico-chemical variations at a hydroelectric reservoir analyzed by Multivariate Analyses and Artificial Neural Networks: Environmental management and policy/decision-making tools*|*2013
Thaise da Silva noronha&Terezinha Ferreira de Oliveira&Antonio Morais da Silveira&Roger Ribeiro da Silva&Augusto Cezar Fonseca Saraiva*|*Knowledge acquisition of vibrations in high-power transformers using statistical analyses and fuzzy approaches - A case study*|*2013
MARQUES, JOAO TRINDADE&WANG, JI-PING&WANG, XIAOHONG&DE OLIVEIRA, KARLA POLLYANNA VIEIRA&GAO, CATHERINE&Eric Roberto Guimarães Rocha Aguiar&JAFARI, NADEREH&CARTHEW, RICHARD W.*|*Functional Specialization of the Small Interfering RNA Pathway in Response to Virus Infection*|*2013
Mariella Berger&Avelino Forechi&Alberto Ferreira De Souza&Jorcy de Oliveira Neto&Lucas de Paula Veronese&Victor Neves&Edilson de Aguiar&Claudine Badue*|*Traffic Sign Recognition with WiSARD and VG-RAM Weightless Neural Networks*|*2013
Rafaela Ponte Lisboa&Maria Elizabeth Sucupira Furtado&Hermínio Borges Neto*|*'Processo de planejamento para producao, execucao e avaliacao de conteudos crossmidiaticos, educativos e televisivos*|*2013
Raquel Oliveira Prates&Tuomo Kujala&Simone Diniz Junqueira Barbosa&milene s. da silveira&Clarisse Sieckenius de Souza&cecilia baranauskas&cristiano Maciel&Maria Elizabeth Sucupira Furtado&junia anacleto&paulo melo*|*HCI community in Brazil---sweet 16!*|*2013
Breno Bernard Nicolau de França&Guilherme Horta Travassos*|*Are We Prepared for Simulation Based Studies in Software Engineering Yet?*|*2013
Paulo Sergio M dos Santos&Guilherme Horta Travassos*|*On the Representation and Aggregation of Evidence in Software Engineering: A Theory and Belief-based Perspective*|*2013
José Fortuna Abrantes&Guilherme Horta Travassos*|*Towards Pertinent Characteristics of Agility and Agile Practices for Software Processes*|*2013
Francisco J. Pino&Mario Piattini&Guilherme Horta Travassos*|*Managing and developing distributed research projects in software engineering by means of action-research*|*2013
Verônica Taquette Vaz&Tayana Uchôa Conte&Guilherme Horta Travassos*|*Empirical Assessments of a tool to support Web usability inspection*|*2013
Ivo José Garcia dos Santos&Marcel Tilly&Badrish Chandramouli&Jonathan Goldstein*|*DiAl: distributed streaming analytics anywhere, anytime*|*2013
Benjamín René Callejas Bedregal&Regivan Hugo Nunes Santiago*|*Interval Representations, Lukasiewicz Implicators and Smets-Magrez Axioms.*|*2013
Renata Hax Sander Reiser&Benjamín René Callejas Bedregal&Regivan Hugo Nunes Santiago&Marília Dias Amaral*|*Canonical representation of the Yagers classes of fuzzy implications*|*2013
Benjamín René Callejas Bedregal&Regivan Hugo Nunes Santiago*|*Some continuity notions for interval functions and representation*|*2013
Fagner Lemos de Santana&Regivan Hugo Nunes Santiago*|*Interval metrics, topology and continuous functions*|*2013
Valença, George&Carina Alves&Vander Ramos Alves&Niu, Nan*|*A Systematic Mapping Study on Business Process Variability*|*2013
Willian Marinho Dourado Coelho&Jancarlo Ferreira Gomes&Alessandro Francisco Talamini do Amarante&Kátia Denise Saraiva Bresciani&Sumie Hoshino-Shimizu&Alexandre Xavier Falcão*|*A new laboratorial method for the diagnosis of gastrointestinal parasites in dogs*|*2013
Papa, João P.&NAKAMURA, RODRIGO Y.M.&de Albuquerque, Victor Hugo C.&Alexandre Xavier Falcão&Tavares, João Manuel R.S.*|*Computer techniques towards the automatic characterization of graphite particles in metallographic images of industrial materials*|*2013
CIESIELSKI, KRZYSZTOF CHRIS&MIRANDA, PAULO A.V.&Alexandre Xavier Falcão&UDUPA, JAYARAM K.*|*Joint graph cut and relative fuzzy connectedness image segmentation algorithm*|*2013
Ivan Mingireanov Filho&VALLIN SPINA, THIAGO&Alexandre Xavier Falcão&CAMPANE VIDAL, ALEXANDRE*|*Segmentation of sandstone thin section images with separation of touching grains using optimum path forest operators*|*2013
DOS SANTOS, NULL&GOSSELIN, PHILIPPE-HENRI&PHILIPP-FOLIGUET, SYLVIE&TORRES, RICARDO DA S.&Alexandre Xavier Falcão*|*Interactive Multiscale Classification of High-Resolution Remote Sensing Images*|*2013
Suzuki, C. T. N.&Jancarlo Ferreira Gomes&Alexandre Xavier Falcão&Papa, J. P.&Sumie Hoshino-Shimizu*|*Automatic Segmentation and Classification of Human Intestinal Parasites From Microscopy Images*|*2013
Djamel Fawzi Hadj Sadok&Luciana Oliveira&Glauco Estácio Gonçalves&Judith Kelner&Rosa, Nelson&Souto, Eduardo*|*Aspects for untangling cross-layer design and policy support*|*2013
SERQUEIRA, ELIAS OLIVEIRA&Rodrigo Ferreira de Morais&DANTAS, NOELIO OLIVEIRA*|*Controlling the spectroscopic parameters of Er3+-doped sodium silicate glass by tuning the Er2O3 and Na2O concentrations*|*2013
SERQUEIRA, ELIAS OLIVEIRA&Rodrigo Ferreira de Morais&ANJOS, VIRGÍLIO&VALENZUELA BELL, MARIA JOSE&DANTAS, NOELIO OLIVEIRA*|*Effect of Na2O concentration on the lifetime of Er3+-doped sodium silicate glass*|*2013
Rodrigo Ferreira de Morais&SERQUEIRA, ELIAS OLIVEIRA&DANTAS, NOELIO OLIVEIRA*|*Effect of thermal annealing on the spectroscopic parameters of Er3+-doped sodium silicate glass*|*2013
Rodrigo Ferreira de Morais&SERQUEIRA, ELIAS OLIVEIRA&DANTAS, NOELIO OLIVEIRA*|*Effects of OH radicals and the silicon network on the lifetime of Eu^3+-doped sodium silicate glasses*|*2013
Josiane Michalak Hauagge Dall Agnol&Cesar Augusto Tacla*|*A Method for Collaborative Argumentation in Merging Individual Ontologies*|*2013
SILVA, CAMILA S.&MONTEIRO, THAÍS H.&SIMÕES-AMBRÓSIO, LÍVIA M.C.&Daniele Yumi Sunaga de Oliveira&CARDOSO, JOÃO F.R.&FURTADO, KELLY S.&ONG, THOMAS P.&MORENO, FERNANDO S.&ZUCOLOTO, SÉRGIO&VANNUCCHI, HELIO*|*Effects of a-Tocopherol Supplementation on Liver of Rats Chronically Exposed to Ethanol*|*2013
YEH, ERIKA&FANGANIELLO, ROBERTO D.&Daniele Yumi Sunaga de Oliveira&ZHOU, XUEYAN&HOLMES, GREGORY&ROCHA, KATIA M.&ALONSO, NIVALDO&MATUSHITA, HAMILTON&WANG, YINGLI&JABS, ETHYLIN W.&Passos-Bueno, Maria Rita*|*Novel Molecular Pathways Elicited by Mutant FGFR2 May Account for Brain Abnormalities in Apert Syndrome*|*2013
GRIESI-OLIVEIRA, KARINA&Daniele Yumi Sunaga de Oliveira&ALVIZI, LUCAS&VADASZ, ESTEVÃO&Passos-Bueno, Maria Rita*|*Stem Cells as a Good Tool to Investigate Dysregulated Biological Systems in Autism Spectrum Disorders*|*2013
Kobayashi, Gerson Shigeru&ALVIZI, LUCAS&Daniele Yumi Sunaga de Oliveira&FRANCIS-WEST, PHILIPPA&KUTA, ANNA&ALMADA, BRUNO VINÍCIUS PIMENTA&FERREIRA, SIMONE GOMES&DE ANDRADE-LIMA, LEONARDO CARMO&Bueno, Daniela Franco&RAPOSO-AMARAL, CÁSSIO EDUARDO&MENCK, CARLOS FREDERICO&Passos-Bueno, Maria Rita*|*Susceptibility to DNA Damage as a Molecular Mechanism for Non-Syndromic Cleft Lip and Palate*|*2013
Daniel Welfer&Scharcanski, Jacob&Marinho, Diane Ruschel*|*A morphologic two-stage approach for automated optic disk detection in color eye fundus images*|*2013
Sérgio Bortolin Júnior&Daniel Welfer*|*Automatic Detection of Microaneurysms and Hemorrhages in Color Eye Fundus Images*|*2013
Carlos Eduardo Rodrigues Alves&Edson Norberto Cáceres&CASTRO, A. A.&Siang Wun Song&Siang Wun Song&J. L. Szwarcfiter*|*Parallel transitive closure algorithm*|*2013
Carlos E R Alves&Edson Norberto Cáceres&SIANG WUN SONG*|*Finding All Maximal Contiguous Subsequences of a Sequence of Numbers in O(1) Communication Rounds*|*2013
Monick Trajano dos Santos&Renato Fernandes Corrêa&Murilo Artur Araújo da Silveira*|*Estudos brasileiros sobre ontologia na Ciencia da Informacao*|*2013
Renato Fernandes Corrêa&Jéssica Monique de Lira Vieira*|*Representacoes visuais para recuperacao de informacao na BDTD-UFPE*|*2013
Sanderson Lopes Dorneles&Renato Fernandes Corrêa*|*Gestao de documentos digitais em aplicacoes de Certificacao digital*|*2013
Renato Fernandes Corrêa&Remi Correia Lapa*|*Panorama de estudos sobre Indexacao Automatica no ambito da Ciencia da Informacao no Brasil (1973-2012)*|*2013
Caroline Rizzi Raymundo&Patricia Dockhorn Costa*|*CraftContext: A Test Platform for Context-Aware Applications*|*2013
Eduardo Bezerra&Denivaldo Cicero Pavão Lopes&Zair Abdelouahab*|*Dynamic Web Service Composition with MDE Approaches and Ontologies*|*2013
Carlos Mendes&Zair Abdelouahab&Denivaldo Cicero Pavão Lopes*|*An Approach based on Z Language for Formalization of Model Transformation Definition*|*2013
Amélia Acácia de Miranda Batista&Zair Abdelouahab&Denivaldo Cicero Pavão Lopes&Pedro de Alcantara dos Santos Neto*|*A Process Model for Supporting the Management of Distance Learning Courses through an Agile Approach*|*2013
Wagner Costa&Denivaldo Cicero Pavão Lopes&Zair Abdelouahab*|*Network Intrusion Detection System based on SOA (NIDS-SOA): enhancing interoperability between IDS*|*2013
Raimundo Pereira da Cunha Neto&Zair Abdelouahab&Denivaldo Cicero Pavão Lopes*|*Intrusion Detection System for Botnet Attacks in Wireless Networks Using Hybrid Detection Method Based on DNS*|*2013
Nguessan Desire&Marcelo Alves Franco&Dorlivete Moreira Shitsuka&Ricardo Shitsuka*|*Desenvolvimento de Agente Movel baseado em Java e MuCode para Ambiente Distribuido Movel (B5 nas areas de Engenharia e B2 em Ensino)*|*2013
MARCELO ALVES FRANCO&Nguessan Desire&Dorlivete Moreira Shitsuka&Ricardo Shitsuka*|*Desenvolvimento de Agente Movel baseado em Java e MuCode para Ambiente Distribuido Movel (Qualis B2 em Ensino)*|*2013
Ana Cristina Souza da Silva&Carlos de Oliveira Galvão&Gerald Norbert Souza da Silva&Fancisco de Assis SouZa Filho*|*Ostrom s institutional design principles and reservoir management: a study on adaptation to climate variability and change*|*2013
Celso Alberto Saibel Santos&Carlos A. G. Ferraz&Alexandre Rafael Lenz&Jancleidsson Soares da Silva*|*Desenvolvimento de Aplicacoes Sensiveis ao Contexto da Programacao diante das Nao Conformidades dos Sinais das TV Brasileiras*|*2013
